"event_id","event_name","event_created","event_time","event_venue_lat","event_venue_lon","venue_name","venue_city"
"12037839","Fifth Saturday Contra Dance",1260217528000,1264901400000,32.836202,-96.757667,"First United Lutheran Church","Dallas"
"dnqwnynkbwb","Third Saturday Contra Dance Featuring a Band from Arizona - Traditional Blend",1277328322000,1.279413e+12,32.836202,-96.757667,"First United Lutheran Church","Dallas"
"12037814","Third Saturday Contra Dance",1260217359000,1263691800000,32.836202,-96.757667,"First United Lutheran Church","Dallas"
"qkjzscyqhbgb","Friday Lunch Bunch - Arlington/Mansfield",1335637278000,1336150800000,32.677165,-97.042181,"China Dragon Chinese Buffet","Grand Prairie"
"qljzscyqhbgb","Friday Lunch Bunch - Arlington/Mansfield",1334508494000,1336150800000,32.677165,-97.042181,"China Dragon Chinese Buffet","Grand Prairie"
"26990321","SAKM Night at the Ballpark in Arlington",1311626976000,1314219600000,32.751012,-97.082056,"Texas Rangers Ballpark","Arlington"
"63438642","SAKM Night at The Ballpark in Arlington",1336156222000,1339711200000,32.751012,-97.082056,"Texas Rangers Ballpark","Arlington"
"11451238","Texas Freethought Convention!!",1253751051000,1258221600000,29.60891,-98.500801,"Alzafar Shrine Temple","San Antonio"
"11047049","Texas Freethought Convention - 2009",1249525122000,1258221600000,29.60891,-98.500801,"Alzafar Shrine Temple","San Antonio"
"44210012","Marilyn Myers Dance Connections - Holiday Ball",1323711824000,1.32417e+12,32.865617,-96.786655,"Temple Emanu-El","Dallas"
"12205282","Another February Game at Barb's!",1262534273000,1267057800000,32.582157,-97.157478,"Barb's place","Mansfield"
"13543013","It's Miller Time - let's play cards at Barb's house",1274370405000,1276990200000,32.582157,-97.157478,"Barb's place","Mansfield"
"12522083","March game at Barb's",1265325190000,1267921800000,32.582157,-97.157478,"Barb's place","Mansfield"
"12240333","Saturday Night Special w/Liz Ashley",1262794283000,1263686400000,32.883942,-96.895203,"Studios of Walnut Ridge","Dallas"
"11550036","Photo Share and Critique Night!",1254731186000,1.256256e+12,32.883942,-96.895203,"Studios of Walnut Ridge","Dallas"
"12693529","Easter Photo Scene Pictures",1267005396000,1269993600000,32.883942,-96.895203,"Studios of Walnut Ridge","Dallas"
"12693521","Photo Share and Critique Night!",1267004958000,1269388800000,32.883942,-96.895203,"Studios of Walnut Ridge","Dallas"
"15862110","GPS/Photo Historical Safari!",1293744530000,1295715600000,32.883942,-96.895203,"Studios of Walnut Ridge","Dallas"
"13453370","Adobe CS5 Suite Giveaway Event",1273612860000,1274918400000,32.883942,-96.895203,"Studios of Walnut Ridge","Dallas"
"12131602","Blonde, Brunette, AND Redhead Photoshoot!",1261497420000,1263061800000,32.883942,-96.895203,"Studios of Walnut Ridge","Dallas"
"13327290","What's New in Lightroom 3?",1272519124000,1273276800000,32.883942,-96.895203,"Studios of Walnut Ridge","Dallas"
"10497826","Ride to PK to say hello",1243372372000,1243698300000,32.758853,-97.182555,"shell gas station","fort worth "
"18853431","Fondue & Brew @Melting Pot (Arlington)",1305740523000,1311289200000,32.680544,-97.106648,"Melting Pot of Arlington","Arlington"
"32537802","Fondue & Brew @Melting Pot (Arlington)",1315360211000,1318546800000,32.680544,-97.106648,"Melting Pot of Arlington","Arlington"
"73162292","$8 Cheese & Chocolate Fondues @Melting Pot (Arlington)",1342155108000,1344553200000,32.680544,-97.106648,"Melting Pot of Arlington","Arlington"
"70061942","$8 Cheese & Chocolate Fondues @Melting Pot (Arlington)",1340241487000,1.342134e+12,32.680544,-97.106648,"Melting Pot of Arlington","Arlington"
"17122453","Lets Do Fondue! $7 @Melting Pot (Arlington)",1301528072000,1305241200000,32.680544,-97.106648,"Melting Pot of Arlington","Arlington"
"32538122","Fondue & Brew @Melting Pot (Arlington)",1315360370000,1320969600000,32.680544,-97.106648,"Melting Pot of Arlington","Arlington"
"32538162","Dawn' Birthday Fondue Celebration @Melting Pot (Arlington)",1315360403000,1323388800000,32.680544,-97.106648,"Melting Pot of Arlington","Arlington"
"93562072","$8 Fondue Night - Resolve to Eat More Chocolate! @Melting Pot (Arlington)",1354325236000,1357862400000,32.680544,-97.106648,"Melting Pot of Arlington","Arlington"
"46787432","$8 Fondue @Melting Pot  (Arlington)",1325779855000,1331251200000,32.680544,-97.106648,"Melting Pot of Arlington","Arlington"
"82520472","$8 Cheese & Chocolate Fondues @Melting Pot (Arlington)",1347721905000,1349996400000,32.680544,-97.106648,"Melting Pot of Arlington","Arlington"
"16173694","Rescheduled: Fondue Happy Hour @Melting Pot",1295922506000,1299801600000,32.680544,-97.106648,"Melting Pot of Arlington","Arlington"
"46785892","Pre-Valentines Fondue & Brew @Melting Pot (Arlington)",1325779103000,1.328832e+12,32.680544,-97.106648,"Melting Pot of Arlington","Arlington"
"55610032","$8 Fondue @Melting Pot (Arlington)",1331263079000,1334271600000,32.680544,-97.106648,"Melting Pot of Arlington","Arlington"
"77214002","$8 Cheese & Chocolate Fondues @Melting Pot (Arlington)",1344629325000,1347577200000,32.680544,-97.106648,"Melting Pot of Arlington","Arlington"
"14004916","Evolution Tango",1278339545000,1.286586e+12,32.787907,-96.789747,"Latino Cultural Center","Dallas"
"11494904","Diwali Festival (Indian Festival of Lights) @ new Cowboy Stadium",1254195151000,1254691800000,32.749462,-97.096891,"Dallas Cowboys Stadium","Arlington"
"23426301","Yoga and Fitness Hiking - White Rock Lake",1308956626000,1309613400000,32.840773,-96.714217,"Bath House Cultural Center ","Dallas"
"10126915","Monthly Meet & Greet & Eat",1239035534000,1.255653e+12,32.836546,-97.140371,"Twin Peaks","Bedford"
"10613576","Can You Handle Twice As Much Fun?",1244571027000,1247185800000,32.836546,-97.140371,"Twin Peaks","Bedford"
"11776639","Monthly Meet & Greet & Eat",1257209372000,1.257471e+12,32.836546,-97.140371,"Twin Peaks","Bedford"
"47174532","Eat at Twin Peaks",1326027851000,1328230800000,32.836546,-97.140371,"Twin Peaks","Bedford"
"11296573","Second Saturday Contra Dance in Irving",1252163467000,1.260666e+12,32.802136,-96.945103,"Irving Senter East","Irving"
"12276751","Second Saturday Contra Dance in Irving",1263140735000,1273363200000,32.802136,-96.945103,"Irving Senter East","Irving"
"12276694","Second Saturday Contra Dance in Irving",1263140254000,1268528400000,32.802136,-96.945103,"Irving Senter East","Irving"
"11757238","Eat some Crawfish Etoufee at  We B Divin - Saturday,  November 14",1257019965000,1258214400000,32.843446,-97.200885,"We B Divin","North Richland Hills"
"84677882","VIETNAMESE CUISINE @ THANH THANH RESTAURANT",1348937823000,1349029800000,32.706009,-97.049286,"Thanh Thanh Restaurant","Arlington"
"13363637","Where's the beef?  Thanh Thanh in Arlington, TX",1272857293000,1274486400000,32.706009,-97.049286,"Thanh Thanh Restaurant","Arlington"
"10697631","Wanna Dive in a Nuclear Missile Silo?  Join us in diving Valhalla!  ",1245538985000,1249732800000,32.452751,-99.799675,"Valhalla Missile Silo","Abilene"
"12317566","1st Tuesday Happy Hour at Beto's (GP)",1263474068000,1265155200000,32.67724,-97.04001,"Beto Mexican Restaurant ","Grand Prairie"
"17512088","May DFWWP: WordPress 101: Back to Basics",1304356404000,1306011600000,32.870892,-96.767967,"The Art Institute of Dallas","Dallas"
"12029296","Jan. DFWWP: John P: Make More Money with WordPress, Social Media and Analytics",1260118810000,1264888800000,32.870892,-96.767967,"The Art Institute of Dallas","Dallas"
"12631954","April DFWWP: Planning for Success: Design Like a Pro",1266447806000,1272142800000,32.870892,-96.767967,"The Art Institute of Dallas","Dallas"
"11850062","Feb. DFWWP: Jeff Haynie: Create Mobile Apps with Titanium",1257951792000,1266703200000,32.870892,-96.767967,"The Art Institute of Dallas","Dallas"
"11238302","Sept. DFWWP:DB Ferguson, How to build your Nation: Growing your online community",1251651866000,1253998800000,32.870892,-96.767967,"The Art Institute of Dallas","Dallas"
"26769601","September DFWWP: Randy Hoyt: Advanced WordPress Features & Customizations",1311439504000,1.316898e+12,32.870892,-96.767967,"The Art Institute of Dallas","Dallas"
"10967889","August Dallas/Fort Worth WordPress Meetup - ""BarCamp"" Style",1248710454000,1251579600000,32.870892,-96.767967,"The Art Institute of Dallas","Dallas"
"13372223","July DFWWP: Special Guest, Cali Lewis: Extending WordPress Functionality",1272921336000,1280005200000,32.870892,-96.767967,"The Art Institute of Dallas","Dallas"
"16713864","March DFWWP:Christopher Gronlund, The Benefits of Sequential Content",1298741785000,1301173200000,32.870892,-96.767967,"The Art Institute of Dallas","Dallas"
"19404161","July DFWWP: WordPress 102: Beyond the Basics",1306171150000,1311454800000,32.870892,-96.767967,"The Art Institute of Dallas","Dallas"
"13008343","May DFWWP: WordPress 101: Themes, User Experience, PodCasting & Clinic",1269710622000,1.274562e+12,32.870892,-96.767967,"The Art Institute of Dallas","Dallas"
"12622562","March DFWWP: BuddyPress: Social Networking in Box by Michael J. Pratt",1266363557000,1269723600000,32.870892,-96.767967,"The Art Institute of Dallas","Dallas"
"15464145","Feb. DFWWP:Special Guest, Stephanie Leary, WordPress Tips & Tricks",1289918012000,1298757600000,32.870892,-96.767967,"The Art Institute of Dallas","Dallas"
"13300550","June DFWWP: Working With Pages in WordPress",1272328677000,1.277586e+12,32.870892,-96.767967,"The Art Institute of Dallas","Dallas"
"13372238","Sept DFWWP:WordPress Hosting - From Commodity Offerings to ""Digg Proof"" Configs",1272921372000,1285448400000,32.870892,-96.767967,"The Art Institute of Dallas","Dallas"
"10733731","TEXAS LUAU - JULY 4th CELEBRATION!!",1245943752000,1.246734e+12,32.9,-96.56,"Backyard of Home ","Rowlett"
"12696182","Sterling Society's Mardi Gras Ball",1267034757000,1267322400000,32.945142,-96.840051,"Crowne Plaza near the Galleria","Addison"
"16525522","Sterling Society Mardi Gras Charity Ball",1297394857000,1298167200000,32.945142,-96.840051,"Crowne Plaza near the Galleria","Addison"
"10836358","CEO Space Dallas Meetup w Guest Speaker Scott Degraffenreid",1247110526000,1247614200000,32.945142,-96.840051,"Crowne Plaza near the Galleria","Addison"
"10768632","Tim's Graduation Celebration",1246368685000,1246579200000,32.736239,-97.436176,"Spencers Corner Bar and Grill","Fort Worth"
"12228111","Meeting with 9-12 Group...  A Growth Opportunity",1262705100000,1.263258e+12,32.742092,-97.291167,"Painless Performance Products","Fort Worth"
"16348429","Papaya Garden-Thai",1296249295000,1.298745e+12,32.837302,-97.101037,"Papaya Garden","Euless"
"17324645","First Tuesday Free Nacho Bar Happy Hour @Chuy's (Arlington)",1302955282000,1304463600000,32.633076,-97.152092,"Chuy's","Arlington"
"12601304","Chuy's Chuy's Chuy's!",1266158723000,1267142400000,32.633076,-97.152092,"Chuy's","Arlington"
"15702695","First Tuesday Happy Hour @Chuy's (Arlington)",1292038036000,1294185600000,32.633076,-97.152092,"Chuy's","Arlington"
"32548192","Free Nacho Happy Hour @Chuys (Arlington)",1315365448000,1317769200000,32.633076,-97.152092,"Chuy's","Arlington"
"15436953","First Tuesday Happy Hour at Chuy's (Arlington)",1289678620000,1291766400000,32.633076,-97.152092,"Chuy's","Arlington"
"72071242","1st Tuesday Happy Hour @Chuys (Arlington)",1341509227000,1344380400000,32.633076,-97.152092,"Chuy's","Arlington"
"80908772","Happy Hour @Chuys (Arlington)",1346819343000,1349218800000,32.633076,-97.152092,"Chuy's","Arlington"
"41431002","Dawn's Birthday Happy Hour @Chuys (Arlington)",1321478736000,1.323216e+12,32.633076,-97.152092,"Chuy's","Arlington"
"12750668","Around Arlington's 3rd Birthday Party at Chuy's (Arlington)",1267492381000,1270594800000,32.633076,-97.152092,"Chuy's","Arlington"
"47286262","1st Tuesday Free Nacho Happy Hour @Chuys (Arlington)",1326084376000,1328659200000,32.633076,-97.152092,"Chuy's","Arlington"
"22832121","1st Tuesday Happy Hour and Free Nacho Bar @Chuy's (Arlington)",1308581014000,1309905900000,32.633076,-97.152092,"Chuy's","Arlington"
"85238492","Politically Incorrect Happy Hour @Chuys (Arlington)",1349232642000,1352246400000,32.633076,-97.152092,"Chuy's","Arlington"
"13186089","First Tuesday Happy Hour at Chuy's (Arlington)",1271289385000,1.273014e+12,32.633076,-97.152092,"Chuy's","Arlington"
"59324972","1st Tuesday Happy Hour @Chuys (Arlington)",1333593105000,1335913200000,32.633076,-97.152092,"Chuy's","Arlington"
"27588561","Hair of the Dog That Bit Ya Happy Hour @Chuys (Arlington)",1312031554000,1.31535e+12,32.633076,-97.152092,"Chuy's","Arlington"
"43601382","Free Nacho Happy Hour @Chuys (Arlington)",1323200774000,1325635200000,32.633076,-97.152092,"Chuy's","Arlington"
"55558112","AAs 5th Bday: 1st Tuesday Happy Hour @Chuys (Arlington)",1331242316000,1.333494e+12,32.633076,-97.152092,"Chuy's","Arlington"
"14746095","First Tuesday Happy Hour at Chuy's (Arlington)",1284333132000,1286319600000,32.633076,-97.152092,"Chuy's","Arlington"
"qkjzscyqgbbc","Friday Lunch Bunch - Arlington/Mansfield",1334427510000,1334941200000,32.68074,-97.11113,"Piranha Killer Sushi","Arlington"
"qljzscyqgbbc","Friday Lunch Bunch - Arlington/Mansfield",1334427509000,1334941200000,32.68074,-97.11113,"Piranha Killer Sushi","Arlington"
"10848737","STUDIO PARTY ",1247260026000,1248568200000,32.948063,-96.717745,"PJ's Dancetique","Richardson"
"14832480"," Rockett Ride!",1284999975000,1285513200000,32.675409,-97.091859,"QT","Arlington"
"10840148","Robert's Rooster Ride!",1247163973000,1247997600000,32.675409,-97.091859,"QT","Arlington"
"34831642","Multi Meetup Groups: Let's Party at 8o's in Ft Worth/ Professor D",1316911201000,1.318644e+12,32.755337,-97.33117,"Eight O","Fort Worth"
"34868732","Multi Group Event: Let's Dance at 8o's w/ Professor D!!!!!",1316955035000,1.318644e+12,32.755337,-97.33117,"Eight O","Fort Worth"
"34831292","Multiple Groups Meetup Event: Let’s dance at 8o’s w/ Professor D",1316910801000,1.318644e+12,32.755337,-97.33117,"Eight O","Fort Worth"
"26838431","Multiple Groups Meetup Event: Let’s dance at 8o’s in Sundance Square",1311518708000,1312077600000,32.755337,-97.33117,"Eight O","Fort Worth"
"27376181","Multi Meetup Groups: Let's Party at 8o's in Ft Worth",1311873160000,1312077600000,32.755337,-97.33117,"Eight O","Fort Worth"
"26785011","Multiple Groups Meetup Event: Let’s dance at 8o’s w/ Blue Finger Disco",1311450667000,1312077600000,32.755337,-97.33117,"Eight O","Fort Worth"
"17150114","Atlas Shrugged: Part I... At Harkins Southlake Town Center!!! April 15, 8:00 PM",1301707162000,1.302912e+12,32.945114,-97.129071,"Harkins Southlake Town Center 14","Southlake"
"10904818","Anybody want to ride tonigjht",1247943387000,1247961600000,32.795726,-96.995059,"Race Track","Grand Prairie"
"11222267","Pizza night at Stroker's ",1251434146000,1252022400000,32.795726,-96.995059,"Race Track","Grand Prairie"
"11571783","Thursday Night (Stroker's Pizza)",1254930585000,1255046400000,32.795726,-96.995059,"Race Track","Grand Prairie"
"10995878","Bikes night out ",1248985044000,1249084800000,32.795726,-96.995059,"Race Track","Grand Prairie"
"13504206","Tuesday Night Ride - Let's go to Venus",1274065528000,1274227200000,32.795726,-96.995059,"Race Track","Grand Prairie"
"11212169","Free Pizza night at Strokers",1251340271000,1251417600000,32.795726,-96.995059,"Race Track","Grand Prairie"
"10926068","let's get the weekend started ",1248206669000,1.24848e+12,32.795726,-96.995059,"Race Track","Grand Prairie"
"12347553","DRNT night out and Dinner",1263777786000,1263949200000,32.795726,-96.995059,"Race Track","Grand Prairie"
"12710390","Kidder's BD Ride!!! - Hope it's not secret because it's not anymore!!!",1267140452000,1267887600000,32.795726,-96.995059,"Race Track","Grand Prairie"
"11163682","LESSONS FROM WALKING ON FIRE",1250830289000,1.251567e+12,33.101887,-96.892227,"Lightworkers Sanctuary ","The Colony"
"11046278","BEING UNSTOPPABLE: The firewalk event",1249519996000,1253390400000,33.101887,-96.892227,"Lightworkers Sanctuary ","The Colony"
"11094556","Toni Moltzan - Channel",1250088341000,1.251558e+12,33.101887,-96.892227,"Lightworkers Sanctuary ","The Colony"
"11168952","Lessons from Walking on Fire",1250899711000,1.251567e+12,33.101887,-96.892227,"Lightworkers Sanctuary ","The Colony"
"11102806","Toni  Moltzan - Channel",1250170524000,1.251558e+12,33.101887,-96.892227,"Lightworkers Sanctuary ","The Colony"
"12151966","Pick up game Wednesday at Dave's House",1261919926000,1262219400000,32.687435,-97.184418,"Dave's Place","Arlington"
"14582787","Pick Up game at Dave's Place",1283116066000,1.283643e+12,32.687435,-97.184418,"Dave's Place","Arlington"
"11630632","November's game is at Dave's house!!!",1255572595000,1257640200000,32.687435,-97.184418,"Dave's Place","Arlington"
"13647676","Progressive Double Two Step - Free Lessons - Electric Cowboy",1275328869000,1276129800000,33.031095,-96.994561,"Electric Cowboy","Lewisville"
"13647709","Waltz - Free Lessons - Electric Cowboy",1275329071000,1275697800000,33.031095,-96.994561,"Electric Cowboy","Lewisville"
"13647720","2 Step Houston Style  - Free Lessons - Electric Cowboy",1275329162000,1276907400000,33.031095,-96.994561,"Electric Cowboy","Lewisville"
"13835473","Two Step Series - Free Lessons - Electric Cowboy",1276819404000,1280363400000,33.031095,-96.994561,"Electric Cowboy","Lewisville"
"14211286","East Coast Swing Series/Electric Cowboy",1280106893000,1280968200000,33.031095,-96.994561,"Electric Cowboy","Lewisville"
"13221502","Electric Cowboy - Three Step Texas Two Step",1271650477000,1274486400000,33.031095,-96.994561,"Electric Cowboy","Lewisville"
"13647729","Three Step -Texas 2 Step  - Free Lessons - Electric Cowboy",1275329210000,1277512200000,33.031095,-96.994561,"Electric Cowboy","Lewisville"
"13221468","Electric Cowboy - Waltz",1271650239000,1273710600000,33.031095,-96.994561,"Electric Cowboy","Lewisville"
"14281430","Swing/Push Lessons Electric Cowboy Lewisville",1280685246000,1.282518e+12,33.031095,-96.994561,"Electric Cowboy","Lewisville"
"13835453","Two Step Series - Free Lessons - Electric Cowboy",1276819274000,1.278549e+12,33.031095,-96.994561,"Electric Cowboy","Lewisville"
"13647700","Progressive Double Two Step - Free Lessons - Electric Cowboy",1275328978000,1277944200000,33.031095,-96.994561,"Electric Cowboy","Lewisville"
"14933205","Electric Cowboy Lewisville - Two Step Houston Style",1285726163000,1285979400000,33.031095,-96.994561,"Electric Cowboy","Lewisville"
"13835460","Two Step Series - Free Lessons - Electric Cowboy",1276819322000,1.279152e+12,33.031095,-96.994561,"Electric Cowboy","Lewisville"
"14211355","Two Step Electric Cowboy",1280107334000,1281745800000,33.031095,-96.994561,"Electric Cowboy","Lewisville"
"13221472","Electric Cowboy - Waltz",1271650273000,1274315400000,33.031095,-96.994561,"Electric Cowboy","Lewisville"
"14211391","Three Step (Texas Two Step)  Electric Cowboy",1280107584000,1282955400000,33.031095,-96.994561,"Electric Cowboy","Lewisville"
"13835500","Waltz - Free Lessons - Electric Cowboy",1276819744000,1280534400000,33.031095,-96.994561,"Electric Cowboy","Lewisville"
"14558537","Electric Cowboy Lewisville Three Step (Texas Two Step)",1282880080000,1284769800000,33.031095,-96.994561,"Electric Cowboy","Lewisville"
"13835480","Waltz - Free Lessons - Electric Cowboy",1276819476000,1278115200000,33.031095,-96.994561,"Electric Cowboy","Lewisville"
"fzctpynpbfb","Electric Cowboy Lewisville Two Step Series",1288567124000,1288830600000,33.031095,-96.994561,"Electric Cowboy","Lewisville"
"14933290","Electric Cowboy Lewisville - Progressive",1285726552000,1287016200000,33.031095,-96.994561,"Electric Cowboy","Lewisville"
"13835486","Progressive -  Free Lessons - Electric Cowboy",1276819559000,1.27872e+12,33.031095,-96.994561,"Electric Cowboy","Lewisville"
"13835497","Three Step - Texas Two Step - Free Lessons - Electric Cowboy",1276819694000,1279931400000,33.031095,-96.994561,"Electric Cowboy","Lewisville"
"14558473","Electric Cowboy Lewisville Waltz Series",1282879704000,1.284597e+12,33.031095,-96.994561,"Electric Cowboy","Lewisville"
"14211302","East Coast Swing Series / Electric Cowboy",1280106989000,1.281573e+12,33.031095,-96.994561,"Electric Cowboy","Lewisville"
"13835468","Two Step Series - Free Lessons - Electric Cowboy",1276819366000,1279758600000,33.031095,-96.994561,"Electric Cowboy","Lewisville"
"13221475","Electric Cowboy - Waltz",1271650301000,1274920200000,33.031095,-96.994561,"Electric Cowboy","Lewisville"
"13647683","Progressive Double Two Step - Free Lessons - Electric Cowboy",1275328902000,1276732800000,33.031095,-96.994561,"Electric Cowboy","Lewisville"
"13221506","Electric Cowboy - East Coast Swing",1271650521000,1.275093e+12,33.031095,-96.994561,"Electric Cowboy","Lewisville"
"14211346","Progressive Lessons Electric Cowboy",1280107298000,1.281141e+12,33.031095,-96.994561,"Electric Cowboy","Lewisville"
"11012455","Weekend Ride  ",1249183029000,1.24974e+12,32.617993,-96.824418,"Cracker Barrel","Desoto"
"31072281","Guest Speaker Event: Albert Meyer, forensic accountant and investor",1314389369000,1315668600000,33.026955,-96.796211,"La Madeleine","Plano"
"28059291","Annual Fort Worth Margarita Charity Ball is November 12, 2011",1312341247000,1321149600000,32.749945,-97.328081,"Fort Worth Convention Center","Fort Worth"
"75486272","Volunteer at Grapefest in Grapevine!",1343626226000,1347631200000,32.929449,-97.078364,"Downtown Grapevine Grapefest","Grapevine"
"80318832","Grapefest in Grapevine",1346459148000,1347753600000,32.929449,-97.078364,"Downtown Grapevine Grapefest","Grapevine"
"97049762","Hike Eagle Mountain Park",1356871060000,1362841200000,32.935446,-97.48015,"Eagle Mountain Park","Fort Worth"
"55881342","Eagle Mountain Park Walk/Run 8 Miles",1331477207000,1337428800000,32.935446,-97.48015,"Eagle Mountain Park","Fort Worth"
"11174593","Tarrant County and Dallas County MARCHING IN UNISON in Forth Worth Parade!!!",1250978218000,1252767600000,32.752044,-97.329509,"Downtown Fort Worth","Fort Worth"
"13118276","Afghan Grill - Colorful and Cozy",1270678984000,1.271466e+12,32.989725,-96.801453,"Afghan Grill","Dallas"
"14256220","Basic Sailing Lessons",1280437119000,1281193200000,32.89314,-97.48718,"Fort Worth Boat Club","Fort Worth"
"16236001","Basic Sailing Lessons",1276900323000,1300546800000,32.89314,-97.48718,"Fort Worth Boat Club","Fort Worth"
"12567957","Basic Sailing Lessons",1265774950000,1.269702e+12,32.89314,-97.48718,"Fort Worth Boat Club","Fort Worth"
"12236040","SALSA WORKSHOPS!!! ",1262747750000,1264294800000,32.851893,-97.115912,"My Salsa Dance & Fitness Studio","Bedford"
"crczpypcbtb","Ultimate Zumba Party",1291487295000,1295107200000,32.851893,-97.115912,"My Salsa Dance & Fitness Studio","Bedford"
"lwrmnynhbhb","Free Basic Salsa Lesson! 1 1/2 hour Class!!",1272130335000,1273105800000,32.851893,-97.115912,"My Salsa Dance & Fitness Studio","Bedford"
"13499909","Dancing At My Salsa Dance Studio!",1274034301000,1276912800000,32.851893,-97.115912,"My Salsa Dance & Fitness Studio","Bedford"
"12862383","BACHATA WORKSHOP!!  Round 2",1268434055000,1271548800000,32.851893,-97.115912,"My Salsa Dance & Fitness Studio","Bedford"
"crczpypcbdc","Ultimate Zumba Party",1291487295000,1.295712e+12,32.851893,-97.115912,"My Salsa Dance & Fitness Studio","Bedford"
"lwrmnynjbdb","Free Basic Salsa Lesson! 1 1/2 hour Class!!",1273175782000,1.275525e+12,32.851893,-97.115912,"My Salsa Dance & Fitness Studio","Bedford"
"hdvqnynjbzb","TOGA PARTY!  At My Salsa Dance Studio!",1274139054000,1276912800000,32.851893,-97.115912,"My Salsa Dance & Fitness Studio","Bedford"
"12115418","FREE BASIC SALSA LESSON!!",1261241492000,1262566800000,32.851893,-97.115912,"My Salsa Dance & Fitness Studio","Bedford"
"45950902","Buddy's Big Band",1325251541000,1325901600000,32.727384,-97.333286,"Southside Preservation Hall","Fort Worth"
"73083352","Rocky Horror Picture Show!",1342121464000,1343446200000,32.81199,-96.752407,"The Historic Lakewood Theater","Dallas"
"ggbbpynnbhb","The Dallas-Plano Atheists Meetup - Holy Grail Pub",1278952056000,1286323200000,33.090263,-96.804848,"The Holy Grail Pub","Plano"
"13557799","HTML5 2/?: Websockets & Geolocation (This one's gonna be good =)",1274488686000,1280965500000,32.976856,-96.827011,"Improving Enterprises","Addison"
"46062752","An Evening with Ken Schwaber",1325341039000,1326846600000,32.976856,-96.827011,"Improving Enterprises","Addison"
"15085662","DFW Scrum | An Evening with Ron Jeffries and Chet Hendrickson",1286905938000,1.289349e+12,32.896414,-96.976075,"Fellowship Technologies","Irving"
"ldjmqypgbcc","Karaoke at Bonnie and Clyde's Hideout in the DFW Lakes Hilton, Grapevine",1297812855000,1303437600000,32.920531,-97.121468,"Hilton DFW Lakes Executive Conference Center","Grapevine"
"gmjkqypgbfb","Karaoke at Bonnie and Clyde's Hideout in the DFW Lakes Hilton, Grapevine",1296607626000,1301882400000,32.920531,-97.121468,"Hilton DFW Lakes Executive Conference Center","Grapevine"
"ldjmqyqjbcc","Karaoke at Bonnie and Clyde's Hideout in the DFW Lakes Hilton, Grapevine",1339816201000,1340330400000,32.920531,-97.121468,"Hilton DFW Lakes Executive Conference Center","Grapevine"
"11239421","The Art of Persuasive Language with CEO Space Marketing VP Steve Decker",1251659985000,1252972800000,32.920531,-97.121468,"Hilton DFW Lakes Executive Conference Center","Grapevine"
"14192882","Ethiopian Night!",1279911645000,1281742200000,32.949287,-96.73728,"Addis Ababa","Richardson"
"12358756","Volunteer: No-Sew Fleece Blanket Day (Give a Day/ Get a Free Disney Day) ",1263871881000,1.266696e+12,32.737907,-97.0174,"Grand Prairie Main Library","Grand Prairie"
"14221578","Celebrate Summer with Sake and Social Media! ",1280184911000,1281481200000,32.83042,-96.770188,"The Blue Fish","Dallas"
"49793472","Mozart's ""The Magic Flute"" @ Cowboys Stadium",1327621265000,1335657600000,33.129093,-96.768665,"Dallas Cowboys Stadium","Arlington"
