"event_id","event_name","event_venue_lat","event_venue_lon","venue_name","venue_city"
"qhnndfyrdbkc","Meet for Stroller Strides Class-your first class is always free~",32.62467,-116.997483,"Heritage Park","Chula Vista"
"dgnndfyrfbcb","Meet for Stroller Strides Class-your first class is always free~",32.62467,-116.997483,"Heritage Park","Chula Vista"
"qzlfxdyqqbjc","Night-Time Run",32.62467,-116.997483,"Heritage Park","Chula Vista"
"qgnndfyrdbhc","Meet for Stroller Strides Class-your first class is always free~",32.62467,-116.997483,"Heritage Park","Chula Vista"
"qzlfxdyrdbkc","Night-Time Run",32.62467,-116.997483,"Heritage Park","Chula Vista"
"96855822","Wine, Women, Hormones",32.636761,-117.017632,"Pacific Southwest Association of Realtors","Chula Vista 91910"
"97312362","The Project for Universalization of Man",32.609428,-117.068916,"SALON OF EVENTS","Chula Vista"
"104445762","Live Gipsey Music with Los Reyes del Ritmo",32.663803,-116.971565,"Villa Capri Cucina Italiana (Casa Bella Ristorante)","Chula Vista"
"100784032","La Rumorosa Path….The Haunted Highway….",32.628395,-117.040146,"Starbuck's ","Chula Vista"
"101290532","Roadrunner Archery at US Team Olympic Archery Range",32.629948,-116.937225,"United States Olympic Training Center","Chula Vista"
