"event_id","event_name","event_created","event_time","event_venue_lat","event_venue_lon","venue_name","venue_city"
"26811591","South Bay Ramblers Annual Picnic - Loch Lomond Recreation Area",1311475380000,1.313253e+12,37.110789,-122.064519,"Loch Lomond Recreation Area","Felton"
"62716962","South Bay Ramblers Annual Picnic - Loch Lomond Recreation Area",1335762784000,1345912200000,37.110789,-122.064519,"Loch Lomond Recreation Area","Felton"
"16565880","PG&E Trail @ Rancho San Antonio",1297727957000,1301162400000,37.33292,-122.075835,"Rancho San Antonio","Los Altos"
"60453232","Hike Sunol to Maguire Peaks (DHS)",1334340144000,1334416500000,37.515188,-121.830165,"Sunol Regional Wilderness","Sunol"
"8608067","San Fran Drum circle",1219553029000,1221940800000,37.770663,-122.468593,"Hippie Hill","San Francisco"
"8608129","Cesar Chavez Park",1219554083000,1220817600000,37.332082,-121.89006,"Plaza De Cesar Chavez Park","San Jose"
"15424356","Christmas in the Park - Downtown San Jose",1289549658000,1.292553e+12,37.332082,-121.89006,"Plaza De Cesar Chavez Park","San Jose"
"14092160","Music in the Park  with *14 piece Michael Jackson Tribute Band",1279051992000,1281056400000,37.332082,-121.89006,"Plaza De Cesar Chavez Park","San Jose"
"8581516","W2M&SN September Meetup: Abaqus, Planet 9, FireEagle",1219201533000,1222221600000,37.42197,-122.084145,"Google / Building 40","Mountain View"
"30493861","Harvest Wine Celebration Concert @White Crane Winery in Livermore",1314055109000,1315180800000,37.649685,-121.698647,"White Crane Winery","Livermore"
"26383221","Silicon Valley POWER Business Mixer - Summer Health & Wealth",1311146137000,1311296400000,37.340054,-121.889931,"San Jose Athletic Club","San Jose"
"52524782","Run for Japan 2012  - 3.5 K Fun Walk / 8K Fun Run",1329353722000,1331479800000,37.415585,-122.078175,"Shoreline Park Run","Mountain View"
"vnbspynpbmb","Santa Clara Library Spanish Conversation (Sycamore Room)",1287806464000,1289356200000,37.340304,-121.973299,"Central Park Library","Santa Clara"
"30389241","Wilder Ranch Inland",1313988082000,1321117200000,37.159966,-121.984269,"Wilder Ranch","Santa Cruz"
"13510999","Walk for a healthy heart",1274125678000,1275843600000,37.576207,-122.010203,"Alameda Creek Trail","Fremont"
"15924151","Walk to stay healthy in the new year",1294199306000,1.294596e+12,37.576207,-122.010203,"Alameda Creek Trail","Fremont"
"glhqpynpbmb","Tuesday Mamadou class",1286743326000,1288144800000,37.379594,-122.112084,"Hillview Community center","Los Altos"
"8943397","Let's check out PG San Francisco!",1223751143000,1224437400000,37.792079,-122.410871,"Planet Granite","San Francisco"
"75757582","Brazen Summer Breeze 13.1/6.2/3.1",1343778440000,1344092400000,37.694434,-122.185627,"San Leandro Marina Park","San Leandro"
"51171782","Brazen Bay Breeze Half/10K/5K @ San Leandro",1328489611000,1329580800000,37.694434,-122.185627,"San Leandro Marina Park","San Leandro"
"mfbnnyqgbrb","Monsieur Lazhar - SJ Indie FIlm April Meetup",1329548105000,1334367900000,37.332272,-121.886078,"Camera 3","San Jose"
"81339832","Guided Meditation",1347042579000,1347127200000,37.554607,-121.989115,"Centerville Community Center","Fremont"
"12478219","Valentine's Day, The Movie!  - Century 20 Oakridge Mall",1264985397000,1266028200000,37.250571,-121.861167,"Century 20 Oakridge","San Jose"
"34246952","COASTAL TRAIL AND HILL 88 LOOP IN THE MARIN HEADLANDS",1316525555000,1319299200000,37.831592,-122.534637,"Fort Cronkhite, Marin Headlands","Sausalito"
"qjwjgcyqnbnb","The Underground  / 106 Miles Meet Up",1344636909000,1349917200000,37.486477,-122.234467,"Redwood City Underground Pub","Redwood City"
"18457201","Salsa Dancing Lesson & Business Networking Meetup",1305484598000,1305943200000,37.486477,-122.234467,"Redwood City Underground Pub","Redwood City"
"qjwjgcyqfbsb","The Underground  / 106 Miles Meet Up",1326234885000,1331773200000,37.486477,-122.234467,"Redwood City Underground Pub","Redwood City"
"qjwjgcyqcbpb","The Underground  / 106 Miles Meet Up",1308458556000,1326333600000,37.486477,-122.234467,"Redwood City Underground Pub","Redwood City"
"qjwjgcyqdblb","The Underground  / 106 Miles Meet Up",1323928846000,1328752800000,37.486477,-122.234467,"Redwood City Underground Pub","Redwood City"
"38000342","11/11/11 Redwood City #nerdnewyear Street Party ........... for 11 Charities !!!",1319054897000,1321063200000,37.486477,-122.234467,"Redwood City Underground Pub","Redwood City"
"qjwjgcypqbsb","Last 106 Miles Meet Up of 2011 !!",1308458556000,1323914400000,37.486477,-122.234467,"Redwood City Underground Pub","Redwood City"
"dbbpdcypqbkb","PARTY WITH THE PANDA!!!",1293128742000,1323482400000,37.486477,-122.234467,"Redwood City Underground Pub","Redwood City"
"qsztbcypnbqb","The Underground  / 106 Miles Meet Up",1308458556000,1318467600000,37.486477,-122.234467,"Redwood City Underground Pub","Redwood City"
"plrbsypkbrb","The Underground Summer BBQ / 106 Miles Meet Up",1306269088000,1310605200000,37.486477,-122.234467,"Redwood City Underground Pub","Redwood City"
"qjwjgcyqlblb","The Underground  / 106 Miles Meet Up",1335299288000,1.344474e+12,37.486477,-122.234467,"Redwood City Underground Pub","Redwood City"
"39670292","7:30pm Informal Biz Social | 8pm -10pm Salsa Lessons | 10pm - 2am Salsa Social",1320256152000,1321673400000,37.486477,-122.234467,"Redwood City Underground Pub","Redwood City"
"ctcstypmbsb","The Underground / 106 Miles Meet Up",1306269088000,1316048400000,37.486477,-122.234467,"Redwood City Underground Pub","Redwood City"
"8925775","Marketing to 100 Million Boomers and Seniors",1223508993000,1227058200000,37.32692,-122.032385,"Intero Real Estate","Cupertino"
"9587522","Social Marketing for Your Career, Business and Job",1232744181000,1.235007e+12,37.32692,-122.032385,"Intero Real Estate","Cupertino"
"8925956","Politics, the Election, and Marketing ",1223510440000,1224635400000,37.32692,-122.032385,"Intero Real Estate","Cupertino"
"9404788","Twitter Means Business, What Does This Mean To You?",1230599573000,1232501400000,37.32692,-122.032385,"Intero Real Estate","Cupertino"
"16184573","LET'S PARTY!! PLAYTHINGS BAND IN SAN FRANCISCO, AT THE BLACKTHORN!",1295994783000,1.298178e+12,37.764256,-122.467033,"Blackthorn Tavern","San Francisco"
"98219262","Rea's Graduation & 2013 New Member's Ice-Breaker",1357498455000,1361584800000,37.433075,-121.89745,"El Torito","Milpitas"
"22858181","New Member's Ice-Breaker!",1308593417000,1310783400000,37.433075,-121.89745,"El Torito","Milpitas"
"39507432","Holiday Mingle, Ugly Holiday Sweaters, & Gift Exchange!",1320168426000,1.324089e+12,37.433075,-121.89745,"El Torito","Milpitas"
"15150171","Cheap seats @ the movies $4.50",1287433171000,1287538200000,37.278108,-121.949825,"Cinelux Plaza Theatre","Campbell"
"qjmlnynhbwb","iPhone and iPad Developer's meetup",1271442029000,1274146200000,37.431507,-122.1036,"TIPS Group","Palo Alto"
"12041035","iPhone Developer's Meetup: Network Effects",1260241246000,1.26387e+12,37.431507,-122.1036,"TIPS Group","Palo Alto"
"10684514","Android July: App demos and how to program in Android",1245370387000,1248312600000,37.431507,-122.1036,"TIPS Group","Palo Alto"
"11501008","Android Developers October Meetup: Getjar, Sprint, SonyEricsson, Flurry",1254256961000,1.256175e+12,37.431507,-122.1036,"TIPS Group","Palo Alto"
"16802851","Mount Diablo State Park",1299288475000,1305390600000,37.924395,-121.940761,"Mount Diablo State Park","Clayton"
"8940038","The Bay Area Origami Meetup Group",1223684422000,1225416600000,37.42741,-122.144371,"printer's Inc Coffee","Palo Alto"
"9398663","Bay Area Origami MeetIp",1230506439000,1232233200000,37.42741,-122.144371,"printer's Inc Coffee","Palo Alto"
"9215302","Bay Area Origami Meetup",1227409119000,1229209200000,37.42741,-122.144371,"printer's Inc Coffee","Palo Alto"
"59472332","Skyline-to-the-Sea (30 mi)",1333679598000,1338729300000,37.258513,-122.121965,"Saratoga Gap OSP","Saratoga"
"98492392","Venture Summit | West 2013",1357613543000,1360805400000,37.414448,-122.077482,"Computer History Museum","Mountain View"
"36035162","2nd Annual Open Science Summit",1317693709000,1319335200000,37.414448,-122.077482,"Computer History Museum","Mountain View"
"85706762","CINA: At the Intersection of Web, Wireless, Entertainment and Cloud Computing",1349474257000,1352491200000,37.414448,-122.077482,"Computer History Museum","Mountain View"
"52354122","Denim to Diamonds - Volunteer at the Wheel of Fortune",1329253784000,1331440200000,37.414448,-122.077482,"Computer History Museum","Mountain View"
"9081167","2009 MECDA Gala Showcase",1225676709000,1232218800000,37.416451,-122.109979,"Cubberly Pavillion","Palo Alto"
"kbjgqypgbdc","Ballroom Dance at Cubberly Pavillion - Every Friday ",1295019677000,1303527600000,37.416451,-122.109979,"Cubberly Pavillion","Palo Alto"
"twwrnynpbjb","Fun Run: Sawyer Camp + Brunch at Nini's ",1274842298000,1289059200000,37.531026,-122.363972,"Sawyer Camp/South Trail Entrance","San Mateo"
"twwrnynkbfb","Fun Run: Sawyer Camp + Brunch at Nini's ",1275400279000,1278172800000,37.531026,-122.363972,"Sawyer Camp/South Trail Entrance","San Mateo"
"62743592","Cinco De Mayo Mania - Day 4 - El Torito's Restaurant",1335795424000,1.336176e+12,37.385315,-121.980553,"El Torito ","Santa Clara"
"16713876","St Patrick's Day - Margarita Movie Madness - Happy Hour and a Movie!!",1298741849000,1.30041e+12,37.385315,-121.980553,"El Torito ","Santa Clara"
"21525531","KJ Member Spotlight:  KJ Karin at El Toritos",1307577357000,1.308357e+12,37.385315,-121.980553,"El Torito ","Santa Clara"
"10532838","Second Annual Open House: Palo Alto Golf Course",1243729918000,1244910600000,37.452746,-122.114785,"Palo Alto Muni","Palo Alto"
"11650812","Groundstroke games w/ Charlie for Advanced Intermediates to Adv. (NTRP 3.5-5.0)",1255824443000,1255898700000,37.398435,-122.000781,"Lakewood Park","Sunnyvale"
"88630672","Tennis Milpitas - Gill Memorial Park",1351223301000,1351277100000,37.437116,-121.896658,"Peter D. Gill Memorial Park","Milpitas"
"79049622","Tennis Milpitas - Gill Memorial Park",1345746378000,1345833900000,37.437116,-121.896658,"Peter D. Gill Memorial Park","Milpitas"
"36268312","Ice skating and Hot Chocolate!",1317838170000,1321673400000,37.431047,-122.12555,"Winter Lodge","Palo Alto"
"16859794","Arlene's Birthday Bash at the Acapulco Lounge",1299693174000,1299983400000,37.348233,-121.995726,"Acapulco Mexican Restaurant","Santa Clara"
"14543717","Member's Choice - Saturday Night Karaoke - YOU PICK THE LOCATION!",1282780585000,1285464600000,37.348233,-121.995726,"Acapulco Mexican Restaurant","Santa Clara"
"15318232","Birthday Karaoke Party for Susan at Acapulco Lounge",1288744726000,1289701800000,37.348233,-121.995726,"Acapulco Mexican Restaurant","Santa Clara"
"17455593","CINCO DE MAYO MANIA - Day 4 - Acapulco Lounge (and Tony's Birthday!)",1303929723000,1304818200000,37.348233,-121.995726,"Acapulco Mexican Restaurant","Santa Clara"
"15532278","Happy Holiday Karaoke at the Acapulco Lounge",1290477689000,1292725800000,37.348233,-121.995726,"Acapulco Mexican Restaurant","Santa Clara"
"9607326","SBAY: Drum Circle In New Location - Norbeth Grandado",1233013713000,1234924200000,37.292763,-121.890198,"Our Sacred Space","San Jose"
"11913399","Grill Em! Steak House-Campbell",1258659018000,1260669600000,37.277672,-121.932629,"Grill Em Bar & Restaurant","Campbell"
"11841805","Grill Em! Steak House-Campbell",1257870050000,1260669600000,37.277672,-121.932629,"Grill Em Bar & Restaurant","Campbell"
"36466242","Food Sort at Second Harvest Food Bank",1317947249000,1321581600000,37.2925,-121.876311,"Second Harvest Food Bank","San Jose"
"42847752","Food Sort at Second Harvest Food Bank",1322624474000,1325728800000,37.2925,-121.876311,"Second Harvest Food Bank","San Jose"
"14137984","Tail Gate to Meteoroids",1279477288000,1.281321e+12,37.463809,-122.297948,"Edgewood Road and Canada Road","Redwood City"
"9298285","Milpitas (2nd Friday of each month)",1228693948000,1.234539e+12,37.434232,-121.88382,"Omega Restaurant","Milpitas"
"9068019","Milpitas (2nd Friday of each month)",1225477284000,1.231515e+12,37.434232,-121.88382,"Omega Restaurant","Milpitas"
"9471973","Serengeti Nights",1231374451000,1247968800000,37.645344,-122.104836,"EON Coffee","Hayward"
"9471928","Serengeti Nights",1231374012000,1232852400000,37.645344,-122.104836,"EON Coffee","Hayward"
"9471965","Serengeti Nights",1231374378000,1246154400000,37.645344,-122.104836,"EON Coffee","Hayward"
"9471982","Serengeti Nights",1231374520000,1.250388e+12,37.645344,-122.104836,"EON Coffee","Hayward"
"9471993","Serengeti Nights",1231374590000,1255831200000,37.645344,-122.104836,"EON Coffee","Hayward"
"9471935","Serengeti Nights",1231374063000,1235876400000,37.645344,-122.104836,"EON Coffee","Hayward"
"10687307","Friday Night Happy Hour at Artists Alley Gallery (4000+ sq ft in downtown SF)",1245407031000,1247275800000,37.78328,-122.405682,"The Artists Alley","San Francisco"
"14177343","Alice's Restaurant: Woodside",1279772310000,1282870800000,37.259472,-122.032264,"Union 76 Gas Station","Saratoga"
"13451691","Alice's Restaurant: Woodside",1273604330000,1276822800000,37.259472,-122.032264,"Union 76 Gas Station","Saratoga"
"15057922","Breakfast @ Alice's then on to Capitola for Dancing to Marshall Law",1286664221000,1286728200000,37.259472,-122.032264,"Union 76 Gas Station","Saratoga"
"17023519","21st Annual Pacific Coast Dream Machines Show - Ride & Brunch",1300860577000,1304263800000,37.435378,-121.885805,"Starbucks","Milpitas"
"94956042","FoSMR joins the SAINTS & SINNERS M.C. Toy Run ( Pack Ride )",1355247033000,1356196500000,37.435378,-121.885805,"Starbucks","Milpitas"
"15512729","Hidden Villa to the Top of Black Mountain",1290301710000,1.294506e+12,37.351891,-122.155618,"Hidden Villa","Los Altos"
"47667272","Farm to Farm - Hidden Villa to Rancho San Antonio",1326301752000,1327771800000,37.351891,-122.155618,"Hidden Villa","Los Altos"
"13140202","Hidden Villa to the Top of Black Mountain",1270867339000,1271518200000,37.351891,-122.155618,"Hidden Villa","Los Altos"
"10173320","05/10/2009 SUNDAY CONGA FLING! DRUM LESSONS, DANCE LESSONS & PRACTICE TIME",1239618984000,1242010800000,37.308639,-122.012122,"CPAA Arts Center","San Jose"
"10126705","04/12/2009 SUNDAY CONGA FLING! DRUM LESSONS, DANCE LESSONS & PRACTICE TIME",1239033965000,1239591600000,37.308639,-122.012122,"CPAA Arts Center","San Jose"
"9047705","Belmont PG  - Gym Meetup (All Levels)",1225215396000,1.225854e+12,37.529102,-122.287509,"Belmont Planet Granite","Belmont"
"9198725","Dec 21st Los Altos/Winter Solstice Drum Circle",1227160062000,1229911200000,37.380161,-122.114479,"DownTime Healing Arts Center","Los Altos"
"9050911","Los Altos drumcircle",1225242074000,1226282400000,37.380161,-122.114479,"DownTime Healing Arts Center","Los Altos"
"9198693","Dec 7th Los Altos Drum Circle",1227159774000,1228701600000,37.380161,-122.114479,"DownTime Healing Arts Center","Los Altos"
"9666384","Los Altos Drum Circle 2/22/2009 7PM!!!",1233704556000,1.235358e+12,37.380161,-122.114479,"DownTime Healing Arts Center","Los Altos"
"11519802","Los Altos October17 Drumcircle",1254416647000,1255831200000,37.380161,-122.114479,"DownTime Healing Arts Center","Los Altos"
"9640898","Los Altos Drum Circle 3/8",1233424336000,1236560400000,37.380161,-122.114479,"DownTime Healing Arts Center","Los Altos"
"9323818","Beginner Drum Class Part 1",1229038628000,1232330400000,37.380161,-122.114479,"DownTime Healing Arts Center","Los Altos"
"10784911","Los Altos July 19th Drumcircle",1246500963000,1248051600000,37.380161,-122.114479,"DownTime Healing Arts Center","Los Altos"
"11711989","LAST Los Altos November 21 Drumcircle",1256533385000,1258855200000,37.380161,-122.114479,"DownTime Healing Arts Center","Los Altos"
"10274726","Los Altos Drum Circle 5/3",1240810557000,1241398800000,37.380161,-122.114479,"DownTime Healing Arts Center","Los Altos"
"9640892","Los Altos Drum Circle 2/8/2009",1233424298000,1234144800000,37.380161,-122.114479,"DownTime Healing Arts Center","Los Altos"
"9323822","Beginner Drum Class Part 2",1229038693000,1232935200000,37.380161,-122.114479,"DownTime Healing Arts Center","Los Altos"
"9518807","Digeridoo Meditations",1231902829000,1232247600000,37.380161,-122.114479,"DownTime Healing Arts Center","Los Altos"
"9051166","Sausalito Drumcircle",1225243600000,1226185200000,37.832649,-122.478201,"tunnels","Sausalito"
"9074077","Dia de los Muertos Celebracion",1225579138000,1225652400000,37.334638,-121.893578,"MLK Library","san jose"
"12006848","[Santa Clara] How High Can You Jump? ",1259815964000,1262746800000,37.371734,-121.978947,"Sky High Sports","Santa Clara"
"12038250","Cherry Sushi-Santa Clara",1260220315000,1261191600000,37.351858,-121.979327,"Cherry Sushi","Santa Clara"
"42021362","Millionaire Mind Intensive... coming to San Jose",1321943054000,1.32345e+12,37.361378,-121.908145,"Wyndham Hotel San Jose","San Jose"
"34297082","Video: Douglas R. Hofstadter Presidential Lecture",1316544906000,1316977200000,37.483185,-122.178054,"TechShop","Menlo Park"
"12650027","Bob Blum: CONSCIOUSNESS: What, Who, When, and Why",1266611828000,1267387200000,37.483185,-122.178054,"TechShop","Menlo Park"
"52179412","Artificial Cognitive Vision",1329155540000,1330286400000,37.483185,-122.178054,"TechShop","Menlo Park"
"51474362","Deconstructing The Matrix",1328661524000,1329076800000,37.483185,-122.178054,"TechShop","Menlo Park"
"46005182","Frank Jenkins: Cognitive Vision – A General Overview",1325283487000,1326052800000,37.483185,-122.178054,"TechShop","Menlo Park"
"17224872","UnMeetup - General discussion about anything AI related",1302215137000,1.302462e+12,37.483185,-122.178054,"TechShop","Menlo Park"
"8544784","Emergence in Social Networks",1218739424000,1218999600000,37.483185,-122.178054,"TechShop","Menlo Park"
"24654621","Is an AI Singularity likely or even possible",1309901611000,1310324400000,37.483185,-122.178054,"TechShop","Menlo Park"
"37891552","Semantics, Models, and Model Free Methods",1318982323000,1319396400000,37.483185,-122.178054,"TechShop","Menlo Park"
"29123531","Sunday Matinee",1313080341000,1313348400000,37.483185,-122.178054,"TechShop","Menlo Park"
"36499942","Yet More Videos",1317982686000,1318186800000,37.483185,-122.178054,"TechShop","Menlo Park"
"59391492","Bring a Question",1333645607000,1333911600000,37.483185,-122.178054,"TechShop","Menlo Park"
"9296366","What Happened To Automatic Programming?",1228671783000,1231099200000,37.483185,-122.178054,"TechShop","Menlo Park"
"12691667","Mike and Cheri's Bunny Ride!",1266982545000,1270312200000,37.386968,-122.26518,"Alice's Restaurant","Woodside"
"10927331","The aMAZEing Race",1248216489000,1249750800000,37.386968,-122.26518,"Alice's Restaurant","Woodside"
"9008096","Nov 18th Meetup: OpenLandmark.com, SKOUT.com (formerly Wichro)",1224644792000,1227063600000,37.423053,-122.082466,"Google","Mountain View"
"25067411","Pronunciation Secrets",1310162251000,1312043400000,37.383526,-122.012808,"Ovient English (Inside the Plug and Play Tech Center)","Sunnyvale"
"103182752","American Business Idioms",1360096644000,1362538800000,37.383526,-122.012808,"Ovient English (Inside the Plug and Play Tech Center)","Sunnyvale"
"70057002","Half and Half Bash!!",1340240124000,1341628200000,37.286216,-121.946025,"The Spot","Campbell"
"31203982","The Half and Half Friday Bash",1314488230000,1.315017e+12,37.286216,-121.946025,"The Spot","Campbell"
"10013967","Let's Celebrate at the French Quarters",1237786483000,1242525600000,37.385956,-122.026869,"Downtown Sunnyvale","Sunnyvale"
"9163757","2 Speakers: How to Make Money Collaberating/Aptana Single Language Stack",1226694334000,1227234600000,37.483264,-122.146853,"Sun Microsystems, Menlo Park","Menlo Park"
"11097693","SBAY: FREE Presentation - 16 Stretches for Health and Success!",1250110574000,1250908200000,37.25354,-121.860441,"JavaLand","San Jose"
"62474722","Dancing and socializing at the Saddle Rack in Fremont !!!",1335580424000,1339726500000,37.507355,-121.981756,"The Saddle Rack","Fremont"
"30384951","The Rack!  A lil' bit Country & a whole lotta Rock n Roll!",1313984499000,1314411300000,37.507355,-121.981756,"The Saddle Rack","Fremont"
"9171427","Aruba's Cypress Raks",1226817467000,1227495600000,36.975731,-122.028191,"Cypress Cafe Lounge","santa cruz"
"10274838","Redwood City Full Moon Drum Circle",1240813138000,1244428200000,37.514355,-122.200469,"Pacific Shores Business Center","Redwood City"
"24997561","Redwood City Full Moon Drum Circle",1310106227000,1313283600000,37.514355,-122.200469,"Pacific Shores Business Center","Redwood City"
"20764021","Redwood City Full Moon Drum Circle",1307060548000,1308189600000,37.514355,-122.200469,"Pacific Shores Business Center","Redwood City"
"12552358","Redwood City Afternoon Drum Circle",1265654920000,1266098400000,37.514355,-122.200469,"Pacific Shores Business Center","Redwood City"
"12084054","Redwood City Full Moon Drum Circle",1260824149000,1267408800000,37.514355,-122.200469,"Pacific Shores Business Center","Redwood City"
"17369333","Redwood City Full Moon Drum Circle",1303276542000,1.305684e+12,37.514355,-122.200469,"Pacific Shores Business Center","Redwood City"
"14209564","Redwood City Full Moon Drum Circle",1280094426000,1282701600000,37.514355,-122.200469,"Pacific Shores Business Center","Redwood City"
"10274737","Redwood City Full Moon Drum Circle",1240810777000,1241836200000,37.514355,-122.200469,"Pacific Shores Business Center","Redwood City"
"10785214","Redwood City Full Moon Drum Circle",1246502807000,1247020200000,37.514355,-122.200469,"Pacific Shores Business Center","Redwood City"
"12084049","Redwood City Full Moon Drum Circle",1260824118000,1264903200000,37.514355,-122.200469,"Pacific Shores Business Center","Redwood City"
"9198817","Redwood City Full Moon Drum Circle",1227161401000,1229131800000,37.514355,-122.200469,"Pacific Shores Business Center","Redwood City"
"11711975","Redwood City Full Moon Drum Circle",1256533195000,1.257219e+12,37.514355,-122.200469,"Pacific Shores Business Center","Redwood City"
"13278514","Redwood City New Moon Drum Circle",1272136127000,1273888800000,37.514355,-122.200469,"Pacific Shores Business Center","Redwood City"
"10785274","Redwood City Full Moon Drum Circle",1246503228000,1249525800000,37.514355,-122.200469,"Pacific Shores Business Center","Redwood City"
"24992231","Redwood City Full Moon Drum Circle",1310100163000,1.310778e+12,37.514355,-122.200469,"Pacific Shores Business Center","Redwood City"
"ctrtqyqqbvb","Sunday Satsang - Meditation Group",1301892936000,1355713200000,37.563275,-122.324555,"Yoga At Change","San Mateo"
"zzhppyqpbdb","DRUM ~ DANCE ~ CHILL (San Mateo)",1349582568000,1351911600000,37.563275,-122.324555,"Yoga At Change","San Mateo"
"zzhppyqqbkb","DRUM ~ DANCE ~ CHILL (San Mateo)",1350263852000,1354939200000,37.563275,-122.324555,"Yoga At Change","San Mateo"
"zzhppyrcbgb","DRUM ~ DANCE ~ CHILL (San Mateo)",1352610898000,1357358400000,37.563275,-122.324555,"Yoga At Change","San Mateo"
"zzhppyqnbhb","DRUM ~ DANCE ~ CHILL (San Mateo)",1347075663000,1349492400000,37.563275,-122.324555,"Yoga At Change","San Mateo"
"zzhppyrfbcb","DRUM ~ DANCE ~ CHILL (San Mateo)",1286109300000,1362196800000,37.563275,-122.324555,"Yoga At Change","San Mateo"
"zzhppyrdbcb","DRUM ~ DANCE ~ CHILL (San Mateo)",1286109300000,1359777600000,37.563275,-122.324555,"Yoga At Change","San Mateo"
"ctrtqyqmbdb","Sunday Satsang - Meditation Group",1346042060000,1346637600000,37.563275,-122.324555,"Yoga At Change","San Mateo"
"ctrtqyqqbnc","Sunday Satsang - Meditation Group",1301892936000,1356922800000,37.563275,-122.324555,"Yoga At Change","San Mateo"
"13302750","Almaden Quick Silver-McAbee Entrance",1272341077000,1273942800000,37.195213,-121.836159,"Almaden Quicksilver County Park - McAbee / Mockingbird Hill Lane","San Jose"
"11842669","Almaden Quick Silver-McAbee Entrance",1257876947000,1263058200000,37.195213,-121.836159,"Almaden Quicksilver County Park - McAbee / Mockingbird Hill Lane","San Jose"
"42076862","WebGL: Hands On Session and Automate your Life with Google Apps Script",1321989710000,1326247200000,37.657997,-121.880852,"Pleasanton Library","Pleasanton"
"50234162","Monte Bello OSP",1327942873000,1330792200000,37.325874,-122.178223,"Monte Bello Open Space Preserve Parking Lot","Palo Alto"
"12815041","SBAY: Metatron Squared",1268037198000,1269050400000,37.345307,-121.924429,"Rebecca's","San Jose"
"74462602","Wednesday Tennis in Sunnyvale 5:30 PM",1343000495000,1343262600000,37.361561,-122.053009,"Mango Park (aka Sunnyvale Middle School courts)","Sunnyvale"
"102606652","Wednesday Tennis in Sunnyvale 5:30 PM",1359771736000,1360200600000,37.361561,-122.053009,"Mango Park (aka Sunnyvale Middle School courts)","Sunnyvale"
"24189161","Sunday Tennis in Sunnyvale at 2:00 PM",1309492937000,1309726800000,37.361561,-122.053009,"Mango Park (aka Sunnyvale Middle School courts)","Sunnyvale"
"49688422","Sunday Tennis in Sunnyvale at 2:00 PM",1327561809000,1327874400000,37.361561,-122.053009,"Mango Park (aka Sunnyvale Middle School courts)","Sunnyvale"
"59789062","Wednesday Tennis in Sunnyvale 5:30 PM",1333944205000,1334190600000,37.361561,-122.053009,"Mango Park (aka Sunnyvale Middle School courts)","Sunnyvale"
"76281202","Monday Tennis in Sunnyvale 5:30 PM",1344053735000,1344299400000,37.361561,-122.053009,"Mango Park (aka Sunnyvale Middle School courts)","Sunnyvale"
"12242633","Chinese New Year Banquet- Asian Pearl, Fremont",1262806441000,1266634800000,37.501472,-121.974167,"Asian Pearl Restaurant","Fremont"
"9672677","Yoga For Fitness Meetup",1233772036000,1234047600000,37.427605,-121.915222,"Sobrato Community Center","Milpitas"
"12463452","Deepen your Relationship, Strengthen your Marriage!",1264814319000,1265479200000,37.427605,-121.915222,"Sobrato Community Center","Milpitas"
"12552789","Valentine Special: Couples Yoga ",1265657552000,1266170400000,37.427605,-121.915222,"Sobrato Community Center","Milpitas"
