"event_id","event_name","event_created","event_time","event_venue_lat","event_venue_lon","venue_name","venue_city"
"10416020","Garland Offisite Dog Adoption",1242353350000,1258815600000,32.955219,-96.610456,"Oak Park School","Garland"
"12493542","Garland Offsite Animal Adoption",1265089463000,1290265200000,32.955219,-96.610456,"Oak Park School","Garland"
"10415875","Garland Offisite Dog Adoption",1242352869000,1245506400000,32.955219,-96.610456,"Oak Park School","Garland"
"8112900","Garland Off-site Dog Adoption Day",1213062464000,1.214658e+12,32.955219,-96.610456,"Oak Park School","Garland"
"12382448","Garland Offisite Animal Adoption",1264089532000,1.266678e+12,32.955219,-96.610456,"Oak Park School","Garland"
"12493552","Garland Offisite Animal Adoption",1265089544000,1292684400000,32.955219,-96.610456,"Oak Park School","Garland"
"10416015","Garland Offisite Dog Adoption",1242353273000,1.255788e+12,32.955219,-96.610456,"Oak Park School","Garland"
"12493531","Garland Offsite Animal Adoption",1265089380000,1287237600000,32.955219,-96.610456,"Oak Park School","Garland"
"8111414","Garland Off-site Adoption Day",1213050815000,1.214658e+12,32.955219,-96.610456,"Oak Park School","Garland"
"16344417","Garland Offisite Animal Adoption",1296231879000,1298127600000,32.955219,-96.610456,"Oak Park School","Garland"
"15935399","Garland Offisite Animal Adoption",1294271607000,1295103600000,32.955219,-96.610456,"Oak Park School","Garland"
"10082074","Garland Offisite Dog Adoption",1238536455000,1240063200000,32.955219,-96.610456,"Oak Park School","Garland"
"10415892","Garland Offisite Dog Adoption",1242353093000,1250344800000,32.955219,-96.610456,"Oak Park School","Garland"
"12493491","Garland Offisite Animal Adoption",1265089117000,1279375200000,32.955219,-96.610456,"Oak Park School","Garland"
"12493510","Garland Offisite Animal Adoption",1265089305000,1284818400000,32.955219,-96.610456,"Oak Park School","Garland"
"22434951","Downtown Dallas Urban Night Hike and Summer Block Party",1308238776000,1308358800000,32.77883,-96.807827,"Old Red Museum","Dallas"
"38269372","Downtown Dallas Urban Night Hike and Dinner",1319242625000,1319324400000,32.77883,-96.807827,"Old Red Museum","Dallas"
"51853162","Margaret Hunt Hill Bridge Celebration Street Fair",1328899634000,1330815600000,32.77883,-96.807827,"Old Red Museum","Dallas"
"91438002","Downtown Dallas Urban Walking Tour and City Lights Christmas Festival",1352938137000,1353194100000,32.77883,-96.807827,"Old Red Museum","Dallas"
"16967186","SUPERMOON-Downtown Dallas Urban Night Hike and Dinner",1300463150000,1300580100000,32.77883,-96.807827,"Old Red Museum","Dallas"
"22434711","Downtown Dallas Urban Night Hike and Summer Block Party",1308238586000,1308358800000,32.77883,-96.807827,"Old Red Museum","Dallas"
"41723582","Downtown Dallas Urban Night Hike and City Lights Party",1321711829000,1321744500000,32.77883,-96.807827,"Old Red Museum","Dallas"
"95332442","Let's hike downtown and see the lights.",1355489315000,1356217200000,32.77883,-96.807827,"Old Red Museum","Dallas"
"56387532","Downtown Dallas Urban Walking Tour",1331768140000,1332025200000,32.77883,-96.807827,"Old Red Museum","Dallas"
"40792012","Downtown Dallas Urban Night Hike and Dinner",1321015776000,1321140600000,32.77883,-96.807827,"Old Red Museum","Dallas"
"40792512","Downtown Dallas Urban Night Hike",1321016581000,1321140600000,32.77883,-96.807827,"Old Red Museum","Dallas"
"38305422","Downtown Dallas Urban Night Hike",1319288224000,1319324400000,32.77883,-96.807827,"Old Red Museum","Dallas"
"41723872","Downtown Dallas Urban Night Hike and Main Street Garden Party",1321711953000,1321744500000,32.77883,-96.807827,"Old Red Museum","Dallas"
"16967066","SUPERMOON-Downtown Dallas Urban Night Hike and Dinner",1300462361000,1300580100000,32.77883,-96.807827,"Old Red Museum","Dallas"
"56388252","Downtown Dallas Urban Walking Tour and Dinner",1331768588000,1332025200000,32.77883,-96.807827,"Old Red Museum","Dallas"
"95967332","Downtown Christmas Lights Walking Tour",1355964518000,1356217200000,32.77883,-96.807827,"Old Red Museum","Dallas"
"15687479","Downtown Dallas Urban Hike and Neiman Marcus Window Viewing",1291906864000,1292104800000,32.77883,-96.807827,"Old Red Museum","Dallas"
"51852732","Margaret Hunt Hill Bridge Celebration Street Fair",1328899529000,1330815600000,32.77883,-96.807827,"Old Red Museum","Dallas"
"68164342","Downtown Dallas Urban Walking Tour",1339083162000,1339286400000,32.77883,-96.807827,"Old Red Museum","Dallas"
"68164992","Downtown Dallas Urban Walking Tour and Dinner",1339083506000,1339286400000,32.77883,-96.807827,"Old Red Museum","Dallas"
"91439172","Downtown Dallas Urban Walking Tour and City Lights Christmas Festival",1352938350000,1353194100000,32.77883,-96.807827,"Old Red Museum","Dallas"
"15687672","Downtown Dallas Urban Hike and Neiman Marcus Window Viewing",1291908256000,1292104800000,32.77883,-96.807827,"Old Red Museum","Dallas"
"92421132","Downtown Dallas Urban Walking Tour and Christmas Light Viewing",1353592671000,1353798900000,32.77883,-96.807827,"Old Red Museum","Dallas"
"14983545","Jazz in the Atrium - Dallas Museum of Art",1286123605000,1287703800000,32.787275,-96.800212,"Dallas Museum of Art","Dallas"
"97557002","Late Nights at the Dallas Museum of Art",1357166716000,1360976400000,32.787275,-96.800212,"Dallas Museum of Art","Dallas"
"12577700","Dallas Museum of Art - Author Lecture by Elizabeth Kostova",1265862529000,1271457900000,32.787275,-96.800212,"Dallas Museum of Art","Dallas"
"51966602","Field Trip to the Dallas Zoo!",1328984879000,1330282800000,32.744122,-96.814154,"Dallas Zoo","Dallas"
"99856562","Field Trip to the Dallas Zoo!",1358325208000,1.359918e+12,32.744122,-96.814154,"Dallas Zoo","Dallas"
"97558502","Dallas Zoo",1357167207000,1359825300000,32.744122,-96.814154,"Dallas Zoo","Dallas"
"16959589","Rowlett-Easter Pup-Apalooza",1300398331000,1.303065e+12,32.903617,-96.55412,"Pecan Grove Park","Rowlett"
"16959508","Easter Pup-apalooza - Dog Egg Hunt",1300398053000,1303066800000,32.903617,-96.55412,"Pecan Grove Park","Rowlett"
"43185222","Yoga, Live Music and Art at the Trammell Crowe (Free Event!)",1322858670000,1323390600000,32.788242,-96.799561,"Trammell & Margaret Crow Collection of Asian Art","Dallas"
"95142802","Dallas World Aquarium",1355357538000,1359223200000,32.783459,-96.804939,"Dallas World Aquarium","Dallas"
"10228935","Glamour Club Dinner Meeting",1240264338000,1.241568e+12,33.001047,-96.962378,"Twin Peaks Restaurant ","Lewisville"
"9777794","Familiar Strangers",1235074192000,1235089800000,32.837822,-96.776167,"Angelika Theater","Dallas"
"11819807","Movie Night:  Invictus - about Nelson Mandela",1257618826000,1260925200000,32.837822,-96.776167,"Angelika Theater","Dallas"
"25902881","Movie - Sarah's Key",1310773906000,1312060500000,32.837822,-96.776167,"Angelika Theater","Dallas"
"9357202","Screening of Defiance",1229582173000,1231893900000,32.837822,-96.776167,"Angelika Theater","Dallas"
"26496161","Movie - The Help",1311214341000,1313798400000,32.837822,-96.776167,"Angelika Theater","Dallas"
"32140582","Movie: ""One Day""",1315072572000,1315765800000,32.837822,-96.776167,"Angelika Theater","Dallas"
"12056608","Movie Night - ""A Single Man""",1260414078000,1262907900000,32.837822,-96.776167,"Angelika Theater","Dallas"
"43950262","Uptown to Downtown Hike",1323457768000,1323633600000,32.807287,-96.803574,"Lee Park","Dallas"
"7719359","Social meet-up with my favorite wine lovers!!!",1207916661000,1208557800000,32.807887,-96.795847,"Cork","Dallas"
"7808339","Two book discussion, One fun location!",1209093422000,1211059800000,32.807887,-96.795847,"Cork","Dallas"
"drhmgfyrdbzb","Writers' Book Club",1359034011000,1.361322e+12,32.807887,-96.795847,"Cork","Dallas"
"drhmgfyrdbhb","Writers' Book Club",1359034011000,1360112400000,32.807887,-96.795847,"Cork","Dallas"
"drhmgfyrdbqb","Writers' Book Club",1359034011000,1360717200000,32.807887,-96.795847,"Cork","Dallas"
"11441242","Pirate Cruise aboard the Chamonix II at Pier121",1253662655000,1254009600000,33.003803,-96.918327,"Pier 121 Marina","Lewisville"
"73226022","Dinner At Taste of Home",1342206228000,1344038400000,33.016435,-96.538505,"Taste of Home","Wylie"
"47604282","Dinner at Taste of Home",1326252020000,1327107600000,33.016435,-96.538505,"Taste of Home","Wylie"
"82859592","Dinner at Taste of Home",1347924178000,1350086400000,33.016435,-96.538505,"Taste of Home","Wylie"
"cnkmnyplbjc","Dinner at Taste of Home in Wylie - MUST RSVP",1312507369000,1314403200000,33.016435,-96.538505,"Taste of Home","Wylie"
"54458782","Dinner at Taste of Home",1330575674000,1332547200000,33.016435,-96.538505,"Taste of Home","Wylie"
"64388132","Dinner At Taste of Home",1336751865000,1.3392e+12,33.016435,-96.538505,"Taste of Home","Wylie"
"99051122","Dinner at Taste of Home",1357878278000,1.359162e+12,33.016435,-96.538505,"Taste of Home","Wylie"
"11665008","Dinner Ride to Ralph and Kacoo's in Allen",1255999182000,1256342400000,33.099292,-96.678316,"Ralph and Kacoo's","Allen"
"40692312","Annual Aura Check Up",1320944654000,1323392400000,33.039818,-97.026891,"Miracles of Joy","Lewisville"
"8801379","Dinner Ride to The String Bean Restaurant",1222008078000,1224892800000,32.940004,-96.85582,"The String Bean","Dallas"
"10564715","Dinner ride to The String Bean",1244035672000,1244851200000,32.940004,-96.85582,"The String Bean","Dallas"
"84825392","Indian cuisine in Addison - Saffron House",1349035850000,1350237600000,32.951931,-96.820574,"Saffron House","Dallas"
"14341895","Rockwall Dog Swim Party @ Harry Myers Pool!",1281119359000,1.281798e+12,32.930366,-96.45279,"Myers Park Pool","Rockwall"
"8585793","Doggie Splash Day Rockwall",1219261336000,1219503600000,32.930366,-96.45279,"Myers Park Pool","Rockwall"
"8232555","Doggie Splash Day - Rockwall",1214635564000,1219503600000,32.930366,-96.45279,"Myers Park Pool","Rockwall"
"9826089","The Dallas-Plano Investor's Business Daily March Meetup",1235614501000,1237507200000,33.032051,-96.771217,"Haggard Library","Plano"
"11635060","October Meetup",1255630570000,1257109200000,32.893902,-96.80275,"Borders Books at Preston Royal Shopping Center, SE corner","Dallas"
"11855457","What's up for next year?",1257991275000,1261947600000,32.893902,-96.80275,"Borders Books at Preston Royal Shopping Center, SE corner","Dallas"
"14959123","Book Discussion: Little Bee by Chris Cleave",1285900731000,1288310400000,32.893902,-96.80275,"Borders Books at Preston Royal Shopping Center, SE corner","Dallas"
"11378598","Sept. 27 Meetup",1253033644000,1254081600000,32.893902,-96.80275,"Borders Books at Preston Royal Shopping Center, SE corner","Dallas"
"11848035","Dinner Ride to Rudy's in Frisco",1257912463000,1258765200000,33.159609,-96.83972,"Rudy's","Frisco"
"8247401","Spring Creek Cooldown",1214851953000,1.21536e+12,32.968488,-96.664597,"Shiloh Springs/ Fred E. Harris park","Garland"
"9388833","Shiloh Springs Nature Hike",1230300661000,1230490800000,32.968488,-96.664597,"Shiloh Springs/ Fred E. Harris park","Garland"
"25355541","Spring Creek Cooldown / Taco Cabana Lunch",1310412488000,1310911200000,32.968488,-96.664597,"Shiloh Springs/ Fred E. Harris park","Garland"
"14578563","Spring Creek Cooldown",1283088773000,1283103900000,32.968488,-96.664597,"Shiloh Springs/ Fred E. Harris park","Garland"
"10795805","Beat the Heat Morning Hike at Shiloh Springs ",1246630164000,1246807800000,32.968488,-96.664597,"Shiloh Springs/ Fred E. Harris park","Garland"
"14570504","Spring Creek Cooldown",1283000100000,1283060700000,32.968488,-96.664597,"Shiloh Springs/ Fred E. Harris park","Garland"
"qwfjkcyqkbkb","Cafe Madrid's Annual Running of the Bulls !!",1327274452000,1341698400000,32.822333,-96.791436,"Cafe Madrid","Dallas"
"58799772","Patio Open Mic/Jam - Love and War in Texas - Plano, TX",1333309949000,1.335114e+12,33.009427,-96.705988,"Love and War in Texas","Plano"
"qtkpbcyqkbfb","Networking Luncheon-  RICHARDSON/ALLEN Chapter",1326169611000,1341332100000,33.009427,-96.705988,"Love and War in Texas","Plano"
"qtkpbcyqjbhb","Co-ed Networking Luncheon-  RICHARDSON/ALLEN Chapter",1326169597000,1338912900000,33.009427,-96.705988,"Love and War in Texas","Plano"
"qtkpbcyqnbdb","Co-ed Networking Luncheon-  RICHARDSON/ALLEN Chapter",1326169655000,1349194500000,33.009427,-96.705988,"Love and War in Texas","Plano"
"15256666","ANNUAL TOY SORTING 2010",1288248087000,1.290348e+12,32.784317,-96.794535,"Sheraton Dallas Hotel","Dallas"
"29904201","Toy Sorting for Love for Kids",1313622733000,1321797600000,32.784317,-96.794535,"Sheraton Dallas Hotel","Dallas"
"14928638","Volunteer for the 2010 Dallas Margarita Ball - Biggest Gala Event!! ",1285705779000,1290301200000,32.784317,-96.794535,"Sheraton Dallas Hotel","Dallas"
"11834613","ANNUAL TOY SORTING 2009!!",1257797472000,1258898400000,32.784317,-96.794535,"Sheraton Dallas Hotel","Dallas"
"11415644","Dallas Margarita Ball - Biggest Gala Event!!",1253400173000,1258855200000,32.784317,-96.794535,"Sheraton Dallas Hotel","Dallas"
"14267216","Special Bonus Event: Chocolate and Blues",1280526275000,1280847600000,33.054768,-96.684608,"Plano Centre","Plano"
"15225481","Texas Pet Expo Adoption- Sponsored Adoption with DFW Pup Patrol- SUNDAY",1288041577000,1289140200000,33.054768,-96.684608,"Plano Centre","Plano"
"15225460","Texas Pet Expo Adoption- Sponsored Adoption with DFW Pup Patrol- SATURDAY",1288041442000,1289050200000,33.054768,-96.684608,"Plano Centre","Plano"
"12172719","HIKE: Ray Roberts Greenbelt  (See DIRECTIONS Below for accurate location!)",1262138427000,1263655800000,33.239548,-97.03297,"Ray Roberts Lake/Lake Lewisville Greenbelt Corridor ","Aubrey"
"pnwfzyqcbdb","DAYBREAKERS is becoming Business Exchange-DFW (Plano) on 1st Monday, 8:30-10am",1323060895000,1325514600000,33.014526,-96.709366,"Corner Bakery Cafe-Healthy Restaurant","Plano"
"pnwfzyqhbkb","DAYBREAKERS is becoming BusinessExchangeDFW (Plano) on 1st Monday, 8:30-10am",1335740581000,1336397400000,33.014526,-96.709366,"Corner Bakery Cafe-Healthy Restaurant","Plano"
"mmvgqyplblb","DAYBREAKERS for September, 2011 is cancelled, due to Labor Day (nat'l holiday)",1295300979000,1315229400000,33.014526,-96.709366,"Corner Bakery Cafe-Healthy Restaurant","Plano"
"pnwfzyqmbfb","BE-DFW (Plano) is on the 1st Tuesday from 8:30-9:45am",1344340948000,1346765400000,33.014526,-96.709366,"Corner Bakery Cafe-Healthy Restaurant","Plano"
"pnwfzypnbfb","DAYBREAKERS, your Monthly Networking Group on the 1st Monday from 8:30am-10am",1313363409000,1317648600000,33.014526,-96.709366,"Corner Bakery Cafe-Healthy Restaurant","Plano"
"47893682","Step Back in Time @ Dallas Heritage Village",1326414777000,1.335726e+12,32.77375,-96.786682,"Dallas Heritage Village","Dallas"
"39249912","Candlelight Performance at Dallas Heritage Village at Old City Park",1319987088000,1323550800000,32.77375,-96.786682,"Dallas Heritage Village","Dallas"
"87884072","Candlelight Performance at Dallas Heritage Village at Old City Park",1350795502000,1355010300000,32.77375,-96.786682,"Dallas Heritage Village","Dallas"
"38265102","Texans for Health Freedom Update:  CHANGE OF LOCATION WEDNESDAY DEC 7",1319239169000,1.323279e+12,33.027048,-96.788402,"La Madeline","Plano"
"15986081","Down the less traversed Vietnamese path",1294619577000,1295823600000,32.946033,-96.681396,"Nam Hua Vietnamese Cuisine","Garland"
"60661092","Pet and Family Fun Day & 1K / 5K Run/Walk",1334506209000,1335722400000,33.034428,-96.659431,"Bob Woodruff Park","Plano"
"60546792","Second Annual Bark for a Cure Trot for Trooper 5k",1334413264000,1335722400000,33.034428,-96.659431,"Bob Woodruff Park","Plano"
"wqkdnyppblb","Build Your Real Estate Power Team Today!",1268852408000,1320798600000,32.674377,-97.008934,"Spring Creek BBQ","Grand Prairie"
"dqnvkdyrcblb","The Anatomy of a Wholesale Flip Revealed!!",1347384504000,1357691400000,32.674377,-97.008934,"Spring Creek BBQ","Grand Prairie"
"dqnvkdyrdbqb","Real Estate Bird Dog Secrets",1351807843000,1360715400000,32.674377,-97.008934,"Spring Creek BBQ","Grand Prairie"
"wqkdnyqkbnb","Create a $5k - $10k Monthly Income thru Real Estate Investing",1339075689000,1.341963e+12,32.674377,-97.008934,"Spring Creek BBQ","Grand Prairie"
"dqnvkdyqnbmb","Real Estate Law for Texas Investors - Get the Answers!",1347509505000,1349825400000,32.674377,-97.008934,"Spring Creek BBQ","Grand Prairie"
"dqnvkdyqqbpb","8th Annual Mastermind Round Table & Toy Drive",1351138436000,1355272200000,32.674377,-97.008934,"Spring Creek BBQ","Grand Prairie"
"wqkdnyqdbsb","Happy Valentines Day - Feb 14th Meeting Cancelled",1325637677000,1329265800000,32.674377,-97.008934,"Spring Creek BBQ","Grand Prairie"
"wqkdnypqbrb","7th Annual Christmas Networking Party & Toy Drive",1268852408000,1323822600000,32.674377,-97.008934,"Spring Creek BBQ","Grand Prairie"
"wqkdnyqjbqb","Close More Deals with Direct Mail Secrets Revealed",1337195293000,1339543800000,32.674377,-97.008934,"Spring Creek BBQ","Grand Prairie"
"wqkdnypmbrb","Make It Big Flipping Apartments Using None of Your Own Money!",1268852408000,1315956600000,32.674377,-97.008934,"Spring Creek BBQ","Grand Prairie"
"wqkdnyqgbnb","Learn To Create a Lifetime of Residual Cashflow: Buy & Pay Off 10 Houses",1332169086000,1334100600000,32.674377,-97.008934,"Spring Creek BBQ","Grand Prairie"
"85226262","Abraham-Hicks - This Friday's In-Powerment Group at CSL",1349228518000,1349481600000,32.940534,-96.827839,"Center for Spiritual Living","Dallas"
"89851112","Journey Through the Magic of Your Mind",1351994608000,1355014800000,32.940534,-96.827839,"Center for Spiritual Living","Dallas"
"65666892","Lessons from the Heart: HeartMath",1337598251000,1.341171e+12,32.940534,-96.827839,"Center for Spiritual Living","Dallas"
"8275117","Abraham-Hicks Law of Attraction/Art of Allowing",1215143749000,1215820800000,32.940534,-96.827839,"Center for Spiritual Living","Dallas"
"77711112","In-Powerment Group / PAX: Understanding Masculine and Feminine Instincts",1344963569000,1345246200000,32.940534,-96.827839,"Center for Spiritual Living","Dallas"
"73140122","An In-Powering Look at The New Science of Adult Attachment",1342144615000,1342828800000,32.940534,-96.827839,"Center for Spiritual Living","Dallas"
"72370022","Taiko Drumming and Drum Circle",1341693273000,1342915200000,32.940534,-96.827839,"Center for Spiritual Living","Dallas"
"96174222","The SELF InPowerment Group at CSL - PowerShifting Through 2013",1356119903000,1356742800000,32.940534,-96.827839,"Center for Spiritual Living","Dallas"
"8821353","Special Event--Realizing the Strength and Power Within.",1222227945000,1.223424e+12,32.940534,-96.827839,"Center for Spiritual Living","Dallas"
"86388032","The In-Powerment Group - Emotional Intelligence; Utilizing and Improving Yours",1349892499000,1350086400000,32.940534,-96.827839,"Center for Spiritual Living","Dallas"
"8648794","Collin/Denton Memory Walk",1220042298000,1223119800000,33.115002,-96.628598,"Celebration Park","Allen"
"12779649","Churascaria Dinner in Irving",1267685623000,1269046800000,32.813035,-96.946581,"Villa's Grill","Irving"
"36236732","Checking 500 homeless into the Hyatt = Soupmobile Christmas Angel Project = FUN!",1317824473000,1.324737e+12,32.775927,-96.809374,"Hyatt Regency Dallas at Reunion","Dallas"
"13254057","Dinner Ride to Zenna Thai and Japanese in Plano",1271898295000,1273881600000,33.031207,-96.707361,"ZENNA THAI/JAPANESE RESTAURANT","Plano"
"11848330","Dinner Ride to Zenna's in Plano",1257914142000,1260579600000,33.031207,-96.707361,"ZENNA THAI/JAPANESE RESTAURANT","Plano"
"dgrzddyqqbkb","Women of Reason Feminine Friday--Cross list with FoF",1343748485000,1354926600000,32.951588,-96.803108,"Fadi's Mediterranean Grill","Dallas"
"56655942","FREE Concert's @The Harbor",1331937761000,1336690800000,32.88319,-96.465697,"The Harbor","Rockwall"
"40942332","Ladies Night Out....Dinner ,Movie - Drinks & Music",1321138632000,1322263800000,32.88319,-96.465697,"The Harbor","Rockwall"
"56657402","FREE Concert's @The Harbor",1331938499000,1340319600000,32.88319,-96.465697,"The Harbor","Rockwall"
"56656222","FREE Concert's @The Harbor",1331938025000,1337900400000,32.88319,-96.465697,"The Harbor","Rockwall"
"56656312","FREE Concert's @The Harbor",1331938138000,1338505200000,32.88319,-96.465697,"The Harbor","Rockwall"
"56626172","FREE Concert's @The Harbor",1331920942000,1337295600000,32.88319,-96.465697,"The Harbor","Rockwall"
"59751762","Brunch-after party.",1333919580000,1335029400000,32.784355,-96.781318,"Maraca's","Dallas"
"43493052","DEEP @ Monica's Aca Y Alla",1323122827000,1.323225e+12,32.784355,-96.781318,"Maraca's","Dallas"
"16533706","Ireland Forever at Trinity Hall",1297463118000,1299976200000,32.837822,-96.776167,"Trinity Hall Irish Pub & Restaurant","Dallas"
"39319212","Lindsay's Alter Ego Party",1320033051000,1321671600000,32.953392,-96.835892,"BlackFinn","Addison"
"20212881","Happy Hour Meet n Greet at Black Finn Addison",1306736351000,1307572200000,32.953392,-96.835892,"BlackFinn","Addison"
"16922588","RAK's 4th Anniversary Celebration benefiting RED CROSS aid to JAPAN",1300149308000,1302906600000,32.953392,-96.835892,"BlackFinn","Addison"
"15870878","Third Thursday Happy Hour at the Black Finn!!!!",1293829721000,1.295568e+12,32.953392,-96.835892,"BlackFinn","Addison"
"15105376","Veterans Day Happy Hour and Fundraiser",1287031006000,1289518200000,32.953392,-96.835892,"BlackFinn","Addison"
"8243357","Inner Peace-Inner Power Retreat",1214793583000,1221238800000,33.87871,-96.636088,"Sundance Camp","Pottsboro"
"12146019","HIKE @ THE HEARD - Night Hike & Dinner",1261780560000,1264291200000,33.159275,-96.616264,"Heard Museum","McKinney"
"12146026","HIKE @ NIGHT!!!) Heard Museum - McKinney, TX (Dinner afterwards)",1261780656000,1271548800000,33.159275,-96.616264,"Heard Museum","McKinney"
"8820915","FREE Intro Evening w/ Bob Stevens: Conscious Language, Bio-Optic Holography.....",1222224594000,1223683200000,33.024916,-96.649574,"Isaac & Courtney's Community Home","Plano"
"31955472","Cowboys Red River - Free Dance Lessons",1314930913000,1315526400000,32.861775,-96.897911,"Cowboys Red River","Dallas"
"36162842","Cowboys Red River Birthday Night",1317767668000,1.318032e+12,32.861775,-96.897911,"Cowboys Red River","Dallas"
"dtrcpynpbvb","Networking @ Vista Ridge ",1280079880000,1289928600000,33.00526,-96.973868,"Spring Creek Barbeque","Lewisville"
"dtrcpynqbkb","Networking @ Vista Ridge ",1280079880000,1.291743e+12,33.00526,-96.973868,"Spring Creek Barbeque","Lewisville"
"dtrcpypcbxb","Networking @ Vista Ridge ",1280079880000,1295371800000,33.00526,-96.973868,"Spring Creek Barbeque","Lewisville"
"dtrcpynlbnb","Networking @ Vista Ridge ",1280146750000,1281457800000,33.00526,-96.973868,"Spring Creek Barbeque","Lewisville"
"dtrcpynpbmb","Networking @ Vista Ridge ",1280079880000,1289323800000,33.00526,-96.973868,"Spring Creek Barbeque","Lewisville"
"dtrcpynmblc","Networking @ Vista Ridge ",1280079880000,1285691400000,33.00526,-96.973868,"Spring Creek Barbeque","Lewisville"
"dtrcpynlbgc","Networking @ Vista Ridge ",1280240275000,1282667400000,33.00526,-96.973868,"Spring Creek Barbeque","Lewisville"
"dtrcpynnbzb","Networking @ Vista Ridge ",1280079880000,1287505800000,33.00526,-96.973868,"Spring Creek Barbeque","Lewisville"
"dtrcpynlbwb","Networking @ Vista Ridge ",1280240141000,1282062600000,33.00526,-96.973868,"Spring Creek Barbeque","Lewisville"
"dtrcpynmbcc","Networking @ Vista Ridge ",1284462481000,1285086600000,33.00526,-96.973868,"Spring Creek Barbeque","Lewisville"
"50249982","FRIENDS A DANCING",1327949043000,1328059800000,32.947045,-96.699892,"W.W. Fairfield's ","Richardson"
"dxtmbcypmbrb","Basic Progressive Double Two Dance Class @ W.W. Fairfields",1315180491000,1.315962e+12,32.947045,-96.699892,"W.W. Fairfield's ","Richardson"
"dxtmbcypmbbc","Basic Progressive Double Two Dance Class @ W.W. Fairfields",1315180491000,1316566800000,32.947045,-96.699892,"W.W. Fairfield's ","Richardson"
"pglbwypkbzb","West Coast Swing @ W.W. Fairfields",1310316333000,1311122700000,32.947045,-96.699892,"W.W. Fairfield's ","Richardson"
"65568752","DANCING WITH FRIENDS",1337528615000,1.337733e+12,32.947045,-96.699892,"W.W. Fairfield's ","Richardson"
"cphvxyplbvb","Progressive Double Two Step @ W.W. Fairfields",1312817116000,1.313541e+12,32.947045,-96.699892,"W.W. Fairfield's ","Richardson"
"dxtmbcypmbjb","Basic Progressive Double Two Dance Class @ W.W. Fairfields",1315180491000,1315357200000,32.947045,-96.699892,"W.W. Fairfield's ","Richardson"
"pglbwypkbqb","Progress Double Two @ W.W. Fairfields",1310316333000,1310517900000,32.947045,-96.699892,"W.W. Fairfield's ","Richardson"
"cshvxyplbgc","WCS @ W. W. Fairfields",1312817333000,1314230400000,32.947045,-96.699892,"W.W. Fairfield's ","Richardson"
"dqpbdcypnbhb","West Coast Swing @ W.W. Faifields",1317218306000,1317859200000,32.947045,-96.699892,"W.W. Fairfield's ","Richardson"
"dqpbdcypnbjc","West Coast Swing @ W.W. Faifields",1319051808000,1319673600000,32.947045,-96.699892,"W.W. Fairfield's ","Richardson"
"dqpbdcypnbzb","West Coast Swing @ W.W. Faifields",1317218306000,1319068800000,32.947045,-96.699892,"W.W. Fairfield's ","Richardson"
"45545852","Progressive Double Two Lessons and Social Dancing",1324954549000,1325035800000,32.947045,-96.699892,"W.W. Fairfield's ","Richardson"
"7949819","EVENT:  Night Shoot of Dallas Building and Monuments II",1210915933000,1216515600000,32.782674,-96.798534,"Thansgiving Square (Dallas)","Dallas"
"12284602","Happy Birthday Harry & Happy 3rd Anniversary HPDFW",1263194032000,1280617200000,32.963703,-96.981422,"Drake's House","Coppell"
"26369341","The New Social House",1311132295000,1311719400000,32.951931,-96.820574,"Addison, Village on the Parkway","Addison"
"9418786","Funny Sat. Night Comedy - Yes Man",1230828931000,1231033500000,32.868831,-96.770719,"North Park Center","Dallas"
"11252166","Capitalism:  A Love Story ",1251763925000,1254959100000,32.868831,-96.770719,"North Park Center","Dallas"
