"event_id","event_name","event_created","event_time","event_venue_lat","event_venue_lon","venue_name","venue_city"
"cnmgtypqbdb","NLP Drop-In Training - An Introduction to NLP - Richardson",1307806920000,1322870400000,32.939125,-96.738251,"Positive Touch Conference Center","Richardson"
"bwnpqypfbwb","Jazz and refreshing Martinis at Sullivans",1275615168000,1300402800000,32.991386,-96.831268,"Sullivan's Steakhouse","Dallas"
"bwnpqypfbfb","Happy Hour Martinis and Music at Sullivans",1275615168000,1302220800000,32.991386,-96.831268,"Sullivan's Steakhouse","Dallas"
"12271696","Hard Nights Day @ Sullivans Steakhouse ",1263068712000,1264906800000,32.991386,-96.831268,"Sullivan's Steakhouse","Dallas"
"69222502","Speedzone",1339715432000,1355621400000,32.884746,-96.899578,"Speedzone","Dallas"
"84314522","Explore: Speedzone",1348719351000,1351036800000,32.884746,-96.899578,"Speedzone","Dallas"
"16576398","Let's discuss what we want out of the Group.",1297801605000,1297990800000,32.95323,-96.854674,"Dunn Bros Coffee","addison"
"11321429","Explore: Wakeboarding, Waterskiing, & Tubing",1252444746000,1254056400000,33.003803,-96.918327,"Pier 121 Marina","Lewisville"
"29112971","Addison Oktoberfest",1313075488000,1316215800000,32.960968,-96.826857,"Addison Circle Park","Addison"
"32887862","Shakespeare in the Park: Hamlet",1315579982000,1318120200000,32.960968,-96.826857,"Addison Circle Park","Addison"
"cpzrwyqhbfc","Dallas Area Investor's Business Daily Monthly Meetup",1332782456000,1337815800000,33.032051,-96.771217,"Haggard Library","Plano"
"qtdmsdyqqbjc","Dallas Area Investor's Business Daily Monthly Meetup",1340406226000,1.357173e+12,33.032051,-96.771217,"Haggard Library","Plano"
"59921892","Kick Off meeting with special guest speaker from Investor Business Daily",1334023481000,1.335915e+12,33.032051,-96.771217,"Haggard Library","Plano"
"cpzrwyqdbdc","Dallas Area Investor's Business Daily Monthly Meetup",1326675035000,1.329957e+12,33.032051,-96.771217,"Haggard Library","Plano"
"11855457","What's up for next year?",1257991275000,1261947600000,32.893902,-96.80275,"Borders Books at Preston Royal Shopping Center, SE corner","Dallas"
"53365182","August Osage County- Watertower Theater",1329937628000,1333846800000,32.962155,-96.828629,"Watertower Theater","Addison"
"wflwpynqbmb","Thursday's Best  East Coast / West Coast Swing Classes",1290104678000,1291944600000,33.011615,-96.9061,"Rosemeade Rec. Center","Carrollton"
"wflwpynqbdb","Thursday's Best  East Coast / West Coast Swing Classes",1290104678000,1291339800000,33.011615,-96.9061,"Rosemeade Rec. Center","Carrollton"
"13221593","Beginner basics, Interm and Advpatterns in C&W, Ballroom, Latin dance - Week 3",1271651296000,1274401800000,33.011615,-96.9061,"Rosemeade Rec. Center","Carrollton"
"14679991","Carrollton-Beg C&W/Ballroom&Beginner/Int ProgDouble 2Step,East Coast Swing-Wk2",1283831181000,1284078600000,33.011615,-96.9061,"Rosemeade Rec. Center","Carrollton"
"wflwpynqbvb","Thursday's Best  East Coast / West Coast Swing Classes",1290104678000,1292549400000,33.011615,-96.9061,"Rosemeade Rec. Center","Carrollton"
"gppspynnblc","The Best Dance Lessons Start Thursday ",1287004576000,1288312200000,33.011615,-96.9061,"Rosemeade Rec. Center","Carrollton"
"wjsqpynnbbc","The Best Dance Lessons Start Thursday ",1287004576000,1.287621e+12,33.011615,-96.9061,"Rosemeade Rec. Center","Carrollton"
"wjsqpynnbcc","The Best Dance Lessons Start Thursday ",1287004576000,1287707400000,33.011615,-96.9061,"Rosemeade Rec. Center","Carrollton"
"vnpspynnbkc","The Best Dance Lessons Start Thursday ",1287004576000,1288312200000,33.011615,-96.9061,"Rosemeade Rec. Center","Carrollton"
"12046828","Self-Esteem and Visualization Workshop and Discussion",1260310730000,1291942800000,32.940534,-96.827839,"Center for Spiritual Living","Dallas"
"12046814","Self-Esteem and Visualization Workshop and Discussion",1260310651000,1289523600000,32.940534,-96.827839,"Center for Spiritual Living","Dallas"
"87310362","Abraham-Hicks - This Friday's In-Powerment Group at CSL",1350438632000,1350691200000,32.940534,-96.827839,"Center for Spiritual Living","Dallas"
"16740359","Ben De La Vega’s Annual Black and White Ball",1298929145000,1.313883e+12,32.930002,-96.820424,"Westin Hotel Galleria ","Dallas"
"pvsmrypmbjc","Monday Irving Bible Church ride",1305550356000,1.317078e+12,32.916206,-96.981995,"Irving Bible Church","Irving"
"10812666","Boomers Re-loaded: Job Survival Strategies",1246894939000,1.253394e+12,32.953592,-96.81674,"la Madeleine","Dallas"
"10812560","Community Building: Social Networking 101 ",1246894220000,1250373600000,32.953592,-96.81674,"la Madeleine","Dallas"
"wgmwqypjbgb","Yucatan Idol Contest",1303098214000,1307239200000,32.952881,-96.940674,"Yucatan Beach Club","Coppell"
"rfmwqypjbgb","Yucatan Idol Contest",1303096649000,1307239200000,32.952881,-96.940674,"Yucatan Beach Club","Coppell"
"dcltfcyqcbnb","Castle Hills Netweavers - Business Networking Group",1325594575000,1326216600000,33.079155,-96.894457,"Angelina's Mexican Restaurant","The Colony"
"89577842","Scenergy and Lock & Key Present:  Lock & Key Singles Event Nov. 30 (Ages 25-49)",1351820422000,1354325400000,32.953392,-96.835892,"BlackFinn","Addison"
"11906395","Mastermind Information Meeting... Get Your Questions Answered...",1258581560000,1260550800000,32.953392,-96.835892,"BlackFinn","Addison"
"qpxbhcyqdbcc","HPM Dallas Business Networking Monthly Mixer",1326306705000,1329861600000,32.953392,-96.835892,"BlackFinn","Addison"
"16922588","RAK's 4th Anniversary Celebration benefiting RED CROSS aid to JAPAN",1300149308000,1302906600000,32.953392,-96.835892,"BlackFinn","Addison"
"10202032","Patriots @ Jets",1239921125000,1.253466e+12,32.953392,-96.835892,"BlackFinn","Addison"
"15408138","#DFWWP 2010 Holiday Party at BlackFinn in Addison",1289427305000,1291489200000,32.953392,-96.835892,"BlackFinn","Addison"
"pfqlzyqkbwb","HPM Dallas Business Networking Monthly Mixer",1336672907000,1342558800000,32.953392,-96.835892,"BlackFinn","Addison"
"11575340","Joomla! User Group - Dallas / Fort Worth  - Cory Webb Speaks on Template Design",1254955770000,1.263258e+12,32.953392,-96.835892,"BlackFinn","Addison"
"11575472","Joomla! User Group - DFW - Video and Your Joomla Site",1254957004000,1260838800000,32.953392,-96.835892,"BlackFinn","Addison"
"72955522","Red River",1342046479000,1352595600000,32.861775,-96.897911,"Cowboys Red River","Dallas"
"11616703","North Texas Church of Freethought November Meetup",1255447725000,1289147400000,32.91577,-97.007378,"Wyndham DFW Airport North","Irving"
"9374685","North Texas Church of Freethought September Meetup",1229923807000,1.252251e+12,32.91577,-97.007378,"Wyndham DFW Airport North","Irving"
"cckkvyrdbzb","Networking @ Vista Ridge",1309350207000,1.361295e+12,33.00526,-96.973868,"Spring Creek Barbeque","Lewisville"
"dtrcpypfbtb","Networking @ Vista Ridge ",1280079880000,1300206600000,33.00526,-96.973868,"Spring Creek Barbeque","Lewisville"
"dtrcpynlbnb","Networking @ Vista Ridge ",1280146750000,1281457800000,33.00526,-96.973868,"Spring Creek Barbeque","Lewisville"
"bsrzqyphbgc","Networking @ Vista Ridge ",1280079880000,1306254600000,33.00526,-96.973868,"Spring Creek Barbeque","Lewisville"
"cckkvyrkbmb","Networking @ Vista Ridge",1309350207000,1360087200000,33.00526,-96.973868,"Spring Creek Barbeque","Lewisville"
"dtrcpynmblc","Networking @ Vista Ridge ",1280079880000,1285691400000,33.00526,-96.973868,"Spring Creek Barbeque","Lewisville"
"bsrzqyphbwb","Networking @ Vista Ridge",1280079880000,1305649800000,33.00526,-96.973868,"Spring Creek Barbeque","Lewisville"
"cckkvyrcbdc","Networking @ Vista Ridge",1309350207000,1360085400000,33.00526,-96.973868,"Spring Creek Barbeque","Lewisville"
"dtrcpynnbzb","Networking @ Vista Ridge ",1280079880000,1287505800000,33.00526,-96.973868,"Spring Creek Barbeque","Lewisville"
"dtrcpynmbsb","Networking @ Vista Ridge ",1280079880000,1284481800000,33.00526,-96.973868,"Spring Creek Barbeque","Lewisville"
"cckkvyqcbnb","Networking @ Vista Ridge",1322100635000,1326216600000,33.00526,-96.973868,"Spring Creek Barbeque","Lewisville"
"dtrcpynmbkb","Networking @ Vista Ridge ",1280240374000,1.283877e+12,33.00526,-96.973868,"Spring Creek Barbeque","Lewisville"
"cckkvyqgbnb","Networking @ Vista Ridge",1332759604000,1334075400000,33.00526,-96.973868,"Spring Creek Barbeque","Lewisville"
"cckkvyrfbhb","Networking @ Vista Ridge",1309350207000,1362504600000,33.00526,-96.973868,"Spring Creek Barbeque","Lewisville"
"dtrcpynnbqb","Networking @ Vista Ridge ",1280079880000,1.286901e+12,33.00526,-96.973868,"Spring Creek Barbeque","Lewisville"
"bsrzqyphbpc","Networking @ Vista Ridge ",1280079880000,1306859400000,33.00526,-96.973868,"Spring Creek Barbeque","Lewisville"
"dtrcpynnbhb","Networking @ Vista Ridge ",1280079880000,1286296200000,33.00526,-96.973868,"Spring Creek Barbeque","Lewisville"
"cckkvyqqbhc","Networking @ Vista Ridge",1309350207000,1356456600000,33.00526,-96.973868,"Spring Creek Barbeque","Lewisville"
"15910290","HP Game Night",1294130607000,1.308438e+12,32.963703,-96.981422,"Drake's House","Coppell"
"28700931","Fundraiser - Happy Hour at The Social House in Addison",1312826003000,1.313712e+12,32.951931,-96.820574,"Addison, Village on the Parkway","Addison"
"26369341","The New Social House",1311132295000,1311719400000,32.951931,-96.820574,"Addison, Village on the Parkway","Addison"
"13554930","Business Sense Meets Design Sense - a special event at IKEA Frisco",1274468537000,1276003800000,33.094181,-96.820465,"IKEA Dallas","Frisco"
"rjcmnypgbkb","The NEW Let's Network & WIN! (First Thursday In Grapevine)",1271737912000,1302220800000,32.973736,-97.037501,"Starbucks by Grapevine Mills Mall","Grapevine"
"47731872","Explore: Broomball",1326322560000,1.329696e+12,32.929881,-96.819424,"Galleria Dallas Play Place","Dallas"
"32538692","There's a beginner bicycle maintenance class at REI.",1315360741000,1317340800000,33.030458,-96.794747,"REI","Plano"
"12065286","Dallas.js: JavaScript North - Part 2 of 2: Server-side JavaScript",1260544104000,1.263258e+12,32.952425,-96.838366,"The Londoner","Addison"
"67837692","Friday at the Londoner Pub Addison for Happy Hour!",1338909500000,1341007200000,32.952425,-96.838366,"The Londoner","Addison"
"65566782","Let's Meetup at the Londoner Pub Addison for Happy Hour!",1337527841000,1.338588e+12,32.952425,-96.838366,"The Londoner","Addison"
"tmqwnynpbjb","First Saturday Contra Dance ",1277319879000,1289089800000,32.951846,-96.907659,"Plaza Arts Center","Carrollton"
"12037901","First Saturday Contra Dance ",1260217913000,1267925400000,32.951846,-96.907659,"Plaza Arts Center","Carrollton"
"12037907","First Saturday Contra Dance ",1260217979000,1272760200000,32.951846,-96.907659,"Plaza Arts Center","Carrollton"
"12037896","First Saturday Contra Dance -- Special Band!!!",1260217886000,1265506200000,32.951846,-96.907659,"Plaza Arts Center","Carrollton"
"12037902","First Saturday Contra Dance ",1260217933000,1.270341e+12,32.951846,-96.907659,"Plaza Arts Center","Carrollton"
"tmqwnypgbdb","First Saturday Contra Dance ",1277319879000,1301790600000,32.951846,-96.907659,"Plaza Arts Center","Carrollton"
"tmqwnypnbcb","Special Guest Band = The Noteboys! at our First Saturday Contra Dance",1277319879000,1317515400000,32.951846,-96.907659,"Plaza Arts Center","Carrollton"
"11237923","HOLIDAY CONTRA Dance ",1251647864000,1.260063e+12,32.951846,-96.907659,"Plaza Arts Center","Carrollton"
"tmqwnyphbkb","First Saturday Contra Dance ",1277319879000,1304814600000,32.951846,-96.907659,"Plaza Arts Center","Carrollton"
"tmqwnyrcbhb","First Saturday Contra Dance ",1277319879000,1357435800000,32.951846,-96.907659,"Plaza Arts Center","Carrollton"
"tmqwnypjbgb","First Saturday Contra Dance ",1277319879000,1307233800000,32.951846,-96.907659,"Plaza Arts Center","Carrollton"
"tmqwnynqbgb","First Saturday Contra Dance ",1277319879000,1291512600000,32.951846,-96.907659,"Plaza Arts Center","Carrollton"
"tmqwnyrfbdb","First Saturday Contra Dance",1277319879000,1.362276e+12,32.951846,-96.907659,"Plaza Arts Center","Carrollton"
"11237915","First Saturday Contra Dance",1251647830000,1257643800000,32.951846,-96.907659,"Plaza Arts Center","Carrollton"
"tmqwnypdbhb","First Saturday Contra Dance ",1277319879000,1296955800000,32.951846,-96.907659,"Plaza Arts Center","Carrollton"
"tmqwnypfbhb","First Saturday Contra Dance ",1277319879000,1.299375e+12,32.951846,-96.907659,"Plaza Arts Center","Carrollton"
"tmqwnyrpbdb","First Saturday Contra Dance",1277319879000,1383440400000,32.951846,-96.907659,"Plaza Arts Center","Carrollton"
"tmqwnyrgbjb","First Saturday Contra Dance",1277319879000,1365296400000,32.951846,-96.907659,"Plaza Arts Center","Carrollton"
"tmqwnyrdbdb","First Saturday Contra Dance",1277319879000,1359856800000,32.951846,-96.907659,"Plaza Arts Center","Carrollton"
"zstsnynjbfc","Norht Dallas Networkers",1275746213000,1277308800000,32.996166,-96.829058,"Picasso's Pizza and Grill","Dallas"
"qqdgqypnbhb","NDN monthly SEO training 1st Wednesdays 2pm at Picasso's",1294927370000,1317841200000,32.996166,-96.829058,"Picasso's Pizza and Grill","Dallas"
"59903052","Characteristics of Top Performers- Betsy Allen-Speaker/Corporate Trainer",1334015397000,1335891600000,32.997649,-96.829042,"Picassos Pizza & Grill","Dallas"
"16123161","Southwestern Invitational DanceSport Competition  - Dallas",1295556627000,1316822400000,32.922072,-96.771333,"Westin Hotel","Dallas"
"71315892","Southwestern Invitational DanceSport Competition - DAY 3",1340998183000,1349017200000,32.922072,-96.771333,"Westin Hotel","Dallas"
"71314332","Southwestern Invitational DanceSport Competition  - Dallas",1340997338000,1348876800000,32.922072,-96.771333,"Westin Hotel","Dallas"
"16494709","Southwestern Invitational DanceSport Competition  - Dallas",1297205236000,1316962800000,32.922072,-96.771333,"Westin Hotel","Dallas"
"16494695","Southwestern Invitational DanceSport Competition  - Dallas",1297205159000,1316876400000,32.922072,-96.771333,"Westin Hotel","Dallas"
"85797602","2-day Basic Pistol Course",1349544203000,1352557800000,32.96,-96.89,"Dallas Pistol Club","Carrollton"
"11267136","Know What Business You're Really In-Rich Allen ACTION COACH",1251890098000,1.255437e+12,32.952648,-96.822027,"The Dream Cafe","Dallas"
"pkcdsypmbkc","Cirque Out",1306356890000,1317171600000,32.959623,-96.730986,"Richardson City Hall / Civic Center Fountain Plaza","Richardson"
"krxrnyrdbfc","Fourth Saturday Social,  Dance Lessons and Social Dance - Carrollton  $10   8-11",1274880049000,1361671200000,32.956726,-96.91412,"The Dance Studio","Carrollton"
"12703288","DANCE PARTY  TUESDAYS  WEST COAST SWING & RUMBA  CARROLLTON  7  &  8:15",1267075734000,1.267578e+12,32.956726,-96.91412,"The Dance Studio","Carrollton"
"krxrnyrfbfc","Fourth Saturday Social,  Dance Lessons and Social Dance - Carrollton  $10   8-11",1274880049000,1364086800000,32.956726,-96.91412,"The Dance Studio","Carrollton"
"krxrnyrgbkc","Fourth Saturday Social,  Dance Lessons and Social Dance - Carrollton  $10   8-11",1274880049000,1367110800000,32.956726,-96.91412,"The Dance Studio","Carrollton"
"12703270","DANCE PARTY    EAST COAST SWING - MONDAYS - 8 PM  CARROLLTON",1267075594000,1267495200000,32.956726,-96.91412,"The Dance Studio","Carrollton"
"11006488","DANCE PARTY  Ballroom Waltz - Beginner & the Next Level  8 pm Carrollton  $10",1249102596000,1250643600000,32.956726,-96.91412,"The Dance Studio","Carrollton"
"11255278","DANCE PARTY - SOCIAL DANCE & TIPS - THURSDAYS  CARROLLTON   SAMBA",1251783107000,1253235600000,32.956726,-96.91412,"The Dance Studio","Carrollton"
"krxrnyrqblc","Fourth Saturday Social,  Dance Lessons and Social Dance - Carrollton  $10   8-11",1274880049000,1388282400000,32.956726,-96.91412,"The Dance Studio","Carrollton"
"krxrnyrhbhc","Fourth Saturday Social,  Dance Lessons and Social Dance - Carrollton  $10   8-11",1274880049000,1.36953e+12,32.956726,-96.91412,"The Dance Studio","Carrollton"
"krxrnyrcbjc","Fourth Saturday Social,  Dance Lessons and Social Dance - Carrollton  $10   8-11",1274880049000,1.359252e+12,32.956726,-96.91412,"The Dance Studio","Carrollton"
"11006506","DANCE PARTY  Ballroom Waltz - Beginner & the Next Level  8 pm Carrollton  $10",1249102746000,1251248400000,32.956726,-96.91412,"The Dance Studio","Carrollton"
"pzqhxyrlbnb","Second Saturday Social - Dancing in One Room - Lessons in Another  $10",1312063959000,1376182800000,32.956726,-96.91412,"The Dance Studio","Carrollton"
"pzqhxypnblb","Second Saturday Social - Dancing in One Room - Lessons in Another  $10",1312063959000,1.318122e+12,32.956726,-96.91412,"The Dance Studio","Carrollton"
"krxrnyqqbdc","Fourth Saturday Social,  Dance Lessons and Social Dance - Carrollton  $10   8-11",1274880049000,1.356228e+12,32.956726,-96.91412,"The Dance Studio","Carrollton"
"krxrnyrlbgc","Fourth Saturday Social,  Dance Lessons and Social Dance - Carrollton  $10   8-11",1274880049000,1377392400000,32.956726,-96.91412,"The Dance Studio","Carrollton"
"12178153","DANCE PARTY  THURSDAYS  THREE STEP & PROGRESSIVE DBLE 2  CARROLLTON  7  &  8:15",1262205756000,1264726800000,32.956726,-96.91412,"The Dance Studio","Carrollton"
"12062716","HumanLight Celebration ",1260494812000,1.26153e+12,32.958212,-96.797736,"Mindi's House","Dallas"
"cdwbvypkbkb","Korean Study Group in Dallas",1308888467000,1310083200000,32.89658,-96.898895,"Mozart Bakery / Cafe","Dallas"
"7521546","Texas Houses for Pennies-Darius M. Barazandeh ",1205368409000,1210807800000,32.926273,-96.771233,"Crowne Plaza Suites - Park Central","Dallas"
"7838216","KABBALAH: The Best Kept Secret- an Exciting live event",1209507858000,1212346800000,32.926273,-96.771233,"Crowne Plaza Suites - Park Central","Dallas"
"13311135","T-SAFE And Owner Financing - Can They Co-Exist???",1272406904000,1276124400000,32.926273,-96.771233,"Crowne Plaza Suites - Park Central","Dallas"
"12065770","February General Meeting",1260550629000,1266539400000,32.926273,-96.771233,"Crowne Plaza Suites - Park Central","Dallas"
"12524472","MaryAnn Russ - Director of Dallas Housing Authority -  Section 8  Housing",1265341234000,1268266500000,32.926273,-96.771233,"Crowne Plaza Suites - Park Central","Dallas"
"12535384","Blue Fish Sushi Happy Hour & New Friends Mixer",1265470292000,1266276600000,32.996406,-96.830534,"Blue Fish","Dallas"
"nrghpynmbwb","The Speaker Co-op Monthly Meetup",1281066858000,1284740100000,32.900024,-96.767181,"Studio Movie Grill - Dallas","Dallas"
"15910273","Harry Potter & The Deathly Hallows (Pt. 2) Movie Premiere",1294130166000,1310700600000,32.900024,-96.767181,"Studio Movie Grill - Dallas","Dallas"
"tffhqypdbxb","The Speaker Co-op DFW Monthly Meetup",1295465145000,1298049300000,32.900024,-96.767181,"Studio Movie Grill - Dallas","Dallas"
"kzxgnypjbcb","NEW Co-ed Business Building Luncheon-Lewisville Chapter",1269452010000,1306944900000,33.016891,-96.981616,"On The Border Mexican Grill","Lewisville"
"68053052","Dinner at On The Border: Lewisville",1339017852000,1340841600000,33.016891,-96.981616,"On The Border Mexican Grill","Lewisville"
"10762430","Art of Spiritual Dreaming book discussion",1246304934000,1247943600000,32.974871,-96.903074,"Dallas Area Eckankar Center","Carrollton"
"qlmpmcyqkbdc","ECK Worship Service",1342201510000,1342972800000,32.974871,-96.903074,"Dallas Area Eckankar Center","Carrollton"
"79449682","Happy Hour and House music at Firefly",1346006611000,1347058800000,32.950573,-96.839898,"Firefly","Addison"
"13542507","Social Meetup Ginger Man PLANO",1274367591000,1276646400000,33.077635,-96.821378,"Angelika Film Center / Plano","Plano"
"7767228","Then She Found Me",1208567801000,1210544100000,33.077635,-96.821378,"Angelika Film Center / Plano","Plano"
"49076062","OSHO MEDITATION  RETREAT WITH SWAMI ANAND ARUN",1327193594000,1334329200000,33.132931,-96.933911,"Hidden Cove Park & Marina","The Colony"
"12010778","December's Laughter Luncheon",1259869603000,1260554400000,32.933299,-96.817381,"Capriccio Ristorante - Dallas - closed","Dallas"
"14082130","Creating Search Engine Friendly Content Using Text And Video",1278974364000,1281484800000,32.933299,-96.817381,"Capriccio Ristorante - Dallas - closed","Dallas"
"15552400","Private Party - Sushi Feast",1290654076000,1.292202e+12,33.043988,-96.793127,"Miyoshi Japanese Restaurant","Plano"
"hjjjnynnbdc","Game Night",1270136257000,1.287792e+12,32.860458,-96.889686,"IHOP","Dallas"
"hjjjnynnbtb","Game Night",1270136257000,1287187200000,32.860458,-96.889686,"IHOP","Dallas"
"hjjjnynnbmc","Game Night",1270136257000,1288396800000,32.860458,-96.889686,"IHOP","Dallas"
"hjjjnynpbhb","Game Night",1270136257000,1289001600000,32.860458,-96.889686,"IHOP","Dallas"
"15912639","Social Dinner - Italian",1294156497000,1297555200000,32.907925,-96.872803,"Two Guys from Italy","Dallas"
"mzkdnynjbxb","Plan your day with us June 18: Speaker Co-op followed by Nothing but Net",1272753196000,1276877700000,32.954632,-96.813098,"Studio Movie Grill - Addison - Closed","Addison"
"mzkdnynhbcc","The Speaker Co-op Monthly Meetup",1268884776000,1274458500000,32.954632,-96.813098,"Studio Movie Grill - Addison - Closed","Addison"
"13016778","Meet NBC 5's Kim Fischer at our April 12th Luncheon",1269810167000,1271089800000,32.954632,-96.813098,"Studio Movie Grill - Addison - Closed","Addison"
"14021188","FUNimation At The Movies - August Screening",1278455104000,1.281483e+12,32.954632,-96.813098,"Studio Movie Grill - Addison - Closed","Addison"
"13194178","FUNimation At The Movies - June Screening",1271364268000,1276039800000,32.954632,-96.813098,"Studio Movie Grill - Addison - Closed","Addison"
"10689324","The Speaker Co-op July Meetup - NEW LOCATION",1245431891000,1247847300000,32.954632,-96.813098,"Studio Movie Grill - Addison - Closed","Addison"
"11166349","The Speaker Co-op September Meetup",1250875239000,1253290500000,32.954632,-96.813098,"Studio Movie Grill - Addison - Closed","Addison"
"13236388","FUNimation At The Movies - July Screening",1271776655000,1279063800000,32.954632,-96.813098,"Studio Movie Grill - Addison - Closed","Addison"
"58419532","HUNGER HITS HOME",1333050581000,1.334448e+12,32.952648,-96.822027,"TGI Friday's","Dallas"
"73909112","We are having clinics for new members interested in playing in DIVA",1342642425000,1343779200000,32.840913,-96.830162,"Polk Recreation Center","Dallas"
"73907242","We are having clinics for new members interested in playing in DIVA",1342641437000,1344297600000,32.840913,-96.830162,"Polk Recreation Center","Dallas"
"73907492","We are having clinics for new members interested in playing in DIVA",1342641559000,1344470400000,32.840913,-96.830162,"Polk Recreation Center","Dallas"
"73907022","We are having clinics for new members interested in playing in DIVA",1342641324000,1.343952e+12,32.840913,-96.830162,"Polk Recreation Center","Dallas"
"11012138","Recess Rally - CD 32",1249179373000,1250960400000,32.920872,-96.773491,"Congressman Sessions' Dallas Office","Dallas"
"87617222","Sherlock's Pub Addison Karaoke Night with a LIVE BAND",1350607378000,1352343600000,32.951931,-96.820574,"Sherlock's Baker St. Pub","Addison"
"15511824","December's Do It Yourself PR Luncheon--Becoming Camera Ready",1290292638000,1292261400000,33.066628,-97.015549,"Studio Movie Grill Lewisville","Lewisville"
"lrvfqyphbhb","Roddy Roundup - May 12th at new location",1294782138000,1305241200000,32.962154,-96.828629,"Addison Conference Centre","Addison"
"smwxqyqdbdb","Roddy Round Up - February 2nd",1324351350000,1.328229e+12,32.962154,-96.828629,"Addison Conference Centre","Addison"
"qngwtcyrnbzb","Wellness Expo in Addison: October 13 & 14",1335202816000,1382198400000,32.962154,-96.828629,"Addison Conference Centre","Addison"
"jmwxqypjbdb","Roddy Round Up for June is next Wednesday, not next Thursday.",1294782138000,1.307574e+12,32.962154,-96.828629,"Addison Conference Centre","Addison"
"11652812","Wellness Expo in Addison: April 17 & 18",1255873747000,1.27152e+12,32.962154,-96.828629,"Addison Conference Centre","Addison"
"13227887","Wellness Expo in Addison: October 16 & 17",1271706918000,1287244800000,32.962154,-96.828629,"Addison Conference Centre","Addison"
"smwxqyqfbcb","Roddy Round Up - 3/1/12 - Short Sales Process & Building your Credit - read more",1327609653000,1330648200000,32.962154,-96.828629,"Addison Conference Centre","Addison"
"mgcwpypgbvb","Wellness Expo in Addison - April 16 & 17",1255873668000,1302969600000,32.962154,-96.828629,"Addison Conference Centre","Addison"
"qngwtcyqnbrb","Wellness Expo in Addison: October 13 & 14",1335202816000,1.350144e+12,32.962154,-96.828629,"Addison Conference Centre","Addison"
"smwxqyqpbcb","Roddy Round Up",1340297081000,1.352421e+12,32.962154,-96.828629,"Addison Conference Centre","Addison"
"qzbcfcyrgbrb","Wellness Expo in Addison",1334437133000,1366473600000,32.962154,-96.828629,"Addison Conference Centre","Addison"
"smwxqyrhbdb","Roddy Round Up",1304051628000,1367535600000,32.962154,-96.828629,"Addison Conference Centre","Addison"
"ggbbpyppbtb","The Dallas-Plano Atheists Meetup - Royal China - Dallas",1278952056000,1321405200000,32.895786,-96.80278,"Royal China","Dallas"
"83844622","Passion Rider Christmas Party",1348501794000,1355187600000,32.952935,-96.907721,"Babe's Chicken Dinner House","Carrollton"
"vmnmnynnbpc","Secular Singles Brunch",1271992778000,1.288539e+12,32.957409,-97.045632,"The Vineyard Restaurant - Hilton DFW Lakes Executive Conference Center","Grapevine"
"11787040","Second ANNUAL - Ukulele Christmas Party, Pot Luck and Yankee Swap",1257291016000,1261256400000,32.833861,-96.826286,"FUQUA Winery in Dallas","Dallas"
"69747612","Real Steel matches at Dallas Pistol Club",1340065010000,1342361700000,32.967846,-96.888718,"Dallas Pistol Club","Carrollton"
"11210157","Real World Gun Match",1251328273000,1253975400000,32.967846,-96.888718,"Dallas Pistol Club","Carrollton"
"10691295","Tuesdays- After Work Match",1245450213000,1247009400000,32.967846,-96.888718,"Dallas Pistol Club","Carrollton"
