"event_id","event_name","event_created","event_time","event_venue_lat","event_venue_lon","venue_name","venue_city"
"43705752","Red Pill and Blue Pill: Virtual Machines and Virtual Environments",1323279213000,1355455800000,37.398052,-122.053513,"Symantec","Mountain View"
"47837002","Mapping All Around: Introduction to the Google Maps API and Street View",1326394050000,1.32858e+12,37.699097,-121.944145,"580 Exec","Dublin"
"38229842","Building apps with Tiggr, A Cloud Service for Building Mobile Apps",1319218670000,1.320894e+12,37.421906,-122.088806,"Asilomar Conference Room","Mountain View"
"46812772","PEDI/MANI NIGHT (PRIVATE PARTY)",1325789420000,1331255700000,37.521294,-121.997437,"Nail Nook Day Spa","Newark"
"91133322","PEDI/MANI NIGHT (JUST IN TIME FOR CHRISTMAS)",1352765568000,1.355274e+12,37.521294,-121.997437,"Nail Nook Day Spa","Newark"
"57955212","PEDI/MANI Sunday Potluck (PRIVATE PARTY)",1332794101000,1334516400000,37.521294,-121.997437,"Nail Nook Day Spa","Newark"
"38697172","PEDI/MANI NIGHT (PRIVATE PARTY)",1319574807000,1321578900000,37.521294,-121.997437,"Nail Nook Day Spa","Newark"
"qhrtfcypnbnc","Why Blogs are Still the King of Social Media - video online",1319578411000,1320026400000,37.368832,-122.036346,"Online","Sunnyvale"
"qtkwkcyqjbrb","7 Simple Strategies to Profit From Facebook Marketing - Webinar",1336615401000,1339639200000,37.368832,-122.036346,"Online","Sunnyvale"
"qkzrjdyqmbmb","How to Get 10,000 Real and Relevant Visitors to Your Web Site",1346709809000,1347242400000,37.368832,-122.036346,"Online","Sunnyvale"
"dzxrjdyqqbdb","How to Get 10,000 Real and Relevant Visitors to Your Web Site",1353362036000,1354503600000,37.368832,-122.036346,"Online","Sunnyvale"
"dxkwkcyqcbpb","7 Simple Strategies to Profit From Facebook Marketing - Webinar",1325808153000,1326337200000,37.368832,-122.036346,"Online","Sunnyvale"
"dzxrjdyqnbkb","How to Get 10,000 Real and Relevant Visitors to Your Web Site",1349147693000,1349661600000,37.368832,-122.036346,"Online","Sunnyvale"
"dzxrjdyrcbjb","How to Get 10,000 Real and Relevant Visitors to Your Web Site",1346709379000,1357527600000,37.368832,-122.036346,"Online","Sunnyvale"
"51789242","The secret to creating high-value products that sell like crazy - WEBINAR",1328844272000,1.328904e+12,37.368832,-122.036346,"Online","Sunnyvale"
"dzjbjcyqpblc","Android Developer Meetup at AnDevCon IV",1322984150000,1354848300000,37.593628,-122.364693,"Hyatt Regency San Francisco Airport","Burlingame"
"83780282","Estuary Cruise",1348452178000,1.349631e+12,37.768623,-122.258163,"Grand street public boat ramp","Alameda"
"38750522","Estuary Cruise.",1319604545000,1319909400000,37.768623,-122.258163,"Grand street public boat ramp","Alameda"
"39459922","DMK Elite Networking Nov 22nd Mixer/Expo at Erik DeliCafe San Ramon",1320134182000,1.32201e+12,37.771473,-121.974632,"Erik's DeliCafe","San Ramon"
"qfgpmcyqfbkb","DMK Elite Networking Business Breakfast Meeting @ Erik DeliCafe",1326218912000,1331137800000,37.771473,-121.974632,"Erik's DeliCafe","San Ramon"
"qzlfjcyqdbcb","DMK Elite Networking Business Breakfast Meeting @ Erik DeliCafe",1324284845000,1328113800000,37.771473,-121.974632,"Erik's DeliCafe","San Ramon"
"38927772","DMK Elite Networking November 9th Breakfast Meeting @ Erik's DeliCafe",1319729874000,1320856200000,37.771473,-121.974632,"Erik's DeliCafe","San Ramon"
"qmgpmcyqgbxb","DMK Elite Networking Breakfast April 18th Meeting at Erik's DeliCafe San Ramon",1330069814000,1.334763e+12,37.771473,-121.974632,"Erik's DeliCafe","San Ramon"
"qfgpmcyqgbgb","DMK Elite Networking Business Breakfast April 4th Meeting @ Erik DeliCafe",1329158234000,1333553400000,37.771473,-121.974632,"Erik's DeliCafe","San Ramon"
"47246622","DMK Elite Networking January 18th Breakfast Meeting",1326065755000,1326904200000,37.771473,-121.974632,"Erik's DeliCafe","San Ramon"
"qmgpmcyqfbcc","DMK Elite Networking March 21st Breakfast Meeting at Erik's DeliCafe San Ramon",1327786213000,1332343800000,37.771473,-121.974632,"Erik's DeliCafe","San Ramon"
"87766722","AngularJS $provide Methods - How do they work?",1350697750000,1352858400000,37.42208,-122.08289,"Google Main Campus:  Paramaribo Room (Building 42, Floor 2)","Mountain View"
"90618222","SERVICE: Newark Rotary Crab Feed",1352427057000,1353196800000,37.533192,-122.032387,"Newark Pavilion","Newark"
"41547352","SERVICE: Newark Rotary Crab Feed!",1321561881000,1325982600000,37.533192,-122.032387,"Newark Pavilion","Newark"
"39022212","Silicon Valley Turkey Trot (5K or 10K)",1319774897000,1322149500000,37.335278,-121.891838,"Guadalupe River Park","San Jose"
"36828002","Nerd New Year Robot Hackathon! (Street Fair & Charity Fundraiser too)",1318261573000,1.321038e+12,37.485916,-122.230858,"Pizza & Pipes","Redwood City"
"39429312","WEEKDAY LUNCH (MINERVA'S)",1320105594000,1321384500000,37.557209,-122.005409,"Minerva's Restaurant","Fremont"
"39434292","YUIConf 2011 Evening Keynote",1320108357000,1320368400000,37.393553,-121.976652,"Yahoo! Building 1GA","Santa Clara"
"43126112","Cassandra from the Trenches: War Stories on Migrating to Cassandra at Netflix",1322809134000,1323831600000,37.412952,-122.016647,"222 Caspian Dr","Sunnyvale"
"39533272","OpenCloudWeekend (Workshops, Unconference & Hackathon)",1320176059000,1320510600000,37.412952,-122.016647,"222 Caspian Dr","Sunnyvale"
"42723632","Keeping Movies Running Amid Thunderstorms!",1322552497000,1323226800000,37.412952,-122.016647,"222 Caspian Dr","Sunnyvale"
"cwblvypqbzb","Holiday Mixer / Second Harvest Food Bank",1283921898000,1.32435e+12,37.445232,-122.165665,"appbackr","Palo Alto"
"ddzxlcyqdbbc","What's New in GlusterFS",1327017006000,1.330569e+12,37.412952,-122.016647,"Silicon Valley Cloud Center","Sunnyvale"
"53690892","Kanban for DevOps (Plus Gene Kim!)",1330123637000,1332466200000,37.412952,-122.016647,"Silicon Valley Cloud Center","Sunnyvale"
"47526102","Migrating Netflix to Cassandra in the cloud",1326221745000,1.328841e+12,37.412952,-122.016647,"Silicon Valley Cloud Center","Sunnyvale"
"dhvjzcyqmbpb","svDevOps",1339843917000,1347415200000,37.412952,-122.016647,"Silicon Valley Cloud Center","Sunnyvale"
"42063552","How Private Cloud Software makes DevOps easier",1321985198000,1323916200000,37.412952,-122.016647,"Silicon Valley Cloud Center","Sunnyvale"
"77233802","Data Mining Hackathon on Big Data",1344640353000,1345305600000,37.412952,-122.016647,"Silicon Valley Cloud Center","Sunnyvale"
"dhvjzcyqjbqb","Let's Discuss Configuration Management ...",1332792684000,1339552800000,37.412952,-122.016647,"Silicon Valley Cloud Center","Sunnyvale"
"73831382","Puppet Hackathon",1342589776000,1.343268e+12,37.412952,-122.016647,"Silicon Valley Cloud Center","Sunnyvale"
"80792492","Apache Drill Design Meeting",1346778966000,1347577200000,37.412952,-122.016647,"Silicon Valley Cloud Center","Sunnyvale"
"61969252","Stackato workshop at OpenCloud Conference",1335304833000,1335988800000,37.412952,-122.016647,"Silicon Valley Cloud Center","Sunnyvale"
"44970942","NoSQL Options Compared - Different Horses for Different Courses",1324344443000,1324607400000,37.412952,-122.016647,"Silicon Valley Cloud Center","Sunnyvale"
"78803092","Advantages of using MongoDB in a Single Page Web Application",1345602940000,1346981400000,37.412952,-122.016647,"Silicon Valley Cloud Center","Sunnyvale"
"qrpncdyqmbpb","svDevOps Hadoop meetup",1342238875000,1347415200000,37.412952,-122.016647,"Silicon Valley Cloud Center","Sunnyvale"
"39354362","Vicky's 4th Holiday Extravaganza!!!",1320072888000,1322962200000,37.368832,-122.036346,"exact location to be announced","Sunnyvale"
"38062122","NEW DATE   ""PAJAMA RIDE"" Bring a toy and make a child happy for the Holidays",1319090937000,1322330400000,37.696938,-122.074135,"Peet's Coffee & Tea","Castro Valley"
"40369612","December Board of Directors Meeting",1320728196000,1.323054e+12,37.550301,-121.983925,"B J Travel Center","Fremont"
"39986262","November Board of Directors Meeting",1320440206000,1320634800000,37.550301,-121.983925,"B J Travel Center","Fremont"
"39990952","FUNDRAISER: We scream, you scream, we all scream for ice cream!",1320442729000,1321219800000,37.550793,-122.049713,"Baskin Robbins","Newark"
"40353872","FELLOWSHIP: WNR at Baskin Robbins (BOGOF)",1320717792000,1320898500000,37.550792,-122.04971,"Baskin Robbins - Newark","Newark"
"85706652","Mobile Opportunity - At the Intersection of Web,Wireless,Entertainment and Cloud",1349474203000,1352491200000,37.414341,-122.07692,"Computer History Museum","Mountain View"
"46211352","Inspire, Impact, Win! Women Leadership Forum",1325473577000,1328979600000,37.414341,-122.07692,"Computer History Museum","Mountain View"
"75390522","Heads Up:CHM's Revolutionaries series:""The Art&Technology Behind Google Doodles""",1343577529000,1.344474e+12,37.414341,-122.07692,"Computer History Museum","Mountain View"
"60626422","Sal Khan (TIME's 100 most influential -2012) to Keynote @ OPEN Forum",1334466751000,1338652800000,37.414341,-122.07692,"Computer History Museum","Mountain View"
"99853852","WOMEN LEADERSHIP FORUM - Women Championing Women",1358320808000,1359219600000,37.414341,-122.07692,"Computer History Museum","Mountain View"
"40228282","TRISTANCOMM",1320640528000,1321225200000,37.544579,-122.03804,"TBA ","Newark"
"100193942","FELLOWSHIP: Rock climbing!",1358489894000,1358906400000,37.510571,-121.951096,"City Beach","Fremont"
"41270282","FELLOWSHIP: Wednesday Night Recreation @ In-N-Out",1321384059000,1321503300000,37.504311,-121.973869,"In-N-Out Burger","Fremont"
"69787592","FELLOWSHIP: Wednesday Night Recreation @ In-N-Out",1340091055000,1340249400000,37.504311,-121.973869,"In-N-Out Burger","Fremont"
"43795922","Legal and Financing Issues Start Ups Face - Session #4  Asset Protection",1323331482000,1323832500000,37.441883,-122.143021,"TELECONFERENCE","Palo Alto"
"43795382","Legal and Financing Issues Start Ups Face - Session #4  Asset Protection",1323330676000,1323832500000,37.441883,-122.143021,"TELECONFERENCE","Palo Alto"
"drgskcyqdbcc","Legal and Financing Issues Start Ups Face-Session #15- On Investing",1329258354000,1329880500000,37.441883,-122.143021,"TELECONFERENCE","Palo Alto"
"43389772","Legal and Financing Issues Start Ups Face - Session #3",1323048895000,1323227700000,37.441883,-122.143021,"TELECONFERENCE","Palo Alto"
"qthskcyqdbcc","Legal and Financing Issues Start Ups Face-Session #15 - Thoughts on Investing",1329258347000,1329880500000,37.441883,-122.143021,"TELECONFERENCE","Palo Alto"
"41601802","***Free Christian Concert This Sunday, November 20th at 6PM***",1321597551000,1321839900000,37.705891,-122.073875,"Redwood Chapel Community Church","Castro Valley"
"41782582","Bikes on the Bay - Vintage Motorcycles",1321761630000,1340555400000,37.260262,-121.931328,"Trail Head Cyclery","San Jose"
"44789012","5-day road trip, North Coast and Rogue River, Ore.",1324181125000,1341419400000,37.260262,-121.931328,"Trail Head Cyclery","San Jose"
"67323572","Happy Hour Palo Alto",1338584254000,1340159400000,37.445065,-122.163948,"The Patio @ Rudy's","Palo Alto"
"cwblvyppbcc","iOS Apps for Businesses",1283921898000,1321930800000,37.431961,-122.096542,"Intuit, Building 9","Mountain View"
"74469782","8/5/12 Santa Teresa 18 Holes",1343004336000,1344203100000,37.223949,-121.779465,"Santa Teresa Golf Club","San Jose"
"87844312","Sun., 11/4/12: Santa Teresa 9 Holes",1350767981000,1352046600000,37.223949,-121.779465,"Santa Teresa Golf Club","San Jose"
"91140512","Saturday, 11/24/12: Santa Teresa 9 Holes",1352768560000,1353777300000,37.223949,-121.779465,"Santa Teresa Golf Club","San Jose"
"91142722","Saturday, 11/24/12: Santa Teresa 18 Holes",1352769382000,1353778200000,37.223949,-121.779465,"Santa Teresa Golf Club","San Jose"
"82009062","Sun., 10/7/12 Santa Teresa 18 Holes",1347422858000,1349641800000,37.223949,-121.779465,"Santa Teresa Golf Club","San Jose"
"88088722","Dissecting Scalable Database Architectures",1350932287000,1353027600000,37.424847,-122.136292,"Groupon","Palo Alto"
"68249372","Storm Meetup II:  Topology Design Workshop",1.339117e+12,1340758800000,37.424847,-122.136292,"Groupon","Palo Alto"
"41894682","Free Expo SVIGDA Tickets to AppNation III, + Limited Game  Demo Pods Available",1321857694000,1322674200000,37.771023,-122.404823,"Concourse Exhibition Center","San Francisco"
"70325072","The paintball uprising!!",1340402201000,1342283400000,37.298328,-121.855766,"Santa Clara Paintball ","San Jose"
"qhhskcyqdbkb","Session #13-In Biz In CA - Discussion w/ a Successful but Challenged Businessman",1328049946000,1328670900000,37.441883,-122.143021,"TELCONFERENCE","Palo Alto"
"41079622","Bethlehem A.D. - Live Nativity Scene",1321259962000,1324697400000,37.483116,-122.224571,"Tapestry Church","Redwood City"
"46038452","Bethlehem  A.D",1325312544000,1356319800000,37.483116,-122.224571,"Tapestry Church","Redwood City"
"88378562","CSPA Partner event: @Venture Series 7:  Tackle the Basics!",1351098556000,1353027600000,37.513474,-122.203339,"Gunderson Dettmer","Redwood City"
"88378102","@Venture Series 7:  Tackle the Basics!",1351098472000,1353027600000,37.513474,-122.203339,"Gunderson Dettmer","Redwood City"
"43312472","FELLOWSHIP: Wednesday Night Recreation @ Newark Hilton",1322982350000,1323317700000,37.52169,-121.991379,"Hilton Hotel Newark","Newark"
"43451842","Flume NG Teach-In and Hackathon",1323107387000,1324054800000,37.424145,-122.136101,"Cloudera Inc","Palo Alto"
"43491902","Blue Star Moms Care Packages",1323122308000,1323307800000,37.576382,-121.981544,"Veterans Hall","Fremont"
"43577612","WEEKDAY LUNCH PACIFIC FISH GRILL....IT'S TACO TUESDAY",1323191951000,1324424700000,37.562908,-122.016068,"Pacific Fish & Grill","Fremont"
"43640672","Hackers & Founders / AT&T Mobile Healthcare Meetup",1323219462000,1.323828e+12,37.4431,-122.157875,"AT&T Foundry","Palo Alto"
"87654962","Combating Antipatterns with Platform as a Service *NEW LOCATION*",1350628426000,1352946600000,37.295376,-121.927856,"eBay South Campus The Front Porch conference room Building 7 (Community)","San Jose"
"44203932","DMK Elite Dec 15th Networking Mixer/Expo at Claudia's Body + Skin Care Center",1323708551000,1323975600000,37.652763,-122.104141,"Claudia's Body & Skin Care Center","Hayward"
"34993192","Why (and How) to Rapidly Prototype for Multiple Devices",1317048670000,1.323918e+12,37.421143,-122.085304,"Seville, Google Building 40","Mountain View"
"87581462","TiE SV & UC Berkeley Invite you to an Event - Fulfilling Entrepreneurial Dreams",1350593248000,1351126800000,37.406761,-121.978668,"TiE Conference Center","Santa Clara"
"89683462","TiE SV Pitchfest",1351886294000,1352426400000,37.406761,-121.978668,"TiE Conference Center","Santa Clara"
"56053552","TiE Startup Pitchfest",1331578575000,1.333674e+12,37.406761,-121.978668,"TiE Conference Center","Santa Clara"
"45103012","Hiking at Huddart County Park",1324449474000,1324663200000,37.432384,-122.291466,"Huddart Park","Woodside"
"69773652","Hanhai Investment Opening Ceremony",1340077209000,1340236800000,37.370575,-121.92276,"2050 Gateway Pl","San Jose"
"41079892","Dinner & $6 Movie - ""Mission: Impossible - Ghost Protocol""",1321260226000,1324860300000,37.285645,-121.931694,"Denny's","Campbell"
"45882502","BIGGEST LOSER WEIGHT LOSS CHALLENGE (Raise money for the Make A Wish Foundation)",1325191914000,1326700800000,37.293892,-121.719543,"LET'S ALL GET HEALTHY TOGETHER","Santa Clara"
"98301632","Freemium As A Business Model:  cleverbridge, Glam Media, and Atlassian",1357528266000,1357869600000,37.775532,-122.406326,"Atlassian Software - San Francisco Office","San Francisco"
"83919202","Intro to MongoDB",1348527545000,1350608400000,37.38049,-121.960492,"Ground Floor Silicon Valley","Santa Clara"
"86722432","InfiniteGraph Office Hours",1350072076000,1350601200000,37.38049,-121.960492,"Ground Floor Silicon Valley","Santa Clara"
"46456432","appMobi Update & Cloud Services Dashboard",1325613702000,1326763800000,37.38049,-121.960492,"Ground Floor Silicon Valley","Santa Clara"
"75700412","Oracle NoSQL DB & InfiniteGraph - Trends in Big Data and Graph Technology",1343754268000,1.345167e+12,37.38049,-121.960492,"Ground Floor Silicon Valley","Santa Clara"
"51766652","appMobi Platform Overview & New GameDev Product, playMobi",1328830809000,1329443100000,37.38049,-121.960492,"Ground Floor Silicon Valley","Santa Clara"
"84215232","The Talent Search Continues: Looking for More Rock Star Entrepreneurs!",1348685865000,1351371600000,37.38049,-121.960492,"Ground Floor Silicon Valley","Santa Clara"
"51775622","SAN JOSE SABERCATS ARENA FOOTBALL GAME OPENING NIGHT 2012",1328836037000,1331434800000,37.332512,-121.901184,"HP Pavilion","San Jose"
"61780052","Calling all Developers!",1335201930000,1.336158e+12,37.323597,-121.945885,"Microsoft Store - Valley Fair Shopping Center","Santa Clara"
"61659012","Calling all Developers!",1335122415000,1.336158e+12,37.323597,-121.945885,"Microsoft Store - Valley Fair Shopping Center","Santa Clara"
"64545832","Small Business Week: Appreciation Night",1336858193000,1337990400000,37.323597,-121.945885,"Microsoft Store - Valley Fair Shopping Center","Santa Clara"
"50655452","Madden 12 Superbowl Tournament",1328146205000,1328403600000,37.323597,-121.945885,"Microsoft Store - Valley Fair Shopping Center","Santa Clara"
"71699922","An Introduction to Microsoft Dynamics",1341263176000,1342573200000,37.323597,-121.945885,"Microsoft Store - Valley Fair Shopping Center","Santa Clara"
"64543872","Small Business Week: Windows 8 Preview + Windows Phone",1336856566000,1337734800000,37.323597,-121.945885,"Microsoft Store - Valley Fair Shopping Center","Santa Clara"
"64542212","Small Business Week: Intro to Office 365",1336855367000,1337623200000,37.323597,-121.945885,"Microsoft Store - Valley Fair Shopping Center","Santa Clara"
"75874652","Please Join Cloud Strategies at the Microsoft Store",1343844119000,1345586400000,37.323597,-121.945885,"Microsoft Store - Valley Fair Shopping Center","Santa Clara"
"78748142","An Introduction to Microsoft Dynamics  ",1345582522000,1346956200000,37.323597,-121.945885,"Microsoft Store - Valley Fair Shopping Center","Santa Clara"
"80097122","Secrets of successful Pinterest marketing for your business on Pinterest.",1346345982000,1347577200000,37.323597,-121.945885,"Microsoft Store - Valley Fair Shopping Center","Santa Clara"
"87119942","Windows 8 Launch Day October 26th All Day Event",1350338003000,1351263600000,37.323174,-121.974136,"Microsoft Store - Valley Fair","Santa Clara"
"94506742","Let's have a Holiday Party at Microsoft Store Valley Fair",1354918037000,1355968800000,37.323174,-121.974136,"Microsoft Store - Valley Fair","Santa Clara"
"99995532","Windows 8 App Labs",1358390412000,1.359144e+12,37.323174,-121.974136,"Microsoft Store - Valley Fair","Santa Clara"
"101882392","Meet Microsoft’s Surface Pro and Experience Office 13",1359421723000,1360202400000,37.323174,-121.974136,"Microsoft Store - Valley Fair","Santa Clara"
"98989892","Device Tune Up Day",1357857119000,1.358532e+12,37.323174,-121.974136,"Microsoft Store - Valley Fair","Santa Clara"
"71058072","Preparing your Business for a Successful Acquisition(Sponsored by K&L Gates LLP)",1340845696000,1.344474e+12,37.404186,-121.983345,"Silicon Valley Bank","Santa Clara"
"55483562","How to Minimize Your Business Tax",1331188084000,1332808200000,37.404186,-121.983345,"Silicon Valley Bank","Santa Clara"
"61660652","Roll Out Mobile Apps for Health & Fitness – Quick, Low-Cost, Usable & Compliant",1335123276000,1336525200000,37.404186,-121.983345,"Silicon Valley Bank","Santa Clara"
"54471242","Seed Round Funding -- What Makes Your Venture Fundable",1330583778000,1333069200000,37.404186,-121.983345,"Silicon Valley Bank","Santa Clara"
"72309292","Global Mobile Internet Conference, Silicon Valley Oct 19-20",1341636146000,1350662400000,37.331924,-121.887733,"San Jose McEnery Convention Center","San Jose"
"76673622","Global Mobile Internet Conference, Silicon Valley Oct 19-20",1344318670000,1350662400000,37.331924,-121.887733,"San Jose McEnery Convention Center","San Jose"
"vmwlqyqhbdc","A Guided Tour of OpenStack for Professionals (Non-Techies)",1327959104000,1338341400000,37.412952,-122.016647,"Silicon Valley Cloud Center","Sunnyvale"
"vmwlqyqjbjc","Big Data at Cloud Scale",1332466717000,1340760600000,37.412952,-122.016647,"Silicon Valley Cloud Center","Sunnyvale"
"vmwlqyqgbgc","Sizing and Designing a Hybrid Cloud",1326936672000,1335317400000,37.412952,-122.016647,"Silicon Valley Cloud Center","Sunnyvale"
"vmwlqyqdblc","Private Cloud (IaaS) Landscape 2012",1322520865000,1330482600000,37.412952,-122.016647,"Silicon Valley Cloud Center","Sunnyvale"
"vmwlqyqkbgc","Cloud SIG  - Google Compute Engine",1332560554000,1343784600000,37.412952,-122.016647,"Silicon Valley Cloud Center","Sunnyvale"
"vmwlqyqnbfc","Six Degrees of Integration: Cloud and the Great Software System",1332560693000,1351042200000,37.412952,-122.016647,"Silicon Valley Cloud Center","Sunnyvale"
"vmwlqyqfbkc","Netflix Night",1325792916000,1332898200000,37.412952,-122.016647,"Silicon Valley Cloud Center","Sunnyvale"
"89147942","The Bay Area's Favorite Speed Dating For Single Professionals",1351576961000,1352599200000,37.321751,-121.978104,"Stevens Creek Executive Park (Conference Room) ","San Jose"
"100112032","Seize the Latest Opportunities from China Internet Companies",1358457444000,1359770400000,37.391403,-122.080933,"801 California St","Mountain View"
"47571432","Meet with Tencent, the biggest and most used internet service portal in China",1326235799000,1326506400000,37.395672,-122.081497,"800 W. El Camino Real","Mountain View"
"47611412","DMK Elite Networking January Mixer/Expo at RoadRunner Print Mail - San Ramon",1326255961000,1.327626e+12,37.775795,-121.981773,"Roadrunner","San Ramon"
"35526512","Cloud Foundry Community updates",1317334476000,1.326852e+12,37.405975,-122.121162,"Crowne Plaza Hotel","Palo Alto"
"68745262","Startup Chile buys you a beer:  H / F meetup",1339452445000,1339635600000,37.485916,-122.230858,"Pizza and Pipes","Redwood City"
"hzkfnyrlbcc","S F Bay Area Investors Club Monthly Meetup",1268852966000,1.377135e+12,37.705471,-121.888153,"Hyatt Place Dublin/Pleasanton","Dublin"
"hzkfnyqnbwb","How to Successfully Buy & Sell HUD Homes Seminar",1345788821000,1351128600000,37.705471,-121.888153,"Hyatt Place Dublin/Pleasanton","Dublin"
"hzkfnyrmbxb","S F Bay Area Investors Club Monthly Meetup",1268852966000,1379554200000,37.705471,-121.888153,"Hyatt Place Dublin/Pleasanton","Dublin"
"hzkfnyrpbbc","S F Bay Area Investors Club Monthly Meetup",1268852966000,1.385001e+12,37.705471,-121.888153,"Hyatt Place Dublin/Pleasanton","Dublin"
"hzkfnyrnbvb","S F Bay Area Investors Club Monthly Meetup",1268852966000,1381973400000,37.705471,-121.888153,"Hyatt Place Dublin/Pleasanton","Dublin"
"hzkfnyrkbwb","S F Bay Area Investors Club Monthly Meetup",1268852966000,1.374111e+12,37.705471,-121.888153,"Hyatt Place Dublin/Pleasanton","Dublin"
"hzkfnyqjbbc","Attend Credit Repair & Business Lines of Credit Seminar",1337360572000,1342661400000,37.705471,-121.888153,"Hyatt Place Dublin/Pleasanton","Dublin"
"hzkfnyrqbxb","S F Bay Area Investors Club Monthly Meetup",1268852966000,1387420200000,37.705471,-121.888153,"Hyatt Place Dublin/Pleasanton","Dublin"
"50504692","Property Rehabbing for Passive Income & Huge Profits",1328068056000,1.330794e+12,37.705471,-121.888153,"Hyatt Place Dublin/Pleasanton","Dublin"
"hzkfnyqfbcc","S F Bay Area Investors Club Monthly Meetup",1331866528000,1332379800000,37.705471,-121.888153,"Hyatt Place Dublin/Pleasanton","Dublin"
"hzkfnyrjbzb","S F Bay Area Investors Club Monthly Meetup",1268852966000,1371691800000,37.705471,-121.888153,"Hyatt Place Dublin/Pleasanton","Dublin"
"hzkfnyqfbkb","Get NEW Loan Info for RE Investors & Home Buyers at Tonight's Event",1327861735000,1.332378e+12,37.705471,-121.888153,"Hyatt Place Dublin/Pleasanton","Dublin"
"hzkfnyqhbvb","Learn how to fix your credit quickly from the Credit Repair Expert",1334107441000,1337218200000,37.705471,-121.888153,"Hyatt Place Dublin/Pleasanton","Dublin"
"74093632","What is the Ideal Real Estate Investment?",1342741027000,1345080600000,37.705471,-121.888153,"Hyatt Place Dublin/Pleasanton","Dublin"
"hzkfnyqkbxb","S F Bay Area Investors Club Monthly Meetup",1342147617000,1342661400000,37.705471,-121.888153,"Hyatt Place Dublin/Pleasanton","Dublin"
"hzkfnyrdbbc","S F Bay Area Investors Club Monthly Meetup",1268852966000,1361413800000,37.705471,-121.888153,"Hyatt Place Dublin/Pleasanton","Dublin"
"hzkfnyrgbwb","S F Bay Area Investors Club Monthly Meetup",1268852966000,1366248600000,37.705471,-121.888153,"Hyatt Place Dublin/Pleasanton","Dublin"
"hzkfnyqmbzb","Buying HUD Homes - Find out at Property Rehab Meetup Tonight",1343193277000,1348104600000,37.705471,-121.888153,"Hyatt Place Dublin/Pleasanton","Dublin"
"50503522","Finding Great Real Estate Deals",1328067546000,1329359400000,37.705471,-121.888153,"Hyatt Place Dublin/Pleasanton","Dublin"
"hzkfnyqlbtb","S F Bay Area Investors Club Monthly Meetup",1343193243000,1345080600000,37.705471,-121.888153,"Hyatt Place Dublin/Pleasanton","Dublin"
"hzkfnyqqbzb","S F Bay Area Investors Club Monthly Meetup",1268852966000,1355970600000,37.705471,-121.888153,"Hyatt Place Dublin/Pleasanton","Dublin"
"hzkfnyrfbbc","S F Bay Area Investors Club Monthly Meetup",1268852966000,1363829400000,37.705471,-121.888153,"Hyatt Place Dublin/Pleasanton","Dublin"
"hzkfnyrhbtb","S F Bay Area Investors Club Monthly Meetup",1268852966000,1368667800000,37.705471,-121.888153,"Hyatt Place Dublin/Pleasanton","Dublin"
"45781902","WEIGHT LOSS CHALLENGE FOR MAKE A WISH (Last day, 12 weeks of hell)",1325117914000,1333954800000,37.548271,-121.988571,"WE DID IT....WE DID IT.....12 WEEKS  IF HELL","Fremont"
"47390782","Cloud Foundry Community updates",1326144500000,1.326852e+12,37.405975,-122.121162,"Crowne Plaza Hotel Palo Alto","Palo Alto"
"56372682","Niles Rotary and Rotaract Mixer",1331761312000,1334192400000,37.602654,-122.068672,"Federicos Tapas & Wine Bar","Union City"
