"event_id","event_name","event_created","event_time","event_venue_lat","event_venue_lon","venue_name","venue_city"
"23877071","FELLOWSHIP: Two Hand Touch Football",1309299685000,1310248800000,37.549624,-121.969735,"Lake Elizabeth","Fremont"
"26382191","FELLOWSHIP: BBQ @ Lake Elizabeth",1311143929000,1311375600000,37.549624,-121.969735,"Lake Elizabeth","Fremont"
"16338650","Gilroy SUNDAY BRUNCH,The BIG RED BARN flea maket AND west to the Beach",1296183809000,1298827800000,37.231678,-121.775612,"Starbucks","San Jose"
"79066412","October Birthday Ride",1345753057000,1.349541e+12,37.231678,-121.775612,"Starbucks","San Jose"
"37421942","Reception: Santa Clara County Poet Larueate Sally Ashton",1318624516000,1320280200000,37.432813,-121.907095,"Milpitas Library Community Room","Milpitas"
"99554602","The Art of Photography in the Photoshop Era",1358187457000,1359514800000,37.330805,-121.893826,"Adobe HQ - San Jose","San Jose"
"cwvfnypcbbc","Translation Tools in the Cloud: TermWiki and ReviewIT ",1274134653000,1.294974e+12,37.330805,-121.893826,"Adobe HQ - San Jose","San Jose"
"15052730","Lighting Workshop for Photographers",1286604034000,1291773600000,37.330805,-121.893826,"Adobe HQ - San Jose","San Jose"
"47759722","Sneak peek at Lightroom 4 and photographer John Lund",1326337048000,1326855600000,37.330805,-121.893826,"Adobe HQ - San Jose","San Jose"
"13359700","Tapas, Drinks & Mandarin",1272835254000,1274664600000,37.443102,-122.162763,"Pampas","Palo Alto"
"12884762","Tapas, Drinks & Mandarin",1268691486000,1271037600000,37.443102,-122.162763,"Pampas","Palo Alto"
"20362011","SERVICE: Relay for Life ""Paint Your Town Purple""",1306856549000,1307203200000,37.549309,-121.987688,"Starbucks","Fremont"
"32260272","FELLOWSHIP: Wednesday Night Recreation @ Starbucks",1315179416000,1315452600000,37.549309,-121.987688,"Starbucks","Fremont"
"38454712","TRISTANCOMM: Sixth Meeting",1319422734000,1.319904e+12,37.549309,-121.987688,"Starbucks","Fremont"
"29812161","Let's Meetup and Brainstorm",1313565957000,1314575100000,37.549309,-121.987688,"Starbucks","Fremont"
"12752183","Chinese Brunch – aka Dim Sum!!!",1267499300000,1269111600000,37.449073,-122.118637,"Ming's","Palo Alto"
"12633284","Workshop! Out door lighting control for fashion photography",1266455493000,1266695100000,37.42896,-122.169538,"Stanford Memorial Church","Stanford"
"qglmmcyqfbkb","Weekly Club Breakfast Meeting",1328203596000,1331134200000,37.474678,-121.932682,"Courtyard ","Fremont"
"qglmmcyqdbdc","Weekly Club Breakfast Meeting",1327878065000,1329924600000,37.474678,-121.932682,"Courtyard ","Fremont"
"qglmmcyqdbcb","Weekly Club Breakfast Meeting",1327648546000,1328110200000,37.474678,-121.932682,"Courtyard ","Fremont"
"qglmmcyqfbcc","Weekly Club Breakfast Meeting",1328761082000,1332340200000,37.474678,-121.932682,"Courtyard ","Fremont"
"qglmmcyqfblc","Weekly Club Breakfast Meeting",1328761093000,1.332945e+12,37.474678,-121.932682,"Courtyard ","Fremont"
"qglmmcyqdblb","Weekly Club Breakfast Meeting",1327878048000,1.328715e+12,37.474678,-121.932682,"Courtyard ","Fremont"
"qglmmcyqfbsb","Weekly Club Breakfast Meeting",1328761063000,1331735400000,37.474678,-121.932682,"Courtyard ","Fremont"
"75492342","PRODEV: Fremont Warm Springs Sunrise Rotary Meeting",1343633615000,1343830500000,37.474678,-121.932682,"Courtyard ","Fremont"
"qglmmcyqdbmc","Weekly Club Breakfast Meeting",1327878075000,1330529400000,37.474678,-121.932682,"Courtyard ","Fremont"
"qglmmcyqdbtb","Weekly Club Breakfast Meeting",1327878058000,1329319800000,37.474678,-121.932682,"Courtyard ","Fremont"
"qglmmcyqgbgb","Weekly Club Breakfast Meeting",1328761104000,1333549800000,37.474678,-121.932682,"Courtyard ","Fremont"
"55267362","WWDC International Mixer",1331076850000,1339549200000,37.786526,-122.403091,"Ducca","San Francisco"
"9643134","SUSHI NIGHT AT AKADAI SUSHI....",1233449678000,1234492200000,37.535221,-121.965429,"Akadai Sushi","Fremont"
"34081052","Fellowship: Rotaract Study Hours",1316410811000,1316480400000,37.532726,-121.959343,"Bay Street Coffee","Fremont"
"11655684","FARMERS MARKET AND COFFEE",1255900876000,1258304400000,37.532726,-121.959343,"Bay Street Coffee","Fremont"
"qqwjncyqfbzb","MONDAY NIGHT STUDY: Bay Street Coffee",1331922208000,1332212400000,37.532726,-121.959343,"Bay Street Coffee","Fremont"
"qqwjncyqfbhb","MONDAY NIGHT STUDY: Bay Street Coffee",1329414568000,1331006400000,37.532726,-121.959343,"Bay Street Coffee","Fremont"
"35843952","Study with Rotaract",1317584533000,1.31769e+12,37.532726,-121.959343,"Bay Street Coffee","Fremont"
"36495012","Study with Rotaract",1317973244000,1318294800000,37.532726,-121.959343,"Bay Street Coffee","Fremont"
"qqwjncyqdbbc","MONDAY NIGHT STUDY: Bay Street Coffee",1329269907000,1329796800000,37.532726,-121.959343,"Bay Street Coffee","Fremont"
"13464455","FARMERS MARKET AND COFFEE",1273696194000,1.27584e+12,37.532726,-121.959343,"Bay Street Coffee","Fremont"
"31321642","Coworking Session",1314580022000,1.315863e+12,37.532726,-121.959343,"Bay Street Coffee","Fremont"
"34955202","Weekly Study Session",1317008579000,1.317087e+12,37.532726,-121.959343,"Bay Street Coffee","Fremont"
"qqwjncyqgbdb","MONDAY NIGHT STUDY: Bay Street Coffee",1332718408000,1.333422e+12,37.532726,-121.959343,"Bay Street Coffee","Fremont"
"qqwjncyqfbqb","MONDAY NIGHT STUDY: Bay Street Coffee",1331248707000,1331607600000,37.532726,-121.959343,"Bay Street Coffee","Fremont"
"38433532","Study with Rotaract",1319408806000,1319504400000,37.532726,-121.959343,"Bay Street Coffee","Fremont"
"37633882","Study with Rotaract",1318819543000,1318899600000,37.532726,-121.959343,"Bay Street Coffee","Fremont"
"33058872","FELLOWSHIP: Study Hours with Rotaract!",1315708191000,1315875600000,37.532726,-121.959343,"Bay Street Coffee","Fremont"
"24706241","WEDNESDAY NIGHT RECREATION: Bay St Cafe!",1309922602000,1310009400000,37.532726,-121.959343,"Bay Street Coffee","Fremont"
"16878637","FARMERS MARKET AND COFFEE (Irvington District)",1299804436000,1301891400000,37.532726,-121.959343,"Bay Street Coffee","Fremont"
"qqwjncyqdbkc","MONDAY NIGHT STUDY: Bay Street Coffee",1330375228000,1330401600000,37.532726,-121.959343,"Bay Street Coffee","Fremont"
"qqwjncyqdbrb","MONDAY NIGHT STUDY: Bay Street Coffee",1328641336000,1.329192e+12,37.532726,-121.959343,"Bay Street Coffee","Fremont"
"11601686","FARMERS MARKET AND COFFEE",1255284616000,1255881600000,37.532726,-121.959343,"Bay Street Coffee","Fremont"
"34077842","FELLOWSHIP: Wednesday Night Recreation @ Bay St. Cafe",1316407626000,1316660400000,37.532726,-121.959343,"Bay Street Coffee","Fremont"
"56922242","FELLOWSHIP: Wednesday Night Recreation @ Bay Street Cafe",1332140274000,1.332387e+12,37.532726,-121.959343,"Bay Street Coffee","Fremont"
"12900265","Farmers Market and Coffee",1268834346000,1.269792e+12,37.532726,-121.959343,"Bay Street Coffee","Fremont"
"99289612","FARMERS MARKET AND COFFEE",1358030065000,1362934800000,37.532726,-121.959343,"Bay Street Coffee","Fremont"
"dqnhjcypqbtb","Meeting",1321982200000,1323961200000,37.627653,-122.049403,"Denny's","Hayward"
"75985602","Lady In Red Premier Dance Party",1343887331000,1346464800000,37.377021,-122.030057,"Tarragon","Sunnyvale"
"72520352","7/28/12 Monarch Bay 9 Holes San Leandro",1341798221000,1343515500000,37.694454,-122.185488,"Monarch Bay Golf Club ","San Leandro"
"12163284","MARKET BROILER ",1262043547000,1263953700000,37.503252,-121.968313,"Market Broiler","Fremont"
"14495560","MARKET BROILER",1282417895000,1283822100000,37.503252,-121.968313,"Market Broiler","Fremont"
"38755712","Study with Rotaract",1319610439000,1320001200000,37.50523,-121.970921,"Panera Bread","Fremont"
"84105702","WORLDCOMM- First Meeting!",1348622129000,1.348938e+12,37.50523,-121.970921,"Panera Bread","Fremont"
"16779548","2nd Rotaract Interest Meeting",1299135458000,1.299726e+12,37.50523,-121.970921,"Panera Bread","Fremont"
"14014826","Evening Meetup",1278423866000,1279245600000,37.50523,-121.970921,"Panera Bread","Fremont"
"14653016","Fremont Area Writers Club Board Meeting",1283573269000,1284080400000,37.50523,-121.970921,"Panera Bread","Fremont"
"qgsrgcyppbbc","Study with Rotaract",1321161970000,1321819200000,37.50523,-121.970921,"Panera Bread","Fremont"
"38433672","Study with Rotaract",1319408860000,1320609600000,37.50523,-121.970921,"Panera Bread","Fremont"
"qgsrgcyppbrb","Study with Rotaract",1320883501000,1321214400000,37.50523,-121.970921,"Panera Bread","Fremont"
"qgsrgcyppbkc","Study with Rotaract",1321161994000,1.322424e+12,37.50523,-121.970921,"Panera Bread","Fremont"
"qgsrgcypqbgb","Study with Rotaract",1322406189000,1323028800000,37.50523,-121.970921,"Panera Bread","Fremont"
"lhqvpypjbmc","Mission Coffee Critique Group",1289520528000,1309397400000,37.50523,-121.970921,"Panera Bread","Fremont"
"15360086","FAW Board Meeting",1289059258000,1289530800000,37.50523,-121.970921,"Panera Bread","Fremont"
"39678302","TRISTANCOMM: Seventh Meeting",1320258102000,1320622200000,37.50523,-121.970921,"Panera Bread","Fremont"
"16615994","The 1st Rotaract Club Interest Meeting",1298058414000,1299121200000,37.50523,-121.970921,"Panera Bread","Fremont"
"16889499","MEETING: 3rd Interest Meeting",1299885375000,1.300932e+12,37.50523,-121.970921,"Panera Bread","Fremont"
"35427702","Study with Rotaract",1317277862000,1317430800000,37.50523,-121.970921,"Panera Bread","Fremont"
"25537581","Fremont Area Writers Club Board Meeting",1310519192000,1310695200000,37.50523,-121.970921,"Panera Bread","Fremont"
"19992691","“BEGIN…COMMIT” is Not Enough: Understanding Transactions",1306529961000,1311125400000,37.413059,-122.071035,"Microsoft","Mountain View"
"68365382","Building Highly Scalable Social Media apps",1339190922000,1340071200000,37.413059,-122.071035,"Microsoft","Mountain View"
"103211512","(Im)practical Data Analytics with Bradley Voytek, UBER/UCB",1360106655000,1361413800000,37.413059,-122.071035,"Microsoft","Mountain View"
"50622612","SQLSaturday Silicon Valley - March 3",1328132660000,1330790400000,37.413059,-122.071035,"Microsoft","Mountain View"
"13697636","DBA as Protector of the Data: Notes from the Field",1275669605000,1.285119e+12,37.413059,-122.071035,"Microsoft","Mountain View"
"13587270","Distributing Data Techniques with SQL Server 2008 R2",1274771553000,1287538200000,37.413059,-122.071035,"Microsoft","Mountain View"
"13613606","Query Tuning - Get it Right the First Time",1274976517000,1.289961e+12,37.413059,-122.071035,"Microsoft","Mountain View"
"66204452","How To Stop Bad Data in its OLTP Tracks",1337890696000,1340155800000,37.413059,-122.071035,"Microsoft","Mountain View"
"16926357","Business Intelligence in SharePoint 2010",1300173440000,1.303263e+12,37.413059,-122.071035,"Microsoft","Mountain View"
"91538162","Exploring PowerPivot & Power View in Excel 2013",1353001699000,1358908200000,37.413059,-122.071035,"Microsoft","Mountain View"
"98621022","SQLSaturday Silicon Valley 2013",1357683814000,1361635200000,37.413059,-122.071035,"Microsoft","Mountain View"
"69330632","How Service Broker Can Help You Achieve High Scalability",1339783418000,1.342575e+12,37.413059,-122.071035,"Microsoft","Mountain View"
"16379798","Filtered Indexes & Sparse Columns: Together - Separately",1296464336000,1297823400000,37.413059,-122.071035,"Microsoft","Mountain View"
"44265272","Fine Tuning Production SQL Servers",1323738529000,1326853800000,37.413059,-122.071035,"Microsoft","Mountain View"
"15462534","SQL Server Denali High Availability Preview",1289887583000,1295404200000,37.413059,-122.071035,"Microsoft","Mountain View"
"58820972","SIMPLY FONDUE...4 COURSE DINNER....MMMMMMM CHEESE",1333320834000,1335746700000,37.682473,-121.767941,"Simply Fondue","Livermore"
"qcjfccyqfblc","MEETING: Good Times, our regular social mixer for Young Professionals & Students",1329363879000,1332986400000,37.533144,-121.920597,"Color Me Mine","Fremont"
"16605130","COLOR ME MINE (LET'S PAINT SOME CERAMICS)",1297980304000,1.30041e+12,37.533144,-121.920597,"Color Me Mine","Fremont"
"10997302","COLOR ME MINE (LET'S PAINT SOME CERAMICS)",1248996724000,1.25073e+12,37.533144,-121.920597,"Color Me Mine","Fremont"
"9742362","Color Me Mine....Let's Paint Some Ceramics....",1234643820000,1235613600000,37.533144,-121.920597,"Color Me Mine","Fremont"
"28856341","FUNDRAISER: Wine Tastings & Good Company",1312914260000,1314496800000,37.533144,-121.920597,"Color Me Mine","Fremont"
"15226932","COLOR ME MINE (LET'S PAINT SOME CERAMICS)",1288048400000,1289354400000,37.533144,-121.920597,"Color Me Mine","Fremont"
"21128761","Everything You Need to Know About Git but Were Afraid to Ask",1307339743000,1.308186e+12,37.421715,-122.084572,"Googleplex (Bldg. 43)","Mountain View"
"9746310","Google Triple Play: Project Hosting, Webmaster Tools & Analytics",1234721077000,1236218400000,37.421715,-122.084572,"Googleplex (Bldg. 43)","Mountain View"
"17434850","Honeycomb Highlights by Romain Guy & Chet Haase",1303793284000,1306976400000,37.421715,-122.084572,"Googleplex (Bldg. 43)","Mountain View"
"13041244","Caching in the Clouds: Applying Ehcache and Terracotta to Cloud Deployments",1269985994000,1273107600000,37.421715,-122.084572,"Googleplex (Bldg. 43)","Mountain View"
"10012586","JSR 315: Java Servlet 3.0 Specification",1237772255000,1.242783e+12,37.421715,-122.084572,"Googleplex (Bldg. 43)","Mountain View"
"15159644","Google Maps JavaScript API V3: Hands-On Session with Mano Marks",1287506371000,1288832400000,37.421715,-122.084572,"Googleplex (Bldg. 43)","Mountain View"
"10863214","Google Chrome Extensions, Chrome Frame and Chrome OS",1247467728000,1259805600000,37.421715,-122.084572,"Googleplex (Bldg. 43)","Mountain View"
"13405866","Caching in the Clouds: Applying Ehcache and Terracotta to Cloud Deployments",1273172297000,1275526800000,37.421715,-122.084572,"Googleplex (Bldg. 43)","Mountain View"
"10863208","November Meeting: Google Health",1247467582000,1257991200000,37.421715,-122.084572,"Googleplex (Bldg. 43)","Mountain View"
"11620691","JavaFX with Richard Bair",1255477146000,1260410400000,37.421715,-122.084572,"Googleplex (Bldg. 43)","Mountain View"
"74954802","Google Compute Engine",1343275548000,1343869200000,37.421715,-122.084572,"Googleplex (Bldg. 43)","Mountain View"
"17217119","Richard Bair Reveals All on JavaFX 2.0",1302164974000,1302742800000,37.421715,-122.084572,"Googleplex (Bldg. 43)","Mountain View"
"29712461","JVM goes to BigData",1313516561000,1316653200000,37.421715,-122.084572,"Googleplex (Bldg. 43)","Mountain View"
"17449317","Lightning Talks!",1303878472000,1304557200000,37.421715,-122.084572,"Googleplex (Bldg. 43)","Mountain View"
"35744522","Google+ API",1317498531000,1318467600000,37.421715,-122.084572,"Googleplex (Bldg. 43)","Mountain View"
"23678251","JavaSE 7 Launch",1309190740000,1.31121e+12,37.421715,-122.084572,"Googleplex (Bldg. 43)","Mountain View"
"9804456","JBoss RichFaces by Max Katz",1235414483000,1237339800000,37.421715,-122.084572,"Googleplex (Bldg. 43)","Mountain View"
"16940490","Fusion Tables by Kathryn Hurley",1300261192000,1.302138e+12,37.421715,-122.084572,"Googleplex (Bldg. 43)","Mountain View"
"38521192","RIA in Java without Plug-ins or JavaScript.",1319478255000,1.320282e+12,37.421715,-122.084572,"Googleplex (Bldg. 43)","Mountain View"
"14925425","James Gosling",1285691230000,1290045600000,37.421715,-122.084572,"Googleplex (Bldg. 43)","Mountain View"
"16044343","The JCP and the JUG Community",1294976634000,1295488800000,37.421715,-122.084572,"Googleplex (Bldg. 43)","Mountain View"
"12287755","Java Store & jFrog Artifactory",1263232327000,1268272800000,37.421715,-122.084572,"Googleplex (Bldg. 43)","Mountain View"
"12028548","The Future of the Web According to Dion Almaer and Ben Galbraith",1260108942000,1264039200000,37.421715,-122.084572,"Googleplex (Bldg. 43)","Mountain View"
"9797701","Python 3.0 and Google App Engine",1235335767000,1239238800000,37.421715,-122.084572,"Googleplex (Bldg. 43)","Mountain View"
"9960044","An Introduction to Scala for Java Developers",1237146920000,1240363800000,37.421715,-122.084572,"Googleplex (Bldg. 43)","Mountain View"
"12559455","Java Store & JFrog Artifactory",1265711272000,1268272800000,37.421715,-122.084572,"Googleplex (Bldg. 43)","Mountain View"
"9963416","Android 1.5 SDK",1237177881000,1.244682e+12,37.421715,-122.084572,"Googleplex (Bldg. 43)","Mountain View"
"42583882","Dart: A Language for Structured Web Programming by Seth Ladd and Steve Messick",1322456607000,1323309600000,37.421715,-122.084572,"Googleplex (Bldg. 43)","Mountain View"
"10246047","Google Technology on the iPhone",1240438764000,1.241658e+12,37.421715,-122.084572,"Googleplex (Bldg. 43)","Mountain View"
"10863204","Renovate Your Old App With Guice -- Jesse Wilson",1247467504000,1251939600000,37.421715,-122.084572,"Googleplex (Bldg. 43)","Mountain View"
"12641781","Google Buzz, Tell me what's a-happening?",1266532325000,1.267668e+12,37.421715,-122.084572,"Googleplex (Bldg. 43)","Mountain View"
"16001089","WebGL",1294707291000,1296698400000,37.421715,-122.084572,"Googleplex (Bldg. 43)","Mountain View"
"14547108","Freebase Talk by Kirrily Robert",1282802302000,1283389200000,37.421715,-122.084572,"Googleplex (Bldg. 43)","Mountain View"
"13262298","Extreme productivity with Spring Roo by Ramnivas Laddad (SpringSource)",1271970413000,1272502800000,37.421715,-122.084572,"Googleplex (Bldg. 43)","Mountain View"
"12038308","Silicon Valley GTUG: Past, Present and Future",1260220633000,1262829600000,37.421715,-122.084572,"Googleplex (Bldg. 43)","Mountain View"
"12987711","A Quick Tour of Contexts and Dependency Injection for Java EE by Reza Rahman",1269499944000,1279760400000,37.421715,-122.084572,"Googleplex (Bldg. 43)","Mountain View"
"14897790","Google Apps Script",1285479886000,1286413200000,37.421715,-122.084572,"Googleplex (Bldg. 43)","Mountain View"
"12892681","Extreme productivity with Spring Roo by Ramnivas Laddad (SpringSource)",1268764166000,1.271898e+12,37.421715,-122.084572,"Googleplex (Bldg. 43)","Mountain View"
"55484292","Lunch + Movie (Paan Singh Tomar)",1331189183000,1331492400000,37.552472,-121.978759,"Masala Grill","Fremont"
"16191158","Introduction to Technical Analysis",1296033899000,1297306800000,37.451637,-122.121932,"Enlightened Super Trader Education","Palo Alto"
"42995982","2012 - Bullish, Bearish or Sideways?",1322721461000,1.323918e+12,37.451637,-122.121932,"Enlightened Super Trader Education","Palo Alto"
"10191483","Meditation in Palo Alto - Guru Yoga",1239816914000,1241404200000,37.459199,-122.152941,"Be Yoga Studio","Menlo Park"
"50817672","Cloudstock: Join 3,000 developers for a day of cloud transformation",1328231286000,1331827200000,37.783743,-122.402128,"Moscone West","San Francisco"
"15394333","Cloudstock: The Woodstock for Cloud Developers",1289331465000,1.291653e+12,37.783743,-122.402128,"Moscone West","San Francisco"
"12524459","Open Mic",1265341112000,1266548400000,37.549718,-121.98737,"Barnes and Noble Booksellers","Fremont"
"12584376","Open Mic",1265934072000,1.268964e+12,37.549718,-121.98737,"Barnes and Noble Booksellers","Fremont"
"11707853","Open Mic November",1256500963000,1.258686e+12,37.549718,-121.98737,"Barnes and Noble Booksellers","Fremont"
"14160322","Open Mic",1279653420000,1282269600000,37.549718,-121.98737,"Barnes and Noble Booksellers","Fremont"
"14653028","Open Mic",1283573415000,1284688800000,37.549718,-121.98737,"Barnes and Noble Booksellers","Fremont"
"14873648","Open Mic",1285271022000,1287712800000,37.549718,-121.98737,"Barnes and Noble Booksellers","Fremont"
"13360598","Open Mic",1272841751000,1274407200000,37.549718,-121.98737,"Barnes and Noble Booksellers","Fremont"
"13781928","Open Mic",1276379769000,1276826400000,37.549718,-121.98737,"Barnes and Noble Booksellers","Fremont"
"13089313","Open Mic",1270469274000,1271383200000,37.549718,-121.98737,"Barnes and Noble Booksellers","Fremont"
"11714650","January Open Mic",1256575842000,1264129200000,37.549718,-121.98737,"Barnes and Noble Booksellers","Fremont"
"15360100","Open Mic",1289059410000,1290135600000,37.549718,-121.98737,"Barnes and Noble Booksellers","Fremont"
"11707876","November Meeting - Tanya Egan Gibson",1256501217000,1258840800000,37.566807,-122.023987,"Mountain Mike's Pizza","Fremont"
"40077942","READY .......SET.... LET'S START PLANNING THE  STURGIS RUN",1320520909000,1328063400000,37.566807,-122.023987,"Mountain Mike's Pizza","Fremont"
"12584401","Fremont Area Writers Club Meeting",1265934388000,1269723600000,37.566807,-122.023987,"Mountain Mike's Pizza","Fremont"
"13089351","Fremont Area Writers Club Meeting",1270469984000,1272142800000,37.566807,-122.023987,"Mountain Mike's Pizza","Fremont"
"62460862","Welcome Back Rich!! Pizza Dinner with Friends",1335574068000,1.336527e+12,37.566807,-122.023987,"Mountain Mike's Pizza","Fremont"
"12395913","Fremont Area Writers Club Meeting",1264199438000,1264888800000,37.566807,-122.023987,"Mountain Mike's Pizza","Fremont"
"12524433","Fremont Area Writers Club Meeting",1265340872000,1.267308e+12,37.566807,-122.023987,"Mountain Mike's Pizza","Fremont"
"17342335","$6 movie - ""Hoodwinked Too! Hood vs. Evil"" (animated comedy)",1303104674000,1304215200000,37.333934,-121.888182,"Tandoori Oven","San Jose"
"9870292","La Casita Mexican Restaurant and Book Swap (UPDATED)",1236100729000,1238721300000,37.530056,-121.958272,"La Casita Restaurant","Fremont"
"12829501","DINNER AT LA CASITA",1268158440000,1268874900000,37.530056,-121.958272,"La Casita Restaurant","Fremont"
"11180694","BOOK SWAP/RECIPE SWAP AT LA CASITA",1251065016000,1253062800000,37.530056,-121.958272,"La Casita Restaurant","Fremont"
"26939231","LA CASITA (MMMMMM MEXICAN FOOD)",1311603376000,1313458200000,37.530056,-121.958272,"La Casita Restaurant","Fremont"
"16106561","Lunch Bunch",1295453801000,1297371600000,37.530056,-121.958272,"La Casita Restaurant","Fremont"
"45029632","LA CASITA (MMMMMM MEXICAN FOOD)",1324403986000,1325816100000,37.530056,-121.958272,"La Casita Restaurant","Fremont"
"11266189","Fremont - Let's meet for spanish conversation.",1251865677000,1252976400000,37.530056,-121.958272,"La Casita Restaurant","Fremont"
"87277072","LA CASITA......MMMMMMMM....MEXICAN FOOD",1350426302000,1352858400000,37.530056,-121.958272,"La Casita Restaurant","Fremont"
"15572137","Holiday Season Two Day Ski Bus Trip to North Lake Tahoe",1290929939000,1292682600000,39.205094,-120.076306,"Tahoe Biltmore Lodge","Crystal Bay"
"35760672","Mr. Roger's Day Out",1317510210000,1335025800000,37.718025,-121.724274,"Starbucks","Livermore"
"48970812","BBQ 4 You",1327110929000,1338645600000,37.718025,-121.724274,"Starbucks","Livermore"
"36029442","Feather River Canyon - Quincy 2 Nighter",1317690691000,1340380800000,37.718025,-121.724274,"Starbucks","Livermore"
"16714190","Feather River Canyon - Quincy Overnighter",1298743877000,1309015800000,37.718025,-121.724274,"Starbucks","Livermore"
"16050974","All Aboard!!! Overnight Ride to Yosemite Mountain Sugar Pine Railroad",1295037871000,1310225400000,37.718025,-121.724274,"Starbucks","Livermore"
"7845304","Sex and the City Movie & Dinner",1209591333000,1.212804e+12,37.402465,-122.078304,"Round Table Pizza","Mountain View"
"48003962","Dinner and $6 Movie - ""The Hunger Games""",1326491852000,1.33272e+12,37.289905,-121.931769,"Hobee's","Campbell"
"qzzdxcyqnbmb","The Bay Area Private Money for Real Estate Investors Meetup",1337816387000,1349834400000,37.289905,-121.931769,"Hobee's","Campbell"
"dxzdxcyqmbpb","The Bay Area Private Money for Real Estate Investors Meetup",1337816324000,1347415200000,37.289905,-121.931769,"Hobee's","Campbell"
"29667501","ChinaTown Discovery Night  - reprise",1313480498000,1313895600000,37.790603,-122.405574,"Chinatown Entry Gate","San Francisco"
"nqsfpynmbfb","Softball Game 2 OR Batting Practice",1281414400000,1.283562e+12,37.340122,-122.059495,"Cupertino Middle School ","Sunnyvale"
"13344055","Saturdays 11:00am at Cupertino Middle School",1272665587000,1272736800000,37.340122,-122.059495,"Cupertino Middle School ","Sunnyvale"
"pnxqnynkbwb","Saturdays 11:00am at Cupertino Middle School",1277621765000,1279389600000,37.340122,-122.059495,"Cupertino Middle School ","Sunnyvale"
"12518403","Saturdays 11:00am at Cupertino Middle School",1265302735000,1265482800000,37.340122,-122.059495,"Cupertino Middle School ","Sunnyvale"
"17464517","FELLOWSHIP: Doggie Playdate!",1303975316000,1304121600000,37.560422,-121.957613,"Fremont Dog Park","Fremont"
"68513412","FELLOWSHIP: Playful Animals Without Stress (PAWS) Day",1339302307000,1339711200000,37.560422,-121.957613,"Fremont Dog Park","Fremont"
"23871631","FELLOWSHIP: Doggie Play Date",1309297258000,1.310076e+12,37.560422,-121.957613,"Fremont Dog Park","Fremont"
"cjglwyqlbsb","South Bay Writers Club Monthly Meeting",1344478929000,1344992400000,37.366623,-122.01643,"Round Table Pizza","Sunnyvale"
"41594732","Social Media Marketing Made Easy, by Evan Bailyn (Social Media Strategist)",1321589619000,1.322793e+12,37.39849,-122.14573,"SAP","Palo Alto"
"80240732","OPEN SV Monthly Planning Meeting",1346424738000,1.347498e+12,37.39849,-122.14573,"SAP","Palo Alto"
"83963932","Women Leadership Forum 2013- Kickoff Meeting",1348544873000,1348624800000,37.39849,-122.14573,"SAP","Palo Alto"
"44196672","OPEN SV Monthly Planning Meeting & Success Stories from Charter Members",1323703758000,1323914400000,37.39849,-122.14573,"SAP","Palo Alto"
"80240032","Is Email Going Away? - A Workshop by Laurie Beasley",1346424313000,1346893200000,37.39849,-122.14573,"SAP","Palo Alto"
"47161182","Charter Member Panel & Planning Meeting",1326007361000,1326333600000,37.39849,-122.14573,"SAP","Palo Alto"
"94166812","December Monthly Pitch Meeting",1354721910000,1.355364e+12,37.39849,-122.14573,"SAP","Palo Alto"
"40402022","OPEN SV Monthly Planning Meeting & Hear from two OPEN SV Charter members",1320764613000,1.320894e+12,37.39849,-122.14573,"SAP","Palo Alto"
"91321412","Monthly Planning Meeting & Discussion with CMs Faraz Hoodbhoy & Zulki Khan",1352867313000,1352944800000,37.39849,-122.14573,"SAP","Palo Alto"
