"event_id","event_name","event_created","event_time","event_venue_lat","event_venue_lon","venue_name","venue_city"
"16594454","President's Day Edgewood Park San Mateo County 2-hour hike",1297904172000,1.298322e+12,37.474109,-122.278413,"Edgewood Park & Preserve","Redwood City"
"49081522","Edgewood Park 1pm Hike in Redwood City w/ Peggy 2 other groups (reschedule)",1327198262000,1327870800000,37.474109,-122.278413,"Edgewood Park & Preserve","Redwood City"
"53012022","Edgewood Park 1pm Hike in Redwood City w/ Peggy 2 + groups expect big turn out",1329719297000,1330894800000,37.474109,-122.278413,"Edgewood Park & Preserve","Redwood City"
"8142728","Tito, from Egypt, teaching in Redwood City, CA",1213468377000,1220808600000,37.48606,-122.22628,"Odd Fellows Hall","Redwood City"
"8142702","Tito, from Egypt, teaching in Redwood City, CA",1213468089000,1220720400000,37.48606,-122.22628,"Odd Fellows Hall","Redwood City"
"13535752","Astro Turf & Surf!! Mini-Golf @Malibu Castle THEN Old Port Lobster (& Rib) Shack",1274305095000,1275703200000,37.492973,-122.215096,"Malibu Grand Prix","Redwood City"
"7073335","First (under new management) Web 2.0 Mapping and Social Network of 2008!",1199906575000,1203476400000,37.478172,-122.18584,"Sonnenschein Nath & Rosenthal","Menlo Park"
"7079219","Web 2.0 Mapping and Social Networks Group February Meetup",1199967013000,1203476400000,37.478172,-122.18584,"Sonnenschein Nath & Rosenthal","Menlo Park"
"7760168","Peninsula Habitat for Humanity",1208476820000,1224948600000,37.479465,-122.22699,"Peninsula Habitat RWC","Redwood City"
"6149490","The Menlo Park French Conversation Group Meetup",1186627765000,1188957600000,37.453022,-122.18172,"Cafe Borrone","Menlo Park"
"8260885","The Menlo Park French Conversation Group Meetup",1214973925000,1219197600000,37.453022,-122.18172,"Cafe Borrone","Menlo Park"
"6149489","The Menlo Park French Conversation Group Meetup",1186627765000,1188352800000,37.453022,-122.18172,"Cafe Borrone","Menlo Park"
"8260875","The Menlo Park French Conversation Group Meetup",1214973791000,1219802400000,37.453022,-122.18172,"Cafe Borrone","Menlo Park"
"7160203","Poetry Night  (Menlo Park)",1200877908000,1201835700000,37.453022,-122.18172,"Cafe Borrone","Menlo Park"
"7225915","The Menlo Park French Conversation Group Meetup",1201666283000,1.204686e+12,37.453022,-122.18172,"Cafe Borrone","Menlo Park"
"15497572","""Molly's Revenge with Moira Smiley"" at Angelica's Bistro, Redwood City",1290145428000,1291343400000,37.485424,-122.225914,"Angelica's Bistro","Redwood City"
"15684448","National Puzzle Day Celebration and Competition",1291862563000,1.296324e+12,37.485905,-122.226265,"Jigsaw Java","Redwood City"
"13352247","Memorial Day Puzzle Meetup",1272754038000,1.275336e+12,37.485905,-122.226265,"Jigsaw Java","Redwood City"
"8719944","Celebrate the Autumn Equinox with a Druid ritual",1220937316000,1222041600000,37.482537,-122.181899,"Bayfront Park","Menlo Park"
"16258826","So many movies, so little time",1286248479000,1299902400000,37.48576,-122.2286,"Century 20 Redwood City","Redwood City"
"7019755","'There Will Be Blood' by P. T. Anderson",1199347226000,1202004900000,37.48576,-122.2286,"Century 20 Redwood City","Redwood City"
"wfclnypkbrb","Java 7 and JavaFX",1271145917000,1310605200000,37.532315,-122.264537,"Oracle Conference Center","Redwood Shores"
"wfclnyrfbrb","SvJugFx Live Event",1333061884000,1363223700000,37.532315,-122.264537,"Oracle Conference Center","Redwood Shores"
"wfclnypnbqb","Progressive JavaFX 2.0 Custom Components",1271145917000,1.318554e+12,37.532315,-122.264537,"Oracle Conference Center","Redwood Shores"
"wfclnyrcbmb","THE MOCHA RASPBERRY PI LAB (US Edition)",1333060908000,1358388900000,37.532315,-122.264537,"Oracle Conference Center","Redwood Shores"
"wfclnypjblb","Hands-on JavaFX Coding in Alternative Languages",1271145917000,1307581200000,37.532315,-122.264537,"Oracle Conference Center","Redwood Shores"
"wfclnyrgbnb","SvJugFx Live Event",1336376045000,1365642900000,37.532315,-122.264537,"Oracle Conference Center","Redwood Shores"
"38348972","Beer/Burger Bash  @  Marvin Gardens - Belmont",1319324530000,1.321497e+12,37.5197,-122.274131,"Marvin Gardens","Belmont"
"8573746","Pinball & Burgers @ Canyon Inn - Hidden in the Hills Near Emerald Lake",1219112712000,1.229571e+12,37.472548,-122.25991,"Canyon Inn","Redwood City"
"6154286","Saturday Night Wine Tasting and Cocktail Party at British Banker's Club",1186701500000,1.189305e+12,37.453757,-122.182652,"British Bankers Club","Menlo Park"
"17579179","Blue Jean Ball (Adults of all ages)",1304785911000,1306551600000,37.523086,-122.261031,"Hotel Sofitel ","Redwood City"
"13408475","Silicon Valley Singles Convention",1273187170000,1276396200000,37.523086,-122.261031,"Hotel Sofitel ","Redwood City"
"14813962","Halloween Costume Dance Party ",1284829373000,1288407600000,37.523086,-122.261031,"Hotel Sofitel ","Redwood City"
"13803186","Doc Wong Motorcycle Ergonomics & Optimal Riding Position Workshop",1276567719000,1278728100000,37.457627,-122.227144,"Doc Wong's Chiropractic Office","Redwood City"
"13597782","Doc Wong Basic Suspension Workshop Part 1",1274843234000,1276912800000,37.457627,-122.227144,"Doc Wong's Chiropractic Office","Redwood City"
"9563692","Doc Wong Street Riding Clinic",1232475911000,1232902800000,37.457627,-122.227144,"Doc Wong's Chiropractic Office","Redwood City"
"14753109","Doc Wong Street Riding Clinic",1284394037000,1.287936e+12,37.457627,-122.227144,"Doc Wong's Chiropractic Office","Redwood City"
"9563725","Doc Wong Certified First Aid/CPR for Motorcyclists!",1232476153000,1.234026e+12,37.457627,-122.227144,"Doc Wong's Chiropractic Office","Redwood City"
"15993029","Doc Wong Motorcycle Ergonomics & Optimal Riding Position",1294675350000,1296875700000,37.457627,-122.227144,"Doc Wong's Chiropractic Office","Redwood City"
"35162252","Doc Wong Adventure Dual Sport Clinic",1317142393000,1321586100000,37.457627,-122.227144,"Doc Wong's Chiropractic Office","Redwood City"
"9921140","Doc Wong Street Riding Clinic",1236658149000,1237132800000,37.457627,-122.227144,"Doc Wong's Chiropractic Office","Redwood City"
"9925981","Doc Wong Dual Sport Clinic for Larger Bikes (Required Friday Lecture)",1236720453000,1240625700000,37.457627,-122.227144,"Doc Wong's Chiropractic Office","Redwood City"
"9921151","Doc Wong Motorcycle Ergonomics and Body Positioning Workshop",1236658418000,1236996900000,37.457627,-122.227144,"Doc Wong's Chiropractic Office","Redwood City"
"34420562","Doc Wong Street Riding Clinic - Cornering Confidence - Lines of Travel (2 Step)",1316623295000,1318780800000,37.457627,-122.227144,"Doc Wong's Chiropractic Office","Redwood City"
"41384162","Doc Wong Street Riding Clinic: ""Smooth Riding - Shifting and Braking""",1321460479000,1324227600000,37.457627,-122.227144,"Doc Wong's Chiropractic Office","Redwood City"
"9921179","""Basic Suspension Part 2""",1236658581000,1237601700000,37.457627,-122.227144,"Doc Wong's Chiropractic Office","Redwood City"
"9563713","Doc Wong Basic Suspension Workshop Part 2",1232476083000,1233371700000,37.457627,-122.227144,"Doc Wong's Chiropractic Office","Redwood City"
"16675269","Doc Wong Certified First Aid/CPR for Motorcyclists!",1298483826000,1305388800000,37.457627,-122.227144,"Doc Wong's Chiropractic Office","Redwood City"
"33374532","Doc Wong Motorcycle Ergonomics & Optimal Riding Position Workshop (CANCELLED)",1315930198000,1318040100000,37.457627,-122.227144,"Doc Wong's Chiropractic Office","Redwood City"
"13532454","Doc Wong Motorcycle Ergonomics & Optimal Riding Position Workshop",1274289617000,1276308900000,37.457627,-122.227144,"Doc Wong's Chiropractic Office","Redwood City"
"14832671","Next Basic Suspension Workshop Part 1--Oct 15 Fri Night!",1285000760000,1287195300000,37.457627,-122.227144,"Doc Wong's Chiropractic Office","Redwood City"
"34271062","Doc Wong Basic Suspension Workshop - Part 1",1316537124000,1318644900000,37.457627,-122.227144,"Doc Wong's Chiropractic Office","Redwood City"
"17177722","Doc Wong Dual Sport Adventure Riding Clinic (Required Friday Lecture)",1301936035000,1305944100000,37.457627,-122.227144,"Doc Wong's Chiropractic Office","Redwood City"
"16383475","Doc Wong Dual Sport Adventure Riding Clinic (Required Friday Lecture)",1296495360000,1301105700000,37.457627,-122.227144,"Doc Wong's Chiropractic Office","Redwood City"
"17243743","Doc Wong Motorcycle Ergonomics & Optimal Riding Position Workshop",1302366883000,1304734500000,37.457627,-122.227144,"Doc Wong's Chiropractic Office","Redwood City"
"16846325","Doc Wong Motorcycle Ergonomics & Optimal Riding Position Workshop",1299608068000,1302315300000,37.457627,-122.227144,"Doc Wong's Chiropractic Office","Redwood City"
"13816286","Doc Wong Certified First Aid/CPR for Motorcyclists!!",1276663235000,1281196800000,37.457627,-122.227144,"Doc Wong's Chiropractic Office","Redwood City"
"9926003","Doc Wong Motorcycle Ergonomics and Body Positioning Workshop",1236720606000,1239416100000,37.457627,-122.227144,"Doc Wong's Chiropractic Office","Redwood City"
"16077842","Basic Suspension Workshop - Part 1",1295277647000,1298085300000,37.457627,-122.227144,"Doc Wong's Chiropractic Office","Redwood City"
"17278911","Doc Wong Street Riding Clinic - Cornering Confidence - Lines of Travel (2 Step)",1302631663000,1305475200000,37.457627,-122.227144,"Doc Wong's Chiropractic Office","Redwood City"
"14753236","Doc Wong Motorcycle Ergonomics & Optimal Riding Position Workshop",1284394681000,1287800100000,37.457627,-122.227144,"Doc Wong's Chiropractic Office","Redwood City"
"17014509","Doc Wong Street Riding Clinic!",1300817363000,1302451200000,37.457627,-122.227144,"Doc Wong's Chiropractic Office","Redwood City"
"15798830","Doc Wong Certified First Aid/CPR for Motorcyclists!!",1293034446000,1298134800000,37.457627,-122.227144,"Doc Wong's Chiropractic Office","Redwood City"
"15742385","Doc Wong Dual Sport Adventure Riding Clinic (Required Friday Lecture)",1292438132000,1296270900000,37.457627,-122.227144,"Doc Wong's Chiropractic Office","Redwood City"
"14952859","Doc Wong/Cal BMW Dual Sport Clinic for Larger Bikes (Required Friday Lecture)",1285870240000,1290827700000,37.457627,-122.227144,"Doc Wong's Chiropractic Office","Redwood City"
"28840291","Doc Wong Certified First Aid/CPR for Motorcyclists!",1312907883000,1320508800000,37.457627,-122.227144,"Doc Wong's Chiropractic Office","Redwood City"
"14366850","Doc Wong Certified First Aid/CPR for Motorcyclists!",1281372020000,1.28664e+12,37.457627,-122.227144,"Doc Wong's Chiropractic Office","Redwood City"
"13872458","Doc Wong Street Riding Clinic",1277184837000,1.279512e+12,37.457627,-122.227144,"Doc Wong's Chiropractic Office","Redwood City"
"13872479","Basic Suspension Workshop - Part 2",1277185186000,1279332900000,37.457627,-122.227144,"Doc Wong's Chiropractic Office","Redwood City"
"crpdvyplbpc","Regular Meeting",1309036519000,1.314801e+12,37.499223,-122.223823,"The Waterfront Restaurant","Redwood City"
"crpdvypkbjb","Regular Meeting",1309036519000,1309962600000,37.499223,-122.223823,"The Waterfront Restaurant","Redwood City"
"62872202","Regular meeting",1335844535000,1.338993e+12,37.499223,-122.223823,"The Waterfront Restaurant","Redwood City"
"crpdvyqjbjb","Regular Meeting",1338478491000,1.338993e+12,37.499223,-122.223823,"The Waterfront Restaurant","Redwood City"
"crpdvyplbgc","Regular Meeting",1309036519000,1314196200000,37.499223,-122.223823,"The Waterfront Restaurant","Redwood City"
"42076972","Videos and Aphorisms",1321989809000,1.322424e+12,37.483185,-122.178054,"TechShop","Menlo Park"
"16108022","Holistic Salon: Reductionism",1295460689000,1295812800000,37.483185,-122.178054,"TechShop","Menlo Park"
"6199596","Reports from Singularity Summit",1187394347000,1189972800000,37.483185,-122.178054,"TechShop","Menlo Park"
"15894646","Video: Jeff Hawkins, Numenta: New HTM Cortical Learning algorithms ",1294044487000,1294603200000,37.483185,-122.178054,"TechShop","Menlo Park"
"39965582","Holiday Wreath Making Workshop",1320430863000,1322337600000,37.483185,-122.178054,"TechShop","Menlo Park"
"6218733","AI Meetup (Discussion): Assigning your AI an IQ",1187715615000,1188763200000,37.483185,-122.178054,"TechShop","Menlo Park"
"60209822","Textiles Meet-Up",1334189924000,1335034800000,37.483185,-122.178054,"TechShop","Menlo Park"
"8700291","Inventors Alliance 15th Anniversary Party and Networking Event",1220677478000,1221322500000,37.483185,-122.178054,"TechShop","Menlo Park"
"9326206","Karaoke @ Carlos Club = FrankenDive Lives Again!!",1229065620000,1233977400000,37.506762,-122.260241,"Carlos Club","San Carlos"
"9457090","Peninsula Speed Dating and Karaoke Party",1231231078000,1.233198e+12,37.506762,-122.260241,"Carlos Club","San Carlos"
"40003012","Huddard Park 10 Mile Morning Practice Run",1320451121000,1320505200000,37.430383,-122.289613,"Huddart Park","Woodside"
"82386932","Save the date, 2nd annual ice cream social and multi-tiered hike",1347636802000,1350242100000,37.430383,-122.289613,"Huddart Park","Woodside"
"69573402","Morning Run at Huddart Park",1339964739000,1345907700000,37.430383,-122.289613,"Huddart Park","Woodside"
"9353725","Yum Yum Dim Sum",1229542525000,1233280800000,37.521877,-122.274787,"China Village Sea Food ","Belmont"
"8573775","Tacos & Tequila @ Coyote's + Beer/Guinness @ Clooney's in 1 Block o' San Carlos!",1219112993000,1231556400000,37.500871,-122.253958,"Coyote's Mexican Cantina","San Carlos"
"13906432","Disco Skate",1277446791000,1279418400000,37.480847,-122.224156,"Redwood Roller Rink","Redwood City"
"15795074","Dive Rink Rollerskating ünd ßiër züm Dëüstchländ!!",1292982908000,1296876600000,37.480847,-122.224156,"Redwood Roller Rink","Redwood City"
"9342070","Dive Rink Rollerskating ünd ßiër züm Dëüstchländ!!",1229366211000,1.23579e+12,37.480847,-122.224156,"Redwood Roller Rink","Redwood City"
"9522761","Ecstatic Dance & Drum - Free Event",1231958546000,1.232766e+12,37.558523,-122.267582,"Peninsula Jewish Community Center","Foster City"
"9535410","East Coast Cheesesteaks & Western Cowboy Pool @ Jersey Joe's & The Lariat",1232078620000,1.237428e+12,37.512708,-122.266524,"Jersey Joe's Cheesesteaks and Hoagies","San Carlos"
"88566862","A Visit From Wine Country",1351197260000,1353205800000,37.533558,-122.248108,"Richard's place","Redwood Shores"
"15905983","Crafting Effective Urban Water Management Plans",1294104220000,1294693200000,37.484612,-122.227844,"Redwood City Council Chambers","Redwood City"
"9474841","Saturday Night Special: Tacqueria El Gruellense & Mardi Gras Bar",1231391874000,1.238292e+12,37.482009,-122.230077,"Taqueria El Grullense","Redwood City"
"vmwlqypnbhc","Hybrid Clouds",1297552041000,1319592600000,37.479392,-122.184632,"Orrick","Menlo Park"
"17917601","Attend SVForum's Cloud & Virtualization SIG: PaaS: The Future is Open",1305071287000,1311730200000,37.479392,-122.184632,"Orrick","Menlo Park"
"vmwlqypmbkc","Cloud Computing & Virtualization SIG Meeting",1297552041000,1317173400000,37.479392,-122.184632,"Orrick","Menlo Park"
"vmwlqyqcbgc","Cloud M&A",1317146143000,1327458600000,37.479392,-122.184632,"Orrick","Menlo Park"
"vmwlqypjblc","The Future of the Data Center",1297552041000,1.309311e+12,37.479392,-122.184632,"Orrick","Menlo Park"
"vmwlqypgbjc","Scaling enterprise applications in cloud computing environments",1297552041000,1303867800000,37.479392,-122.184632,"Orrick","Menlo Park"
"vmwlqypfbdc","Cloud SIG - Cloud Security Night",1297552041000,1300843800000,37.479392,-122.184632,"Orrick","Menlo Park"
"vmwlqyplbfc","OpenStack: Just how big can this get?",1297552041000,1314149400000,37.479392,-122.184632,"Orrick","Menlo Park"
"vmwlqyphbgc","Cloud SIG: Virtual Networks",1297552041000,1.306287e+12,37.479392,-122.184632,"Orrick","Menlo Park"
"cbnfqypdbjc","Call of Soul",1294625378000,1298757600000,37.486616,-122.226574,"Redwood City Eckankar Center","Redwood City"
"15440194","Community HU Song: Let Go and Let God--Chant HU!",1289709219000,1292036400000,37.486616,-122.226574,"Redwood City Eckankar Center","Redwood City"
"cbnfqypdbhb","Call of Soul",1294625378000,1296943200000,37.486616,-122.226574,"Redwood City Eckankar Center","Redwood City"
"15564888","Your Doorway to Wisdom, Freedom and Love",1290839066000,1291507200000,37.486616,-122.226574,"Redwood City Eckankar Center","Redwood City"
"13154984","Problem Solving Exercises",1271041781000,1277593200000,37.486616,-122.226574,"Redwood City Eckankar Center","Redwood City"
"15924998","Last Minute BDay Addition",1294203467000,1.294542e+12,37.490458,-122.228374,"Old Port Lobster Shack","Redwood City"
"16544129","Discover how Rebuilding Together are preparing for National Rebuilding day",1297555245000,1298840400000,37.483999,-122.211922,"Rebuilding Together Peninsula Warehouse","Redwood City"
"83172292","Everything is Illuminated by Jonathan Safran Foer",1348090560000,1361930400000,37.532716,-122.256898,"Redwood Shores Library","Redwood City"
"83172072","State of Wonder by Ann Patchet",1348090443000,1359511200000,37.532716,-122.256898,"Redwood Shores Library","Redwood City"
"16201735","The History of Love by Nicole Krauss",1296092196000,1.30689e+12,37.532716,-122.256898,"Redwood Shores Library","Redwood City"
"27532761","Cat's Cradle by Kurt Vonnegut",1311973704000,1319590800000,37.532716,-122.256898,"Redwood Shores Library","Redwood City"
"67608892","The Glass Castle by Jeannette Walls",1338775199000,1348621200000,37.532716,-122.256898,"Redwood Shores Library","Redwood City"
"67608722","The Book Thief by Markus Zusak",1338775120000,1.346202e+12,37.532716,-122.256898,"Redwood Shores Library","Redwood City"
"13325799","The Enchantress of Florence by Salman Rushdie",1272507831000,1277859600000,37.532716,-122.256898,"Redwood Shores Library","Redwood City"
"39375492","When the Emporer was Divine by Julie Otsuka",1320083165000,1330480800000,37.532716,-122.256898,"Redwood Shores Library","Redwood City"
"39375412","The Persian Boy by Mary Renault",1320083111000,1328061600000,37.532716,-122.256898,"Redwood Shores Library","Redwood City"
"39375602","Death with Interruptions by Jose Saramago",1320083218000,1332896400000,37.532716,-122.256898,"Redwood Shores Library","Redwood City"
"27533171","Suttree by Cormac McCarthy",1311973960000,1322618400000,37.532716,-122.256898,"Redwood Shores Library","Redwood City"
"qklfncyqjbwb","Connect for Democracy - Money out of Politics",1336750229000,1339966800000,37.532716,-122.256898,"Redwood Shores Library","Redwood City"
"83171602","Something Wicked This Way Comes by Ray Bradbury",1348090202000,1351645200000,37.532716,-122.256898,"Redwood Shores Library","Redwood City"
"13957364","Water for Elephants by Sara Gruen",1277877284000,1288141200000,37.532716,-122.256898,"Redwood Shores Library","Redwood City"
"54231142","Cloud Atlas by David Mitchell",1330465731000,1340758800000,37.532716,-122.256898,"Redwood Shores Library","Redwood City"
"17505034","The Surrendered by Chang Rae Lee",1304299812000,1311728400000,37.532716,-122.256898,"Redwood Shores Library","Redwood City"
"13325854","Adventures of Huckleberry Finn by Mark Twain",1272508123000,1280278800000,37.532716,-122.256898,"Redwood Shores Library","Redwood City"
"16201673","Carter Beats the Devil by Glen David Gold",1296091816000,1.303866e+12,37.532716,-122.256898,"Redwood Shores Library","Redwood City"
"83171862","The Night Circus by Erin Morgenstern",1348090304000,1.354068e+12,37.532716,-122.256898,"Redwood Shores Library","Redwood City"
"14939575","The Virgin Suicides by Jeffrey Eugenides",1285782337000,1298426400000,37.532716,-122.256898,"Redwood Shores Library","Redwood City"
"67608572","Salvage the Bones by Jesmyn Ward",1338775036000,1343782800000,37.532716,-122.256898,"Redwood Shores Library","Redwood City"
"dwxmqypfbnb","Playgroup at Marlin Park",1298241725000,1299781800000,37.532716,-122.256898,"Redwood Shores Library","Redwood City"
"54231072","A Confederacy of Dunces by John Toole",1330465704000,1338339600000,37.532716,-122.256898,"Redwood Shores Library","Redwood City"
"16201537","Brooklyn by Colm Toibin",1296091412000,1301446800000,37.532716,-122.256898,"Redwood Shores Library","Redwood City"
"qklfncyqgblb","General Membership Meeting",1326578425000,1.33452e+12,37.532716,-122.256898,"Redwood Shores Library","Redwood City"
"14939515","The Catcher in the Rye by J.D. Salinger",1285782101000,1291168800000,37.532716,-122.256898,"Redwood Shores Library","Redwood City"
"17505058","A Spot of Bother by Mark Haddon",1304299955000,1314752400000,37.532716,-122.256898,"Redwood Shores Library","Redwood City"
"15480311","Salsa Networking Meetup",1290027199000,1.291257e+12,37.485695,-122.225891,"Deseo Tequila Lounge & Restaurant","Redwood City"
"15480344","SPECIAL Salsa Networking Meetup 12/15: filming testimonials!",1290027328000,1292466600000,37.485695,-122.225891,"Deseo Tequila Lounge & Restaurant","Redwood City"
"86987162","Wine Tasting Mom Break ",1350262200000,1350761400000,37.481398,-122.209301,"La Honda Winery ","Redwood City"
"35464282","Our First Fall Reading Choice--Cutting For Stone",1317311596000,1320004800000,37.527238,-122.228517,"Redwood Shores Library","Redwood City"
"72854822","Newcomer Hike, Edgewood Park Sunday, July 22, 2012 at 9:45 a.m.",1341984929000,1342975500000,37.466855,-122.285237,"Edgewood Park and Preserve","Redwood City"
"53639412","Newcomer Hike - Edgewood Park - 4 miles",1330099819000,1330282800000,37.466855,-122.285237,"Edgewood Park and Preserve","Redwood City"
"14835689","Manifest Your Dreams--Create a Beautiful Vision Board",1285014310000,1287712800000,37.466225,-122.2246,"Align the Self ","Redwood City"
"97585622","Set Intentions & Craft Your Vision for 2013 with a Vision Board",1357175734000,1358984700000,37.466225,-122.2246,"Align the Self ","Redwood City"
"jtgtpynpbcc","Adoption Day - Doggie Protective Services - PET FOOD EXPRESS Redwood City",1288646913000,1290369600000,37.463445,-122.22568,"Pet Food Express","Redwood City"
"15039722","Adoption Day - Doggie Protective Services - PET FOOD EXPRESS Redwood City",1286494841000,1.287342e+12,37.463445,-122.22568,"Pet Food Express","Redwood City"
"15909428","Tennis Canada College (Redwood City)",1294119661000,1295197200000,37.447541,-122.26314,"Canada College","Redwood City"
"77633242","Tennis Redwood City - Canada College",1344905504000,1346601600000,37.447541,-122.26314,"Canada College","Redwood City"
"69630302","Tennis Redwood City - Canada College",1340003500000,1341158400000,37.447541,-122.26314,"Canada College","Redwood City"
"25824861","Tennis Canada College (Redwood City)",1310708781000,1312732800000,37.447541,-122.26314,"Canada College","Redwood City"
"38491542","Tennis Redwood City - Canada College",1319464018000,1320598800000,37.447541,-122.26314,"Canada College","Redwood City"
"14737192","Saturday Drop-In Social Tennis ",1284244316000,1.284858e+12,37.447541,-122.26314,"Canada College","Redwood City"
"16460792","Tennis Canada College (Redwood City)",1296975954000,1298221200000,37.447541,-122.26314,"Canada College","Redwood City"
"33171242","Tennis Redwood City - Canada College",1315797065000,1316966400000,37.447541,-122.26314,"Canada College","Redwood City"
"39266202","Tennis Redwood City - Canada College",1319997320000,1321203600000,37.447541,-122.26314,"Canada College","Redwood City"
"71448692","Tennis Redwood City - Canada College",1341095117000,1342972800000,37.447541,-122.26314,"Canada College","Redwood City"
"83900902","Art, Olives..and the Sun Kings.",1348520415000,1349636400000,37.447541,-122.26314,"Canada College","Redwood City"
"14808938","Tennis Canada College (Redwood City)",1284769941000,1285516800000,37.447541,-122.26314,"Canada College","Redwood City"
"25824701","Tennis Canada College (Redwood City)",1310708627000,1.312128e+12,37.447541,-122.26314,"Canada College","Redwood City"
"26905791","Saturday Twilight Drop-In Social Tennis",1311561124000,1312075800000,37.447541,-122.26314,"Canada College","Redwood City"
"16460795","Tennis Canada College (Redwood City)",1296976005000,1.298826e+12,37.447541,-122.26314,"Canada College","Redwood City"
"15909426","Tennis Canada College (Redwood City)",1294119640000,1294592400000,37.447541,-122.26314,"Canada College","Redwood City"
"26905921","Friday Twilight Drop-In Social Tennis",1311561188000,1311989400000,37.447541,-122.26314,"Canada College","Redwood City"
"71448662","Tennis Redwood City - Canada College",1341095102000,1.342368e+12,37.447541,-122.26314,"Canada College","Redwood City"
"32682352","Tennis Redwood City - Canada College",1315441455000,1316361600000,37.447541,-122.26314,"Canada College","Redwood City"
"48848782","Tennis Redwood City - Canada College",1327025069000,1327856400000,37.447541,-122.26314,"Canada College","Redwood City"
"22739301","Tennis Canada College (Redwood City)",1308501358000,1310313600000,37.447541,-122.26314,"Canada College","Redwood City"
"14694010","Tennis Canada College (Redwood City)",1283919966000,1.284912e+12,37.447541,-122.26314,"Canada College","Redwood City"
"71448712","Tennis Redwood City - Canada College",1341095129000,1343577600000,37.447541,-122.26314,"Canada College","Redwood City"
"dwxsgdyrcblb","Redwood City Advanced Beginner - 3.0 Meet Up @ Red Morton Community Park",1345051314000,1357693200000,37.47152,-122.235126,"Red Morton Community Center","Redwood City"
"dwxsgdyrfbjc","Advanced Beginner (2.5 – 3.0) Meet Up @ Red Morton",1345051314000,1364346900000,37.47152,-122.235126,"Red Morton Community Center","Redwood City"
"15618282","2nd Joint Classic & Indie Films Meetups Social Event!!",1291272463000,1295215200000,37.48581,-122.229306,"Cafe La Tartine","Redwood City"
"qvmqkfyrfblc","Afternoon Weekly Meetup",1360900997000,1364517900000,37.48581,-122.229306,"Cafe La Tartine","Redwood City"
"15617553","2nd Joint Indie & Classic Films Meetups Social Event",1291265328000,1295215200000,37.48581,-122.229306,"Cafe La Tartine","Redwood City"
