"event_id","event_name","event_created","event_time","event_venue_lat","event_venue_lon","venue_name","venue_city"
"dszzdcyqnbxb","Afro Belly Boogie Workout - Oakland High Street",1350061675000,1.350576e+12,37.769096,-122.223907,"24 Hour Fitness","Oakland"
"dszzdcyrdbcc","Afro Belly Boogie Workout - Oakland High Street",1318459665000,1.361466e+12,37.769096,-122.223907,"24 Hour Fitness","Oakland"
"dszzdcyrdbsb","Afro Belly Boogie Workout - Oakland High Street",1318459665000,1360861200000,37.769096,-122.223907,"24 Hour Fitness","Oakland"
"36598272","protest unrestrained corporate greed and maybe have a Guinness",1318050312000,1318712400000,37.792938,-122.395432,"101 Market St","San Francisco"
"41870432","Lunch at Phil's Fish Market",1321838846000,1339354800000,37.230865,-121.979996,"Starbucks","Los Gatos"
"21469561","Bay Area Science Festival 10/29-11/6",1307552473000,1.320606e+12,37.778141,-122.390869,"AT&T Park","San Francisco"
"38327672","Game night",1319305202000,1321671600000,37.87072,-122.293045,"The Albatross Pub","Berkeley"
"66660482","Let's meet and make new friends!",1338226556000,1340413200000,37.87072,-122.293045,"The Albatross Pub","Berkeley"
"38741912","Other People's Code | Best Practices | @ UC Berkeley with Citrix Online",1319597615000,1320978600000,37.874146,-122.266457,"UC Berkeley","Berkeley"
"55375902","Founders Space March San Francisco Roundtable",1331143118000,1.333035e+12,37.789631,-122.395432,"RocketSpace Inc","San Francisco"
"40868202","3rd Annual Green Building Symposium and Celebration",1321067184000,1322780400000,37.869434,-122.266441,"David Brower Center","Berkeley"
"81046572","Anker, Chin, and Ozturk on the Shark's Fin, Meru (in Berkeley)",1346891038000,1349920800000,37.869434,-122.266441,"David Brower Center","Berkeley"
"43673342","Learn Composition and Master Your Camera +2 Hour Photo tour *GROUPON Deal",1323249865000,1332604800000,32.781906,-117.09655,"Right Light Studios","San Diego"
"79696372","graph something and discuss it",1346136523000,1.348191e+12,37.780991,-122.395592,"Engine Yard","San Francisco"
"40196472","Holiday Party-Cocktails, Appetizers and Dancing!",1320621443000,1.324179e+12,37.361351,-121.803406,"Bobbie's House","San Jose"
"39601642","Sat 11/12 ""Family of Friends"" Pot Luck Style Main Dish Thai Noodle Soup",1320206647000,1321131600000,37.791267,-122.204323,"3509 Suter St","Oakland"
"77237182","Game Design Conference Sept 17 Fairmont Hotel",1344641223000,1347897600000,37.792339,-122.410515,"The Fairmont San Francisco Hotel","San Francisco"
"55690912","April Potluck and Skin Health Lecture with Free Skin Evaluations by Dr T",1331322490000,1.335744e+12,37.780094,-122.390632,"The Warehouse","San Francisco"
"ddpsgcyrcbnb","North University Community Libary Baby Sign Language Storytime Meetup",1320878480000,1.357848e+12,32.867622,-117.199081,"North University Community Branch Library","San Diego"
"dkhdlcyrdbtb","Party Up! and Dance Into Fitness",1326084811000,1360963800000,32.779202,-117.1269,"Mission Valley Library","San Diego"
"40878562","LEED-Platinum Renovation Open House and Tour",1321082172000,1.32174e+12,37.850464,-122.253494,"Gottfried Tesla Home","Oakland"
"90017982","Sail Along SF Water Front and Karaoke on the Boat&Dinner Afterwards",1352107770000,1.356219e+12,37.797676,-122.394341,"PIER 39","San Francisco"
"41527102","SF Edition: Tax Laws Have Changed-Learn How to Prepare W/ Experts from Outright!",1321554993000,1326337200000,37.793629,-122.398613,"Schlesinger Associates","San Francisco"
"72252632","Founders Space San Francisco July Roundtable",1341608981000,1343316600000,37.787758,-122.399712,"Reed Smith LLP","San Francisco"
"41795632","Mr. Rick's Martini Club's        Not Quite New Years Gala",1321782374000,1325991600000,37.804367,-122.26226,"Lake Merritt Hotel","Oakland"
"rmzvpyqjbmb","Dallas Daoism (Taoism) Meetup",1338145897000,1339264800000,33.001394,-96.685655,"Scalini's Pizza and Pasta","RICHARDSON "
"43100852","Bezerkeley Rehearsal",1322790066000,1.323054e+12,37.8694,-122.252975,"Berkeley Hillel","Berkeley"
"dkpwpcyqfbtb","Rehearsal and Singing Tags",1331352428000,1332727200000,37.8694,-122.252975,"Berkeley Hillel","Berkeley"
"43107352","Fungus Fair",1322793905000,1322935200000,37.87933,-122.246338,"Lawrence Hall of Science","Berkeley"
"dvhpccypqbcc","Hump Day Karaoke @ Rick's - Arlington (a weekly Meetup event)",1321212449000,1324515600000,32.723907,-97.114639,"Rick's Bar & Grill","Arlington"
"36214872","Startup Monthly Demo Day",1317806986000,1327273200000,37.781868,-122.395264,"PeopleBrowsr","San Francisco"
"43467822","Demo Pitch Coaching: Practice for January Demo Day",1323113464000,1326938400000,37.781868,-122.395264,"PeopleBrowsr","San Francisco"
"79199982","IGDA San Francisco Micro-Talk Event",1345831480000,1346896800000,37.789295,-122.401367,"Autodesk Gallery","San Francisco"
"52469732","Meetup @ Green Earth Cafe & Bakery, after UPC conference on Conscious Eating",1329332493000,1329616800000,37.8703,-122.267273,"Green Earth Cafe and Bakery","Berkeley"
"52468992","Meetup @ Green Earth Cafe & Bakery, after UPC conference on Conscious Eating",1329332069000,1329616800000,37.8703,-122.267273,"Green Earth Cafe and Bakery","Berkeley"
"98433832","Grey Ghost Paranormal Conference",1357594592000,1.359828e+12,37.765205,-122.241638,"USS Hornet","Alameda"
"93358842","WIZARD OF OZ & Paramount Theatre Private Tour! in Oakland",1354214784000,1356738300000,37.809704,-122.268219,"The Paramount Theatre","Oakland"
"dmlcgdyqpblb","Adult Group Class - Waltz/Swing",1351202751000,1352425500000,32.941055,-97.074181,"DANCE on the Vine","Grapevine"
"51321652","Firefox Add-ons Made Easy with Builder and SDK",1328576869000,1.329876e+12,37.789032,-122.389328,"Mozilla SF","San Francisco"
"44474402","Startup Socials Happy Hour",1323894880000,1326952800000,37.778458,-122.393349,"District","San Francisco"
"99481562","Crystal Castles @ the Fox",1358137165000,1.367118e+12,37.807716,-122.270058,"Fox Theater","Oakland"
"104791542","Metric @ Fox Theater",1360965261000,1366340400000,37.807716,-122.270058,"Fox Theater","Oakland"
"48981962","Let's meet up and develop a list of wish trips for all East Bay Travel Pals",1327119738000,1328929200000,37.796665,-122.276192,"Buttercup Grill & Bar","Oakland"
"hvttqyqlbvb","BayLISA in San Francisco - Solaris Theme",1322593866000,1345170600000,37.795345,-122.39373,"Joyent","San Francisco"
"50358802","You are invited to celebrate the 50th Anniversary of THE PERSUASIONS",1327993547000,1328673600000,37.795948,-122.27829,"Yoshi's Oakland","Oakland"
"64654952","Startup Party SF June 2012",1336948270000,1340940600000,37.783211,-122.396355,"Supper Club","San Francisco"
"59700112","Startup Social Party SF May 2012",1333883594000,1.336104e+12,37.783211,-122.396355,"Supper Club","San Francisco"
"88170612","San Francisco Chinatown",1350965705000,1.353204e+12,37.793381,-122.406136,"China Town ","San Francisco"
"51134392","monster jam",1328466598000,1.330209e+12,37.751553,-122.201569,"Oracle Arena & Oakland-Alameda County Coliseum","Oakland"
"51134852","monster jam",1328466719000,1.330209e+12,37.751553,-122.201569,"Oracle Arena & Oakland-Alameda County Coliseum","Oakland"
"65439742","""Catapult Your Career"" Workshop",1337405008000,1.339119e+12,32.824951,-117.118881,"4455 Murphy Canyon Road","San Diego"
"48912152","East Bay: Building Your Portfolio. Basics & Accelerated Real Estate Practices",1327081170000,1329447600000,37.829777,-122.248169,"4341 Piedmont Ave","Oakland"
"48912922","Emeryville: Building Your Portfolio. Basics & Accelerated Real Estate Practices",1327081708000,1329447600000,37.829777,-122.248169,"4341 Piedmont Ave","Oakland"
"95805012","Huge Salsa Dance Party with Live Band, 2 Lessons, free food and drinks!",1355858018000,1358652600000,37.838634,-122.294754,"Allegro Ballroom","Emeryville"
"90950492","HackerX-SF (iOS) Developer Ticket (Free)",1352663697000,1.354158e+12,37.787098,-122.399101,"WeWork","San Francisco"
"53403712","Berkeley Wine Festival Grand Opening",1329955748000,1330741800000,37.858841,-122.241943,"Claremont Hotel and Spa","Berkeley"
"53828222","Women in Renewable Energy Career Panel: How to Land Your Dream Job!",1330221561000,1334278800000,37.784615,-122.388382,"The Delancey Street Foundation Screening Room","San Francisco"
"55113842","What are the health effects of cell phone radiation?",1330986930000,1336615200000,37.852882,-122.266129,"La Pena Lounge at Cafe Valparaiso","Berkeley"
"105832852","Free Barn Tour",1361519857000,1362245400000,37.879906,-122.31028,"Golden Gate Fields","Berkeley"
"qvwqqcyqjbcc","Tai Chi at SF St Mary Square",1339788959000,1340302500000,37.792484,-122.405548,"St. Mary Square Park","San Francisco"
"qbfshfyrdblc","Tai Chi at SF St Mary Square",1359675319000,1.362078e+12,37.792484,-122.405548,"St. Mary Square Park","San Francisco"
"qvwqqcyqpbtb","Tai Chi at SF St Mary Square",1352492861000,1353006900000,37.792484,-122.405548,"St. Mary Square Park","San Francisco"
"qvwqqcyrcbfb","Tai Chi at SF St Mary Square",1331316390000,1357240500000,37.792484,-122.405548,"St. Mary Square Park","San Francisco"
"dvfvqcyqgbtb","Breakfast and Worship!!",1332007824000,1334502900000,32.924458,-96.874489,"Farmers Branch Church of Christ","Farmers Branch"
"56167172","Size Friendly Belly Dance workshop with full-figure bellydancers, RAKS AFRICA!",1331651692000,1333238400000,37.833202,-122.27655,"Destiny Arts Center","Oakland"
"69478442","GIANTS VS A'S IN OAKLAND",1339887475000,1.340568e+12,37.751553,-122.201569,"7000 Coliseum Way","Oakland"
"101736262","Valentine's Day Veg Speed Dating in Berkeley!",1359354139000,1.360899e+12,37.869728,-122.26609,"Saturn Cafe","Berkeley"
"qhxrzcyqlblb","Pickup soccer at Terman Park",1343958668000,1344473100000,37.402584,-122.126038,"Terman Park","palo alto"
"55906302","Nice to meet you guys!",1331489118000,1354674600000,37.79969,-122.43779," Amici's East Coast Pizzeria","San Francisco"
"59490312","Flying Trapeze and Trampoline",1333692018000,1338662700000,37.810505,-122.302444,"1822 9th St","Oakland"
"80968432","A Day with John Schaub",1346864933000,1.354374e+12,32.760773,-97.056755,"Crown Plaza Suites","Arlington"
"qdhstcyrdbvb","Introduction to Maum Meditation",1334998588000,1361062800000,37.347363,-121.985229,"Maum Meditation San Jose","Santa Clara"
"68848752","Full Figure Friday Stars and Stripes",1339518670000,1341032400000,37.797058,-122.277794,"Kimball's Carnival","Oakland"
"qhzlddyrdbzb","Stroller Strides - Balboa Park/Pepper Grove Park TuTh",1342568995000,1361293200000,32.728672,-117.147675,"Balboa Park - Pepper Grove Playground","San Diego"
"89380482","Game Demo Night",1351719429000,1355194800000,37.787285,-122.398857,"WeWork Labs","San Francisco"
"85211282","Longsword Training",1349223832000,1352561400000,32.710526,-97.173637,"Sacred Grove of the Immortals","Arlington"
"63835952","Beach Fun at Ft. Funston",1336429242000,1.338741e+12,37.774929,-122.419418,"Fort Funston/Golden Gate National Recreation Area","San Francisco"
"84301592","Just drumming with others",1348715063000,1350183600000,37.899586,-122.302307,"Tatami Multi Arts","El Cerrito"
"79843062","Free Drop in Drumming in el Cerrito",1346208946000,1347766200000,37.899586,-122.302307,"Tatami Multi Arts","El Cerrito"
"64684122","St. George's Spirits-Hangar One Vodka Tasting",1336965211000,1339357500000,37.787552,-122.3097,"St. George Spirits","Alameda"
"70696082","Motivating Consumers to Pick Sustainable Brands",1340657115000,1342661400000,37.786861,-122.401054,"Energy Efficiency Funding Group","San Francisco"
"93599252","Start Up Party San Francisco December 2012",1354357373000,1354939200000,37.813686,-122.314713,"One Ferry Plaza","San Francisco"
"91814032","Startup Party San Francisco December 2012",1353181999000,1354939200000,37.813686,-122.314713,"One Ferry Plaza","San Francisco"
"93178832","Startup Party San Francisco December 2012",1354120161000,1354939200000,37.813686,-122.314713,"One Ferry Plaza","San Francisco"
"93650312","Startup Party San Francisco December 2012",1354397721000,1354939200000,37.813686,-122.314713,"One Ferry Plaza","San Francisco"
"93650872","Startup Party San Francisco December 2012",1354398155000,1354939200000,37.813686,-122.314713,"One Ferry Plaza","San Francisco"
"101736422","Berkeley Vegan Earth Day",1359354279000,1366498800000,37.869434,-122.266441,"The David Brower Center","Berkeley"
"65790812","15 day Hawaiian Princess Cruise",1337651721000,1352145600000,37.797676,-122.394341,"San Francisco Cruise Terminal, Fishermans Wharf","San Francisco"
"66487222","Let's go sailing out of Alameda",1338079018000,1339171200000,37.77787,-122.25782,"Fortman Marina","Alameda"
"94758402","GUADALUPE REGIONAL GROUP Executive Committee Meeting",1355110461000,1.355454e+12,37.353073,-121.936409,"South Bay Historical Railroad","Santa Clara"
"65604722","Camping and Rafting weekend  Kern river",1337547411000,1341021600000,35.754673,-118.425362,"Camp Three Campgrounds","Kernville"
"91496802","Watch worlds top comedian and ventriloquist Jeff dunham Live!",1352969754000,1364005800000,37.751553,-122.201569,"Oracle Arena","Oakland"
"18645161","Demo night - 5 min per app demos",1305598709000,1.338948e+12,37.776489,-122.40818,"Terroir","San Francisco"
"qgswxcyrdbgc","Attend a church service (arrive a little early 10:15 a.m., start time is 10:30)",1338706501000,1361729700000,37.324993,-121.846107,"New Beginnings Church - PCG","San Jose"
"39288392","Sing you Home by Jodi Picoult",1320012055000,1.340568e+12,32.710575,-97.386314,"The Tavern","Fort Worth"
"72804042","Tilden Park Night Hiking -2",1341962603000,1342402200000,37.90841,-122.264175,"Tilden park Environmental Education Center (EEC)","berkeley"
"73506152","Tilden Park Hiking -3",1342409307000,1.343592e+12,37.90841,-122.264175,"Tilden park Environmental Education Center (EEC)","berkeley"
"qthxscyqjbkb","The Bay Area Clojure User Group Early/SF Monthly Meetup",1326406251000,1339117200000,37.785629,-122.396393,"The Climate Corporation (alternate)","San Francisco"
"qwhxscyqlbdb","The Bay Area Clojure User Group Early/SF Monthly Meetup",1326406265000,1343955600000,37.785629,-122.396393,"The Climate Corporation (alternate)","San Francisco"
"75584112","Urban Hike/Lunch - San Francisco/Sausalito Loop",1343682605000,1.34712e+12,37.799404,-122.412361,"Crissy Field","San Francisco"
"qfjxbdyrcblb","Join English Vietnamese Toastmaster meeting. Snacks provided!",1340839666000,1357699500000,37.395535,-121.917313,"Cadence Design Systems Inc. (Bldg 5)","San Jose"
"69502652","Bootcamp Series-Navigating Federal, State and Local Government ",1339902451000,1340305200000,37.795094,-122.396118,"Sheppard Mullin","San Francisco"
"69570022","Round Table discussion with Ionut Ancutescu journalist from Forbes Romania",1339962983000,1341968400000,37.789654,-122.401962,"Carroll, Burdick & McDonough","San Francisco"
"68636032","""Berkeley's Back Again"" Rehearsal",1339389032000,1339984800000,37.87471,-122.258385,"Marvell Nanofabrication Laboratory","Berkeley"
"85554092","Brazen Nitro Turkey 6.2/3.1/Kids run (100 yd)",1349391620000,1353603600000,37.988503,-122.352974,"Point Pinole Regional Shoreline","Pinole"
"97635782","The Shotgun Players Present - Woyzeck",1357190583000,1359172800000,37.85458,-122.270889,"Ashby Stage","Berkeley"
"98296812","See Alvin Ailey in Berkeley...",1357526979000,1367114400000,37.869244,-122.258575,"Cal Performances Zellerbach Hall","Berkeley"
"98297772","See Alvin Ailey in Berkeley...",1357527248000,1367114400000,37.869244,-122.258575,"Cal Performances Zellerbach Hall","Berkeley"
"qjtrbdyrcbmc","Plano Chapter Meetings: Cancelled this week January 29th.",1340640129000,1359482400000,33.017551,-96.709076,"BJ's Restaurant","Plano"
"71277432","as per the Rangers - This is full - so CANCELLED - EVENT PIER CRABBING -",1340981867000,1342285200000,37.803703,-122.468567,"Crissy Field - Fort Point Pier","San Francisco"
"71876492","Lodi's Treasure Island Wine Fest",1341365209000,1349548200000,37.807499,-122.363327,"Yerba Buena Island Treasure Island Rd","San Francisco"
"qhlqcdyrcbwb","Thursday training",1341679584000,1358474400000,32.834087,-97.179153,"Progressive Fighting Systems-DFW","Hurst"
"dsbfscyrfbsb","Rewards of Lending on Flips - Finding UGLY Houses for Profit",1333126109000,1363312800000,37.522903,-121.965141,"Wally Pond Community Center","Fremont"
"74538882","Show do Gilberto Gil no Paramount Theatre in Oakland",1343059390000,1351218600000,37.809704,-122.268219,"The Paramount Theatre","Oakland"
"75222812","Day at the Races! Golden Gate Fields",1343435697000,1.345401e+12,37.873669,-122.28241,"Golden Gate Fields","Berkeley"
"75360512","Tour/Taste/Picnic-St. George Spirits Artisan Distillers",1343543471000,1347742800000,37.787552,-122.3097,"ST. GEORGE SPIRITS  ","Alameda"
"75742462","Sunset Party Sailboat (NO Experience Required)",1343771839000,1344562200000,37.870159,-122.316956,"Berkeley Marina","Berkeley"
"dnvsfdyrdbkb","The Bay Area Clojure User Group Early/SF Monthly Meetup",1343975462000,1360288800000,37.785049,-122.399818,"The Climate Corporation (new)","San Francisco"
"dnvsfdyrfbkb","The Bay Area Clojure User Group Early/SF Monthly Meetup",1343975462000,1.362708e+12,37.785049,-122.399818,"The Climate Corporation (new)","San Francisco"
"dnvsfdyrcbfb","The Bay Area Clojure User Group Early/SF Monthly Meetup",1353120089000,1357264800000,37.785049,-122.399818,"The Climate Corporation (new)","San Francisco"
"76252632","Berkeley Juggling Festival (Aug 17-19)",1344039897000,1345309200000,37.869015,-122.270752,"Berkeley High School","Berkeley"
"70762092","Game Event evening with Perfect World, Cryptic and Kabam at Google SF",1340683627000,1346290200000,37.789761,-122.390175,"Google Inc.","San Francisco"
"77439732","Saturday Core Standards Seminar with Harold Asturias",1344798471000,1349542800000,37.87933,-122.246338,"Lawrence Hall of Science","Berkeley"
"90092762","The Mathematics Behind Math Midway!",1352145887000,1352858400000,37.87933,-122.246338,"Lawrence Hall of Science","Berkeley"
"90093522","Math Midway meets the Amazing Race!!",1352146147000,1354674600000,37.87933,-122.246338,"Lawrence Hall of Science","Berkeley"
"77819922","Growth Hacks Conference by H/F University, San Francisco",1345009989000,1.348938e+12,37.79808,-122.404427,"Broadway Studios","San Fransico"
"79865932","Mobile H/F Presents - The iPhone 5: What It Means for Us, San Francisco",1346221117000,1347501600000,37.79808,-122.404427,"Broadway Studios","San Fransico"
"78720232","Heading to SF for Museum Day!",1345572110000,1358103600000,37.808159,-122.415382,"Ripley's Believe It Or Not","San Francisco"
"80062512","BELLYDANCE DAY WORKSHOP & SHOW",1346331942000,1346518800000,37.809364,-122.249992,"Shabnam","Oakland"
"80863082","From Fire-Scarred Wreck to Gorgeous Craftsman: the Story",1346803500000,1348527600000,37.834846,-122.27224,"Renovated Wonder of a house","Oakland"
"80988682","Let's go to the Edible Schoolyard Berkely",1346871121000,1351785600000,37.88195,-122.276375,"The Edible Schoolyard Berkeley","Berkeley"
"81081262","Indie Game Awards at CODAME ART+TECH Festival",1346901485000,1351393200000,37.777798,-122.409096,"Location details given upon registration on official CODAME site","San Francisco"
"81203422","StartupLive & Data 2.0 Data Lightning Pitch Event at DataWeek",1346969451000,1348779600000,37.78685,-122.401077,"SPUR Urban Center","San Francisco"
"104221702","China Series Going Private  (Alliance Event)",1360647726000,1361930400000,37.791283,-122.398605,"Morrison & Foerster LLP","San Francisco"
"81653472","Community Potluck and Skin Health Lecture with Dr T - Free Skin Evaluations",1347241134000,1.347759e+12,37.870132,-122.288383,"Finnish Brotherhood Hall","Berkeley"
"81680112","Richard Dawkins -- The Magic of Reality",1347255216000,1.350009e+12,37.866692,-122.26133,"First Congregational Church of Berkeley","Berkeley"
"81746942","Lucky Strike SF",1347300188000,1351994400000,37.778107,-122.392281,"Lucky Strike San Francisco","San Francisco"
"100714172","HTML5 Developer Conference - April 1-3, 2013",1358804646000,1364824800000,37.788216,-122.401642,"Palace Hotel San Francisco","San Francisco"
"95956422","HTML5DevConf Call for Speakers Deadline, Presale Ticket Info",1355959323000,1.359648e+12,37.788216,-122.401642,"Palace Hotel San Francisco","San Francisco"
"82155892","Causal inference short course by Harvard Prof. Don Rubin",1347500750000,1350658800000,37.871052,-122.259079,"Maude Fife Room (315 Wheeler Hall) of English Department at UC Berkeley","Berkeley"
"dxmvhdyqmbcc","Sound Energy Healing Through Beatbox Prana-Yoga",1347765395000,1.348452e+12,37.860466,-122.255836,"Willard Park","Berkeley"
"86103662","Hackers / Founders -  East Bay",1349733262000,1351645200000,37.808609,-122.269531,"The Uptown","Oakland"
"82910702","Hackers & Founders -  East Bay",1347947112000,1348621200000,37.808609,-122.269531,"The Uptown","Oakland"
"97767682","Hackers / Founders -  East Bay",1357256559000,1359511200000,37.808609,-122.269531,"The Uptown","Oakland"
"83125592","Let's go cause a RUCKUS - CD Recording - Dancing - Dinner (optional)",1348072995000,1352606400000,37.775951,-122.252296," Rooster's Roadhouse."," Alameda"
"83346202","Goapele at Yoshi's Oakland",1348179647000,1353205800000,37.795929,-122.278297,"Yoshi's Oakland","Oakland"
"91182102","Ugly Holiday Sweater Contest & Wine Tasting at Donkey and Goat in Berkeley",1352793391000,1356141600000,37.878166,-122.302391,"A Donkey & Goat Winery","Berkeley"
"101048992","Looking for Artists to Feature",1358974540000,1360983600000,37.797909,-122.404762,"Atmosphere 3","San Francisco"
"85038302","Corona Developer Workshop",1349137207000,1350005400000,37.796265,-122.403435,"Comfy Chair","San Francisco"
"85613802","8 PLUS DIVAS CLOTHING SWAP",1349412975000,1352604600000,37.796677,-122.276176,"Buttercup Grill","Oakland"
"94487742","FREE - Holiday (Dance-Socialize) Party in SF... RSVP is required.",1354907728000,1356145200000,37.786758,-122.400429,"Alibi Restaurant and Lounge","San Francisco"
"95009642","FREE - Holiday (Dance-Socialize) Party in SF... RSVP is required.",1355273961000,1.356147e+12,37.786758,-122.400429,"Alibi Restaurant and Lounge","San Francisco"
"86134012","Cancelled - Drum circle at Sunday Streets event in Berkeley",1349745066000,1350248400000,37.872093,-122.268379,"Downtown","Berkeley"
"86707932","The Future of Data: We Depend on You! - Mike Olson, CEO, Cloudera",1350065400000,1352253600000,37.871761,-122.258232,"UC Berkeley School of Information","Berkeley"
"80268902","Typesafe Slick at Ticketfly in San Francisco",1346436888000,1.350351e+12,37.783009,-122.392601,"Ticketfly","Palo Alto"
"93638332","Let's meet up for wine tasting at the Four Seasons in SF!",1354390056000,1355974200000,37.786621,-122.404366,"Blu Restaurant","San Francisco"
"86466772","Meet the Catalysts - SF",1349921131000,1352503800000,37.78878,-122.403839,"ING DIRECT Cafe","San Francisco"
"89064562","Havdalah & Casual Potluck Dinner Party on Saturday, Nov 10",1351535573000,1352604600000,37.804363,-122.271111,"Private home in the Oakland hills","Oakland"
"90095502","Family Mathematics Festival !!",1352146618000,1353117600000,37.871716,-122.260353,"Thousand Oaks Elementary School","Berkeley"
"90171812","Open Heart Safari to Zambia - A Preview",1352177740000,1352674800000,37.798809,-122.258636,"Lakeshore Apts.","Oakland"
"90241292","Lower Maxwell Park Marvelous",1352229262000,1353369600000,37.778378,-122.209122,"Beautiful Newly-Renovated Home","Oakland"
"104279152","WebRTC March Meetup",1360692932000,1362709800000,37.783031,-122.39344,"Jive Software SF","San Francisco"
"90385262","November WebRTC Meetup",1352313803000,1354242600000,37.783031,-122.39344,"Jive Software SF","San Francisco"
"90594382","East Bay New Year's Eve Blast at Oakland Marriott hotel and Convention Center",1352420262000,1357014600000,37.802204,-122.272896,"Oakland Marriott City Center","Oakland"
"93587352","Singles Party on New Year's Eve",1354337713000,1357009200000,37.802204,-122.272896,"Oakland Marriott City Center","Oakland"
"90834362","An Iliad at Berkeley Rep",1352576772000,1353124800000,37.871296,-122.269318,"Berkeley Repertory Theatre","Berkeley"
"91494102","Berkeley China Forum 2012 - China in Transition (Alliance event)",1352963849000,1353259800000,37.869099,-122.259605,"Pauley Ballroom, MLK Jr. Student Union, UC-Berkeley","Berkeley"
"91808902","Meet up and shoot",1353178830000,1356733800000,37.832096,-122.244858,"Mountain View Cemetery","Oakland"
"92875552","World Hoop Day Bay Area Celebration 2012",1353952618000,1355086800000,37.833977,-122.279739,"Veteran's Memorial Building"," Emeryville"
"92684622","Linden: Learning Foundations",1353814377000,1.354752e+12,37.817478,-122.281281,"Home in the Process of Being Renovated","Oakland"
"93771132"," Hoilday Mixer at The Claremont Resort and Spa",1354482990000,1354843800000,37.85791,-122.241081,"Claremont Hotel Club and Spa","Berkeley"
"75066602","Effective Scala at 111 Minna Gallery",1343345889000,1.355193e+12,37.78746,-122.399445,"111 Minna Gallery","San Francisco"
"93035372","HackerX (Android) Developer Ticket (Free)",1354041840000,1.355454e+12,37.78968,-122.394394,"SKOUT","San Francisco"
"94120982","NFL Wife, Owning a Small Business, & The Look of Success: Lunch with Marie Green",1354679108000,1358537400000,37.785789,-122.410034,"Hilton San Francisco Union Square, Urban Legend Restaurant","San Francisco"
"98320622","Sophisticated Singles' Dance at the Country Club, Sat. Jan 19",1357538048000,1358654400000,37.984238,-122.350685,"Richmond Country Club","Richmond"
"96113462","UXPA Chapter Meeting: Putting Lean UX into Practice:",1356061508000,1362103200000,37.791378,-122.393715,"AnswerLab","San Francisco"
"96158212","EFactor Presents: The Ins and Outs of Entrepreneurship",1356111201000,1357871400000,37.788792,-122.395607,"The Orrick Building","San Francisco"
"96877142","Ferry Building/Farmers Market, Lunch and TCHO tour",1356738519000,1358620200000,37.94772,-122.344711,"Ferry Buildig","San Francisco"
